### ISSUE TITLE
Split brain occur due to which 2 nodes are showing up as Master for same VRRP instance

### ISSUE THREAD

**Issue by rajivginotra** [acassen/keepalived#2649]
**Describe the bug**
Split brain occur due to which 2 nodes are showing up as Master for same VRRP instance(.248).

There are 3 K8s nodes in the cluster IPv4 suffix .245 and .246 and .247 and we have the VRRP priority set in the same order(lower suffix has the higher priority). Now we have rebooted the .245 node and then once it come back we are seeing that both .245 and .246 are becoming the master.

When we have restarted the keepalived pods on 245 and 246 the problem went away so there is no evidence of network issue also. But 
**To Reproduce**
Reproduce the node which has the highest VRRP priority but its not coming always.

**Expected behavior**
Highest VRRP instance should takeover the mastership via forcing new election 

**Keepalived version**
```
Keepalived v2.2.4 (08/21,2021)
```

**Distro (please complete the following information):**
 - Name: Ubuntu
 - Version: 22.04.5 LTS
 - Architecture: x86_64

**Details of any containerisation or hosted service (e.g. AWS)**
Keepalived is running inside the container shared the host network

**Configuration file:**
```
Node => 10.89.102.245
=====================
vrrp_instance vip_10.89.102.248 {
  state BACKUP
  interface cluster
  virtual_router_id 101
  priority 250
  advert_int 1
  higher_prio_send_advert true

  track_interface {
    cluster
  }

  virtual_ipaddress {
    10.89.102.248 dev cluster scope global
  }

  unicast_src_ip 10.89.102.245
  unicast_peer {
    10.89.102.246
    10.89.102.247
    }

  track_script {
    node_health_check
  }

}


Node => 10.89.102.246
=====================
global_defs {
  vrrp_version 3
  enable_script_security
  script_user keepalived_script
  vrrp_garp_master_delay 40
  vrrp_garp_master_refresh 60
}

vrrp_script node_health_check {
  script       "/node_health_check.py"
  interval 60  # check every 60 seconds
  timeout 40   # Script Timeout of 40 seconds
  fall 3       # require 3 failures for FAULT Transition
  user root root
}


vrrp_instance vip_10.89.102.248 {
  state BACKUP
  interface cluster
  virtual_router_id 3
  priority 150
  advert_int 1
  higher_prio_send_advert true

  track_interface {
    cluster
  }

  virtual_ipaddress {
    10.89.102.248 dev cluster scope global
  }

  unicast_src_ip 10.89.102.246
  unicast_peer {
    10.89.102.245
    }

  track_script {
    node_health_check
  }
}


Node => 10.89.102.247
=====================
global_defs {
  vrrp_version 3
  enable_script_security
  script_user keepalived_script
  vrrp_garp_master_delay 40
  vrrp_garp_master_refresh 60
}

vrrp_script node_health_check {
  script       "/node_health_check.py"
  interval 60  # check every 60 seconds
  timeout 40   # Script Timeout of 40 seconds
  fall 3       # require 3 failures for FAULT Transition
  user root root
}


vrrp_instance vip_10.89.102.248 {
  state BACKUP
  interface cluster
  virtual_router_id 3
  priority 50
  advert_int 1
  higher_prio_send_advert true

  track_interface {
    cluster
  }

  virtual_ipaddress {
    10.89.102.248 dev cluster scope global
  }

  unicast_src_ip 10.89.102.247
  unicast_peer {
    10.89.102.245
    10.89.102.246
    }

  track_script {
    node_health_check
  }

[0_keep_246.log](https://github.com/user-attachments/files/21665319/0_keep_246.log)
[0_keep_247.log](https://github.com/user-attachments/files/21665320/0_keep_247.log)
[4_keep_245.log](https://github.com/user-attachments/files/21665318/4_keep_245.log)

}
```

**Notify and track scripts**
```
If any notify or track scripts are in use, please provide copies of them
```

**System Log entries**
```
Full keepalived system log entries from when keepalived started
```

**Did keepalived coredump?**
```
If so, can you please provide a stacktrace from the coredump, using gdb.
```

**Additional context**
One of the observations is that .246 is sending the packets to both .245 and .247 but didn;t receive any packets from .245 node which is trying to force the election after reboot

Clearly below tcpdump shows that .245 node is sending to .247 but not to .247
===========================================================
root@maglev-master-10-89-102-245:~# tcpdump -i cluster -n vrrp
tcpdump: verbose output suppressed, use -v[v]... for full protocol decode
listening on cluster, link-type EN10MB (Ethernet), snapshot length 262144 bytes
12:27:31.045080 IP 10.89.102.246 > 10.89.102.245: VRRPv3, Advertisement, vrid 3, prio 150, intvl 100cs, length 12
12:27:31.045395 IP 10.89.102.245 > 10.89.102.247: VRRPv3, Advertisement, vrid 3, prio 250, intvl 100cs, length 12
12:27:32.045280 IP 10.89.102.246 > 10.89.102.245: VRRPv3, Advertisement, vrid 3, prio 150, intvl 100cs, length 12
12:27:32.046205 IP 10.89.102.245 > 10.89.102.247: VRRPv3, Advertisement, vrid 3, prio 250, intvl 100cs, length 12
12:27:33.045735 IP 10.89.102.246 > 10.89.102.245: VRRPv3, Advertisement, vrid 3, prio 150, intvl 100cs, length 12
12:27:33.045936 IP 10.89.102.245 > 10.89.102.247: VRRPv3, Advertisement, vrid 3, prio 250, intvl 100cs, length 12

Tcpdump captures from .246 node 
===========================
root@maglev-master-10-89-102-246:~# tcpdump -i cluster -n vrrp
tcpdump: verbose output suppressed, use -v[v]... for full protocol decode
listening on cluster, link-type EN10MB (Ethernet), snapshot length 262144 bytes
12:35:35.183623 IP 10.89.102.246 > 10.89.102.245: VRRPv3, Advertisement, vrid 3, prio 150, intvl 100cs, length 12
12:35:35.183706 IP 10.89.102.246 > 10.89.102.247: VRRPv3, Advertisement, vrid 3, prio 150, intvl 100cs, length 12
12:35:36.183940 IP 10.89.102.246 > 10.89.102.245: VRRPv3, Advertisement, vrid 3, prio 150, intvl 100cs, length 12
12:35:36.184019 IP 10.89.102.246 > 10.89.102.247: VRRPv3, Advertisement, vrid 3, prio 150, intvl 100cs, length 12
12:35:37.184265 IP 10.89.102.246 > 10.89.102.245: VRRPv3, Advertisement, vrid 3, prio 150, intvl 100cs, length 12
12:35:37.184348 IP 10.89.102.246 > 10.89.102.247: VRRPv3, Advertisement, vrid 3, prio 150, intvl 100cs, length 12

Tcpdump captures from .247 node 
===========================
But when I have checked on .247 node, we are seeing the VRRP packets coming from both .245 and .246 node
root@maglev-master-10-89-102-247:~# tcpdump -i cluster -n vrrp
tcpdump: verbose output suppressed, use -v[v]... for full protocol decode
listening on cluster, link-type EN10MB (Ethernet), snapshot length 262144 bytes
12:26:53.033975 IP 10.89.102.246 > 10.89.102.247: VRRPv3, Advertisement, vrid 3, prio 150, intvl 100cs, length 12
12:26:53.034129 IP 10.89.102.245 > 10.89.102.247: VRRPv3, Advertisement, vrid 3, prio 250, intvl 100cs, length 12
12:26:54.034173 IP 10.89.102.246 > 10.89.102.247: VRRPv3, Advertisement, vrid 3, prio 150, intvl 100cs, length 12
12:26:54.034642 IP 10.89.102.245 > 10.89.102.247: VRRPv3, Advertisement, vrid 3, prio 250, intvl 100cs, length 12
12:26:55.034551 IP 10.89.102.246 > 10.89.102.247: VRRPv3, Advertisement, vrid 3, prio 150, intvl 100cs, length 12
12:26:55.034975 IP 10.89.102.245 > 10.89.102.247: VRRPv3, Advertisement, vrid 3, prio 250, intvl 100cs, length 12
12:26:56.034859 IP 10.89.102.246 > 10.89.102.247: VRRPv3, Advertisement, vrid 3, prio 150, intvl 100cs, length 12
12:26:56.035118 IP 10.89.102.245 > 10.89.102.247: VRRPv3, Advertisement, vrid 3, prio 250, intvl 100cs, length 12
12:26:57.035254 IP 10.89.102.246 > 10.89.102.247: VRRPv3, Advertisement, vrid 3, prio 150, intvl 100cs, length 12
12:26:57.035571 IP 10.89.102.245 > 10.89.102.247: VRRPv3, Advertisement, vrid 3, prio 250, intvl 100cs, length 12
12:26:58.035581 IP 10.89.102.246 > 10.89.102.247: VRRPv3, Advertisement, vrid 3, prio 150, intvl 100cs, length 12
12:26:58.035921 IP 10.89.102.245 > 10.89.102.247: VRRPv3, Advertisement, vrid 3, prio 250, intvl 100cs, length 12
