### ISSUE TITLE
vip has double traffic

### ISSUE THREAD

**Issue by Zhangyida183** [acassen/keepalived#2134]
**Describe the issue**
a server ping vip and tcpdump on master nic, it has double traffic.
[root@localhost] ping 172.16.1.77
PING 172.16.1.77 (172.16.1.77) 56(84) bytes of data.
64 bytes from 172.16.1.77: icmp_seq=1 ttl=64 time=0.335 ms
64 bytes from 172.16.1.77: icmp_seq=1 ttl=64 time=2.44 ms (DUP!)
64 bytes from 172.16.1.77: icmp_seq=2 ttl=64 time=0.185 ms
64 bytes from 172.16.1.77: icmp_seq=2 ttl=64 time=0.243 ms (DUP!)

**To Reproduce**
test server (172.16.1.98)
server1 (ens224: 172.16.1.101) ---> esxi enable promisc
server2 (ens256: 172.16.1.100) ---> esxi enable promisc
server1 (master) and server2 (backup) has vip 172.16.1.77
1. on server1, tcpdump -i ens224 -nn
2. on test server, ping 172.16.1.77 (vip)

**Expected behavior**
vip only has one set of traffic
[root@localhost] ping 172.16.1.77
PING 172.16.1.77 (172.16.1.77) 56(84) bytes of data.
64 bytes from 172.16.1.77: icmp_seq=1 ttl=64 time=0.335 ms
64 bytes from 172.16.1.77: icmp_seq=2 ttl=64 time=0.185 ms

**Keepalived version**
Keepalived v2.1.5 (07/13,2020)

**Distro (please complete the following information):**
 - Name [Centos8]

**Configuration file:**

 server1（ens224->172.16.1.101）:
global_defs {
	script_user root
	enable_script_security
}

vrrp_script check_msquic_server {
    script "/usr/bin/killall -0 quicsample"
    interval 1
    fall 1
    rise 1
}

vrrp_instance VI_1 {
    state BACKUP
    interface ens224
	use_vmac
	vmac_xmit_base

    track_script {
        check_msquic_server
    }

    virtual_router_id 7
    priority 150
    advert_int 1

    virtual_ipaddress {
        172.16.1.77
    }

	nopreempt
	accept
}

global_defs {
	script_user root
	enable_script_security
}

vrrp_script check_msquic_server {
    script "/usr/bin/killall -0 quicsample"
    interval 1
    fall 1
    rise 1
}

server2（ens256->172.16.1.100）:
vrrp_instance VI_2 {
    state BACKUP
    interface ens256
	use_vmac
	vmac_xmit_base

    track_script {
        check_msquic_server
    }

    virtual_router_id 7
    priority 100
    advert_int 1

    virtual_ipaddress {
        172.16.1.77
    }

	nopreempt
	accept
}

**tcpdump log**
16:15:52.040107 IP 172.16.1.101 > 224.0.0.18: VRRPv2, Advertisement, vrid 7, prio 150, authtype none, intvl 1s, length 20
16:15:53.040287 IP 172.16.1.101 > 224.0.0.18: VRRPv2, Advertisement, vrid 7, prio 150, authtype none, intvl 1s, length 20
16:15:53.698715 IP 172.16.1.98 > 172.16.1.77: ICMP echo request, id 36247, seq 1, length 64
16:15:53.698793 IP 172.16.1.77 > 172.16.1.98: ICMP echo reply, id 36247, seq 1, length 64
16:15:53.698823 IP 172.16.1.98 > 172.16.1.77: ICMP echo request, id 36247, seq 1, length 64
16:15:53.698836 IP 172.16.1.77 > 172.16.1.98: ICMP echo reply, id 36247, seq 1, length 64
16:15:54.040472 IP 172.16.1.101 > 224.0.0.18: VRRPv2, Advertisement, vrid 7, prio 150, authtype none, intvl 1s, length 20
16:15:54.700259 IP 172.16.1.98 > 172.16.1.77: ICMP echo request, id 36247, seq 2, length 64
16:15:54.700292 IP 172.16.1.77 > 172.16.1.98: ICMP echo reply, id 36247, seq 2, length 64
16:15:54.700363 IP 172.16.1.98 > 172.16.1.77: ICMP echo request, id 36247, seq 2, length 64
16:15:54.700372 IP 172.16.1.77 > 172.16.1.98: ICMP echo reply, id 36247, seq 2, length 64
......

**Comment by pqarmitage** [comment]
The tcpdump log above shows that each ICMP echo request is being received on server 1 twice (see the sequence numbers), and so server 1 is replying to each echo request that it receives. It is interesting to note that the VRRP advertisements are not being received twice. It would be worth running tcpdump on the test server to see if it is sending duplicate ICMP echo requests.

If my understanding is correct you are setting promiscuous mode on the ens224/ens256 interfaces. This should not be needed for keepalived and may cause some problems.

This does not appear to be a keepalived issue, but rather an issue with the setup of your servers/network.

**Comment by Zhangyida183** [comment]
> The tcpdump log above shows that each ICMP echo request is being received on server 1 twice (see the sequence numbers), and so server 1 is replying to each echo request that it receives. It is interesting to note that the VRRP advertisements are not being received twice. It would be worth running tcpdump on the test server to see if it is sending duplicate ICMP echo requests.
> 
> If my understanding is correct you are setting promiscuous mode on the ens224/ens256 interfaces. This should not be needed for keepalived and may cause some problems.
> 
> This does not appear to be a keepalived issue, but rather an issue with the setup of your servers/network.

I try to close promiscuous mode on the ens224/ens256 interfaces. Using test server to ping vip, only get arp cache, icmp is not produced. 
According to https://www.keepalived.org/manpage.html, option use_vmac on, it's macvlan. Should I turn it on promiscuous mode?

**Comment by pqarmitage** [comment]
There is no need to turn promiscuous mode on; in fact if anything it would cause problems rather than resolve them.

If your ARP cache is being updated, then there must be communications between the two systems, so you will need to investigate why ICMP messages are not working.

All keepalived does is add or remove the VIP addresses (and set up the VMAC interfaces it they are being used). It might be worth disabling use_vmac to see if you can get it working that way first.
