### ISSUE TITLE
Creating a VIP for VIP

### ISSUE THREAD

**Issue by newman0089** [acassen/keepalived#1367]
Hello!
Perhaps this is an obvious question, but how can I create a VIP?
I can simply specify any ip of my network, or should I somehow select it?
I'm trying to run keepalived on two nodes for fault tolerance. In the virtual_ipaddress directive, I indicated the ip invented by me, for example 192.168.0.10 for the network 192.168.0.0/24. But when I try to ping to this address, after saving the configuration and running keepalived, I get the following error:
 

> Destination Host Unreachable

My conf file:

```
vrrp_script chk_haproxy {
script "killall -0 haproxy"   # verify the pid existance
interval 2                    # check every 2 seconds
weight 2                      # add 2 points of prio if OK
}

vrrp_instance VI_1 {
interface ens3                # interface to monitor
state MASTER
virtual_router_id 100          # Assign one ID for this route
priority 50                  # 100 on master, 50 on backup

virtual_ipaddress {
192.168.0.10            # the virtual IP
}

track_script {
chk_haproxy
  }
}
```

Sorry for the stupid questions. I'm new to Linux

**Comment by pqarmitage** [comment]
@newman0089 Your keepalived configuration is fine. You problem is more likely to do with the configuration of your network; for example does the 192.168.0.0/24 network already exist? If not, no other system would know how to route to it.

**Comment by newman0089** [comment]
@pqarmitage 
Thanks for the answer!
Yes, the network exists. My two servers have IP 192.168.0.1 and 192.168.0.2.
Do I need to somehow reserve or allocate an ip address for balancing or is this done by keepalived?

**Comment by pqarmitage** [comment]
There is no need to reserve the address, keepalived will add it to the relevant interface when it is master.

When keepalived is running, execute `ip addr show ens3` on your two systems, and you should see that 192.168.0.10/32 is configured on ens3 on the keepalived master, and not on the backup.

It might be helpful if you posted the output of the keepalived logs, so that we could see the cause of any problems. For example, if haproxy is not running, then neither system will become master, and hence 192.168.0.10 will not be configured anywhere.

By the way, using `track_process` is much more efficient that a track script for detecting whether a process is running.

**Comment by newman0089** [comment]
@pqarmitage 
The master server has ip
192.168.0.1 and configuration:
```
vrrp_script chk_haproxy {
script "killall -0 haproxy"   # verify the pid existance
interval 2                    # check every 2 seconds
weight 2                      # add 2 points of prio if OK
}

vrrp_instance VI_1 {
interface ens3                # interface to monitor
state MASTER
virtual_router_id 100          # Assign one ID for this route
priority 100                  # 100 on master, 50 on backup

virtual_ipaddress {
192.168.0.10/24            # the virtual IP
}

track_script {
chk_haproxy
  }
}
```

I am running `systemctl restart keepalived`. Log after launch:

```
Aug 01 09:42:30 test_master Keepalived_vrrp[21203]: Registering Kernel netlink command channel
Aug 01 09:42:30 test_master Keepalived_vrrp[21203]: Registering gratuitous ARP shared channel
Aug 01 09:42:30 test_master Keepalived_vrrp[21203]: Opening file '/etc/keepalived/keepalived.conf'.
Aug 01 09:42:30 test_master Keepalived_vrrp[21203]: WARNING - default user 'keepalived_script' for script execution does not exist - please create.
Aug 01 09:42:30 test_master Keepalived_vrrp[21203]: WARNING - script `killall` resolved by path search to `/usr/bin/killall`. Please specify full path.
Aug 01 09:42:30 test_master Keepalived_vrrp[21203]: SECURITY VIOLATION - scripts are being executed but script_security not enabled.
Aug 01 09:42:30 test_master Keepalived_vrrp[21203]: Using LinkWatch kernel netlink reflector...
Aug 01 09:42:30 test_master Keepalived_vrrp[21203]: VRRP_Script(chk_haproxy) succeeded
Aug 01 09:42:31 test_master Keepalived_vrrp[21203]: VRRP_Instance(VI_1) Transition to MASTER STATE
Aug 01 09:42:31 test_master Keepalived_vrrp[21203]: VRRP_Instance(VI_1) Changing effective priority from 100 to 102
```

`ip addr show ens3` on the wizard shows:

```
2: ens3: <BROADCAST,MULTICAST,UP,LOWER_UP> mtu 1500 qdisc fq_codel state UP group default qlen 1000
    link/ether xx:xx:xx:xx:xx:xx brd xx:xx:xx:xx:xx:xx
    inet 192.168.0.1/24 brd xxxx.xx scope global dynamic ens3
       valid_lft 75241sec preferred_lft 75241sec
    inet 192.168.0.10/24 scope global secondary ens3
       valid_lft forever preferred_lft forever
    inet6 xx::xx:xxxx:xx/64 scope link
       valid_lft forever preferred_lft forever
```

But when I try to ping VIP from another machine, I get the following error:
`From 192.168.0.3 icmp_seq=1 Destination Host Unreachable`

Maybe I need to configure something else?


> By the way, using track_process is much more efficient that a track script for detecting whether a process is running.

My configuration should be? :

vrrp_sync_group VG1 {
group {
VI_1
   }
track_process {
chk_haproxy
   }
}
vrrp_script chk_haproxy {
script "killall -0 haproxy"   # verify the pid existance
interval 2                    # check every 2 seconds
weight 2                      # add 2 points of prio if OK
}

vrrp_instance VI_1 {
interface ens3                # interface to monitor
state MASTER
virtual_router_id 100          # Assign one ID for this route
priority 100                  # 100 on master, 50 on backup

virtual_ipaddress {
192.168.0.10/24            # the virtual IP
}

track_script {
chk_haproxy
  }
}

**Comment by newman0089** [comment]
@pqarmitage 
There is nothing unusual in the haproxy log:

I do not quite understand how keepalived interacts with haproxy? Using the script "killall -0 haproxy"?

Could there be a problem in the fact that my server is in the cloud infrastructure?

I hope for your advice on solving the problem.

**Comment by newman0089** [comment]
@pqarmitage
I found a few more clues.
I tried to run `"killall -0 haproxy"` manually and received this message:
`haproxy: no process found`

I decided to use this command as a script:
`/bin/pidof haproxy`
When executed manually, I get two pid's (This is also not clear to me. Why does the command return two pid's? I checked the file `/var/run/haproxy.pid `and saw only one pid in it). But when I add this command to keepalived.conf, after running keepalived I get a constant stream of errors:
```
Aug 01 14:27:23 test_master Keepalived_vrrp[25067]: SECURITY VIOLATION - scripts are being executed but script_security not enabled.
Aug 01 14:27:23 test_master Keepalived_vrrp[25067]: Using LinkWatch kernel netlink reflector...
Aug 01 14:27:23 test_master killall5[25072]: only one argument, a signal number, allowed
Aug 01 14:27:23 test_master Keepalived_vrrp[25067]: /sbin/killall5 haproxy exited with status 1
Aug 01 14:27:24 test_master Keepalived_vrrp[25067]: VRRP_Instance(VI_1) Transition to MASTER STATE
Aug 01 14:27:25 test_master Keepalived_vrrp[25067]: VRRP_Instance(VI_1) Entering MASTER STATE
Aug 01 14:27:25 test_master killall5[25077]: only one argument, a signal number, allowed
Aug 01 14:27:25 test_master Keepalived_vrrp[25067]: /sbin/killall5 haproxy exited with status 1
Aug 01 14:27:27 test_master Keepalived_vrrp[25067]: /sbin/killall5 haproxy exited with status 1
Aug 01 14:27:29 test_master Keepalived_vrrp[25067]: /sbin/killall5 haproxy exited with status 1
```

I am completely baffled. Could this be causing the virtual ip problem?
Am I having problems with haproxy, or is it something else?

Any ideas would be helpful.
Thank you very much!

My keepalived.conf is now:

```
vrrp_script chk_haproxy {
script "/bin/pidof haproxy"   # verify the pid existance
interval 2                    # check every 2 seconds
weight 2                      # add 2 points of prio if OK
}

vrrp_instance VI_1 {
interface ens3                # interface to monitor
state MASTER
virtual_router_id 100          # Assign one ID for this route
priority 100                  # 100 on master, 50 on backup

virtual_ipaddress {
192.168.0.10/24           # the virtual IP
}

track_script {
chk_haproxy
  }
}

```

**Comment by pqarmitage** [comment]
@newman0089 You don't want to use vrrp_sync_groups since you only have 1 vrrp instance, and sync groups group multiple vrrp instances so that either all or none of them are master.

I think it is probably sensible to leave aside the track_process until you have things working properly with 192.168.0.10.

I suggest what you do is:
- Stop keepalived on both systems
- Make sure that neither system has address 192.168.0.10 configured
- Start keepalived on both systems
- Check that the master keepalived has 192.168.0.10 configured on ens3, and the backup does not have 192.168.0.10 configured

If all the above is working, then keepalived is working properly, and any problems you have are more to do with your network configuration.

If 192.168.0.10 is configured on neither system, or on both systems, then post the full keepalived logs from both systems from when keepalived started. It would also be worth posting the output of `ip addr show` from both systems.

The checking for haproxy is not going to have a significant effect on getting this working - all it is doing is adjusting the priority of the vrrp instances by 2 (`weight 2`) depending on whether haproxy is running or not. You could even remove the `vrrp_script chk_haproxy` and the `track_script` blocks to simplify your configuration until you get it working.

**Comment by newman0089** [comment]
@pqarmitage 
> Stop keepalived on both systems

I stopped activity support on both systems and removed the vrrp_script chk_haproxy and track_script blocks. Logs from both systems:
Master:
```
Aug  1 15:57:06 test_master Keepalived[1903]: Stopping
Aug  1 15:57:06 test_master Keepalived_healthcheckers[1904]: Stopped
Aug  1 15:57:06 test_master Keepalived_vrrp[1905]: VRRP_Instance(VI_1) sent 0 priority
Aug  1 15:57:07 test_master Keepalived_vrrp[1905]: Stopped
Aug  1 15:57:07 test_master Keepalived[1903]: Stopped Keepalived v1.3.9 (10/21,2017)
Aug  1 15:57:07 test_master systemd[1]: Stopped Keepalive Daemon (LVS and VRRP).

```
Backup:
```
Aug  1 15:57:01 test_slave systemd[1]: Stopping Keepalive Daemon (LVS and VRRP)...
Aug  1 15:57:01 test_slave Keepalived[5492]: Stopping
Aug  1 15:57:01 test_slave Keepalived_healthcheckers[5493]: Stopped
Aug  1 15:57:01 test_slave Keepalived_vrrp[5494]: VRRP_Instance(VI_1) sent 0 priority
Aug  1 15:57:02 test_slave Keepalived_vrrp[5494]: Stopped
Aug  1 15:57:02 test_slave Keepalived[5492]: Stopped Keepalived v1.3.9 (10/21,2017)
Aug  1 15:57:02 test_slave systemd[1]: Stopped Keepalive Daemon (LVS and VRRP).
```

> Make sure that neither system has address 192.168.0.10 configured

After stopping, I checked that the address 192.168.0.10 is missing, everything is good:
Master:
```
admin@test_master$ ip addr show
1: lo: <LOOPBACK,UP,LOWER_UP> mtu 65536 qdisc noqueue state UNKNOWN group default qlen 1000
    link/loopback 00:00:00:00:00:00 brd 00:00:00:00:00:00
    inet 127.0.0.1/8 scope host lo
       valid_lft forever preferred_lft forever
    inet6 ::1/128 scope host
       valid_lft forever preferred_lft forever
2: ens3: <BROADCAST,MULTICAST,UP,LOWER_UP> mtu 1500 qdisc fq_codel state UP group default qlen 1000
    link/ether xx:xx:xx:xx:xx:xx brd ff:ff:ff:ff:ff:ff
    inet 192.168.0.1/24 brd 192.168.255.255 scope global dynamic ens3
       valid_lft 54044sec preferred_lft 54044sec
    inet6  xx:xx:xx:xx:xx:xx/64 scope link
       valid_lft forever preferred_lft forever
```
Backup:
```
admin@test_slave$ ip addr show
1: lo: <LOOPBACK,UP,LOWER_UP> mtu 65536 qdisc noqueue state UNKNOWN group default qlen 1000
    link/loopback 00:00:00:00:00:00 brd 00:00:00:00:00:00
    inet 127.0.0.1/8 scope host lo
       valid_lft forever preferred_lft forever
    inet6 ::1/128 scope host
       valid_lft forever preferred_lft forever
2: ens3: <BROADCAST,MULTICAST,UP,LOWER_UP> mtu 1500 qdisc fq_codel state UP group default qlen 1000
    link/ether xx:xx:xx:xx:xx:xx brd ff:ff:ff:ff:ff:ff
    inet 192.168.0.2/24 brd 192.168.255.255 scope global dynamic ens3
       valid_lft 54044sec preferred_lft 54044sec
    inet6  xx:xx:xx:xx:xx:xx/64 scope link
       valid_lft forever preferred_lft forever
```

> Start keepalived on both systems

I launched a keepalived on both systems. **For some reason, backup has become a master**. Logs at startup:
Master:
```
Aug  1 16:10:44 test_master systemd[1]: Starting Keepalive Daemon (LVS and VRRP)...
Aug  1 16:10:44 test_master Keepalived[3184]: Starting Keepalived v1.3.9 (10/21,2017)
Aug  1 16:10:44 test_master Keepalived[3184]: Opening file '/etc/keepalived/keepalived.conf'.
Aug  1 16:10:44 test_master systemd[1]: Started Keepalive Daemon (LVS and VRRP).
Aug  1 16:10:44 test_master Keepalived[3196]: Starting Healthcheck child process, pid=3197
Aug  1 16:10:44 test_master Keepalived[3196]: Starting VRRP child process, pid=3198
Aug  1 16:10:44 test_master Keepalived_vrrp[3198]: Registering Kernel netlink reflector
Aug  1 16:10:44 test_master Keepalived_vrrp[3198]: Registering Kernel netlink command channel
Aug  1 16:10:44 test_master Keepalived_vrrp[3198]: Registering gratuitous ARP shared channel
Aug  1 16:10:44 test_master Keepalived_vrrp[3198]: Opening file '/etc/keepalived/keepalived.conf'.
Aug  1 16:10:44 test_master Keepalived_healthcheckers[3197]: Opening file '/etc/keepalived/keepalived.conf'.
Aug  1 16:10:44 test_master Keepalived_vrrp[3198]: Using LinkWatch kernel netlink reflector...
Aug  1 16:10:45 test_master Keepalived_vrrp[3198]: VRRP_Instance(VI_1) Transition to MASTER STATE
Aug  1 16:10:46 test_master Keepalived_vrrp[3198]: VRRP_Instance(VI_1) Entering MASTER STATE
```
Backup:
```
Aug  1 16:18:58 test_slave systemd[1]: Starting Keepalive Daemon (LVS and VRRP)...
Aug  1 16:18:58 test_slave Keepalived[7007]: Starting Keepalived v1.3.9 (10/21,2017)
Aug  1 16:18:58 test_slave Keepalived[7007]: Opening file '/etc/keepalived/keepalived.conf'.
Aug  1 16:18:58 test_slave systemd[1]: Started Keepalive Daemon (LVS and VRRP).
Aug  1 16:18:58 test_slave Keepalived[7017]: Starting Healthcheck child process, pid=7018
Aug  1 16:18:58 test_slave Keepalived[7017]: Starting VRRP child process, pid=7019
Aug  1 16:18:58 test_slave Keepalived_healthcheckers[7018]: Opening file '/etc/keepalived/keepalived.conf'.
Aug  1 16:18:58 test_slave Keepalived_vrrp[7019]: Registering Kernel netlink reflector
Aug  1 16:18:58 test_slave Keepalived_vrrp[7019]: Registering Kernel netlink command channel
Aug  1 16:18:58 test_slave Keepalived_vrrp[7019]: Registering gratuitous ARP shared channel
Aug  1 16:18:58 test_slave Keepalived_vrrp[7019]: Opening file '/etc/keepalived/keepalived.conf'.
Aug  1 16:18:58 test_slave Keepalived_vrrp[7019]: Using LinkWatch kernel netlink reflector...
Aug  1 16:18:58 test_slave Keepalived_vrrp[7019]: VRRP_Instance(VI_1) Entering BACKUP STATE
Aug  1 16:19:02 test_slave Keepalived_vrrp[7019]: VRRP_Instance(VI_1) Transition to MASTER STATE
Aug  1 16:19:03 test_slave Keepalived_vrrp[7019]: VRRP_Instance(VI_1) Entering MASTER STATE
```

> Check that the master keepalived has 192.168.0.10 configured on ens3, and the backup does not have 192.168.0.10 configured

For some reason, backup has become a master. Now both systems are masters. When I run the ip addr show command, I see the VIP on both machines.
Master:
```
admin@test_master$ ip addr show
1: lo: <LOOPBACK,UP,LOWER_UP> mtu 65536 qdisc noqueue state UNKNOWN group default qlen 1000
    link/loopback 00:00:00:00:00:00 brd 00:00:00:00:00:00
    inet 127.0.0.1/8 scope host lo
       valid_lft forever preferred_lft forever
    inet6 ::1/128 scope host
       valid_lft forever preferred_lft forever
2: ens3: <BROADCAST,MULTICAST,UP,LOWER_UP> mtu 1500 qdisc fq_codel state UP group default qlen 1000
    link/ether xx:xx:xx:xx:xx:xx brd ff:ff:ff:ff:ff:ff
    inet 192.168.0.1/24 brd 192.168.255.255 scope global dynamic ens3
       valid_lft 54044sec preferred_lft 54044sec
    inet 192.168.0.10/24 scope global secondary ens3
       valid_lft forever preferred_lft forever
    inet6  xx:xx:xx:xx:xx:xx/64 scope link
       valid_lft forever preferred_lft forever
```
Backup:
```
admin@test_slave$ ip addr show
1: lo: <LOOPBACK,UP,LOWER_UP> mtu 65536 qdisc noqueue state UNKNOWN group default qlen 1000
    link/loopback 00:00:00:00:00:00 brd 00:00:00:00:00:00
    inet 127.0.0.1/8 scope host lo
       valid_lft forever preferred_lft forever
    inet6 ::1/128 scope host
       valid_lft forever preferred_lft forever
2: ens3: <BROADCAST,MULTICAST,UP,LOWER_UP> mtu 1500 qdisc fq_codel state UP group default qlen 1000
    link/ether xx:xx:xx:xx:xx:xx brd ff:ff:ff:ff:ff:ff
    inet 192.168.0.2/24 brd 192.168.255.255 scope global dynamic ens3
       valid_lft 54044sec preferred_lft 54044sec
    inet 192.168.0.10/24 scope global secondary ens3
       valid_lft forever preferred_lft forever
    inet6  xx:xx:xx:xx:xx:xx/64 scope link
       valid_lft forever preferred_lft forever
```

Maybe something is wrong with my configuration? Maybe he can’t check the status of the master?

Master:
```
vrrp_instance VI_1 {
interface ens3                # interface to monitor
state MASTER
virtual_router_id 100          # Assign one ID for this route
priority 100                  # 100 on master, 50 on backup

virtual_ipaddress {
192.168.0.10/24            # the virtual IP
}
}
```
Backup:
```
vrrp_instance VI_1 {
interface ens3                # interface to monitor
state BACKUP
virtual_router_id 100          # Assign one ID for this route
priority 50                  # 100 on master, 50 on backup

virtual_ipaddress {
192.168.0.10/24            # the virtual IP
}
}
```

**Comment by pqarmitage** [comment]
The problem looks to me to be the broadcast addresses configured for 192.168.0.1/24 and 192.168.0.2/24 since 192.168.255.255 lies outside the 192.168.0.x/24 subnet. The easiest way to configure broadcast addresses is using `brd +`, e.g. `ip addr add 192.168.0.1/24 brd + dev ens3`.

**Comment by pqarmitage** [comment]
BTW, the virtual_ipaddress should be configured without the `/24` - the subnet is already configured and you are just adding a single address within that subnet.

**Comment by newman0089** [comment]
Sorry to confuse you. Real subnet  /16 and ip - 173.23.0.1, 173.23.0.2, VIP - 173.23.0.100. I hope this has not been a big problem for you. I just tried to hide my IP.

> The easiest way to configure broadcast addresses is using brd +, e.g. ip addr add 192.168.0.1/24 brd + dev ens3.

I followed these steps, but the subnet mask did not change.

> BTW, the virtual_ipaddress should be configured without the /24 - the subnet is already configured and you are just adding a single address within that subnet.

I deleted /24 (/16). Now the output looks like this:

admin@test_master$ ip addr show
1: lo: <LOOPBACK,UP,LOWER_UP> mtu 65536 qdisc noqueue state UNKNOWN group default qlen 1000
    link/loopback 00:00:00:00:00:00 brd 00:00:00:00:00:00
    inet 127.0.0.1/8 scope host lo
       valid_lft forever preferred_lft forever
    inet6 ::1/128 scope host
       valid_lft forever preferred_lft forever
2: ens3: <BROADCAST,MULTICAST,UP,LOWER_UP> mtu 1500 qdisc fq_codel state UP group default qlen 1000
    link/ether xx:xx:xx:xx:xx:xx brd ff:ff:ff:ff:ff:ff
    inet 173.23.0.1/16 brd 173.23.255.255 scope global dynamic ens3
       valid_lft 54044sec preferred_lft 54044sec
    inet 173.23.0.100/32 scope global secondary ens3
       valid_lft forever preferred_lft forever
    inet6  xx:xx:xx:xx:xx:xx/64 scope link
       valid_lft forever preferred_lft forever

**Comment by pqarmitage** [comment]
Since test_master and test_backup are both going to master state, it means that they are not seeing each other's adverts. You could try running tcpdump on one system and see if it can see vrrp adverts coming from both systems, using the `-e` option can you are see adverts with different source MAC addresses. If you can't see the adverts from the other system, then you know that are being blocked somewhere before the reach the other system, if you can see the adverts then they are being blocked in the receiving system. Either way, iptables/nftables configuration could cause that. If the packets are not being received at the remote system, then it could also be something to do with the network in between. If you are running in containers, there can often be a problem with multicast traffic being passed. You could try using `unicast_src_ip` and `unicast_peer` to see if the multicasting is a problem.

The version of keepalived that you are using is very old. Although at the moment there is no indication that that is causing a problem, it would be worth upgrading to a recent version, e.g v2.0.18.

At the moment, and since you are using such a simple configuration which I have confirmed works, this does not look like a keepalived problem, but more likely a problem of traffic being blocked somewhere between your two systems.

**Comment by newman0089** [comment]
@pqarmitage 
Sorry for the possibly obvious questions, but I'm just starting with Linux. And thank you so much for the help!

Not sure if the packages are blocked because these two nodes are in the etcd cluster. And with the fall of any of them, re-elections occur without problems.

My servers are in the cloud infrastructure. In it, you can create a network, for example 173.23.0.0/16, and when you create a server, it is automatically assigned ip from this network. Could the problem be in that?

I tried using` tcpdump -e`, but I got only this output:

```
10:34:17.886862 0a:01:e2:51:76:32 (oui Unknown) >d0:fe:00:00:78:94 (oui Unknown), ethertype IPv4 (0x0800), length 118: etcd1.ssh > 194.29.34.29.52172: Flags [P.], seq 1971040:1971104, ack 961, win 1452, length 64
10:34:17.886906 0a:01:e2:51:76:32 (oui Unknown) > d0:fe:00:00:78:94 (oui Unknown), ethertype IPv4 (0x0800), length 134: etcd1.ssh > 194.29.34.29.52172: Flags [P.], seq 1971104:1971184, ack 961, win 1452, length 80
10:34:17.886951 0a:01:e2:51:76:32 (oui Unknown) > d0:fe:00:00:78:94 (oui Unknown), ethertype IPv4 (0x0800), length 118: etcd1.ssh > 194.29.34.29.52172: Flags [P.], seq 1971184:1971248, ack 961, win 1452, length 64
10:34:17.886992 0a:01:e2:51:76:32 (oui Unknown) > d0:fe:00:00:78:94 (oui Unknown), ethertype IPv4 (0x0800), length 134: etcd1.ssh > 194.29.34.29.52172: Flags [P.], seq 1971248:1971328, ack 961, win 1452, length 80
10:34:17.887031 0a:01:e2:51:76:32 (oui Unknown) >d0:fe:00:00:78:94 (oui Unknown), ethertype IPv4 (0x0800), length 118: etcd1.ssh > 194.29.34.29.52172: Flags [P.], seq 1971328:1971392, ack 961, win 1452, length 64
10:34:17.887071 0a:01:e2:51:76:32 (oui Unknown) > d0:fe:00:00:78:94 (oui Unknown), ethertype IPv4 (0x0800), length 118: etcd1.ssh > 194.29.34.29.52172: Flags [P.], seq 1971392:1971456, ack 961, win 1452, length 64
>10:34:17.887110 0a:01:e2:51:76:32 (oui Unknown) >d0:fe:00:00:78:94 (oui Unknown), ethertype IPv4 (0x0800), length 118: etcd1.ssh > 194.29.34.29.52172: Flags [P.], seq 1971456:1971520, ack 961, win 1452, length 64
10:34:17.887148 0a:01:e2:51:76:32 (oui Unknown) > d0:fe:00:00:78:94 (oui Unknown), ethertype IPv4 (0x0800), length 118: etcd1.ssh > 194.29.34.29.52172: Flags [P.], seq 1971520:1971584, ack 961, win 1452, length 64
 10:34:17.887170 d0:fe:00:00:67:84 (oui Unknown) > 0a:01:e2:51:68:41 (oui Unknown), ethertype IPv4 (0x0800), length 54: 194.29.34.29.52172 > etcd1.ssh: Flags [.], ack 1966960, win 38, length 0
 10:34:17.887206 0a:01:e2:51:76:32 (oui Unknown) >d0:fe:00:00:78:94 (oui Unknown), ethertype IPv4 (0x0800), length 118: etcd1.ssh > 194.29.34.29.52172: Flags [P.], seq 1971584:1971648, ack 961, win 1452, length 64
10:34:17.887250 0a:01:e2:51:76:32 (oui Unknown) > d0:fe:00:00:78:94 (oui Unknown), ethertype IPv4 (0x0800), length 134: etcd1.ssh > 194.29.34.29.52172: Flags [P.], seq 1971648:1971728, ack 961, win 1452, length 80
 10:34:17.887257 d0:fe:00:00:67:84 (oui Unknown) > 0a:01:e2:51:68:41 (oui Unknown), ethertype IPv4 (0x0800), length 54: 194.29.34.29.52172 > etcd1.ssh: Flags [.], ack 1967552, win 36, length 0
 10:34:17.887305 0a:01:e2:51:76:32 (oui Unknown) > d0:fe:00:00:78:94 (oui Unknown), ethertype IPv4 (0x0800), length 118: etcd1.ssh > 194.29.34.29.52172: Flags [P.], seq 1971728:1971792, ack 961, win 1452, length 64
 10:34:17.8873390a:01:e2:51:76:32 (oui Unknown) > 0a:01:e2:51:68:41 (oui Unknown), ethertype IPv4 (0x0800), length 54: 194.29.34.29.52172 > etcd1.ssh: Flags [.], ack 1967744, win 35, length 0
 10:34:17.887372 00a:01:e2:51:76:32(oui Unknown) > d0:fe:00:00:27:84 (oui Unknown), ethertype IPv4 (0x0800), length 134: etcd1.ssh > 194.29.34.29.52172: Flags [P.], seq 1971792:1971872, ack 961, win 1452, length 80
 10:34:17.887379 0a:01:e2:51:76:32 (oui Unknown) > 0a:01:e2:51:68:41 (oui Unknown), ethertype IPv4 (0x0800), length 102: 194.29.34.29.52172> etcd1.ssh: Flags [P.], seq 961:1009, ack 1967744, win 35, length 48
 10:34:17.887433 0a:01:e2:51:76:32 (oui Unknown) > d0:fe:00:00:78:94 (oui Unknown), ethertype IPv4 (0x0800), length 134: etcd1.ssh > 194.29.34.29.52172: Flags [P.], seq 1971872:1971952, ack 1009, win 1452, length 80
```
I am not strong in networks, if I did something wrong, tell me please.

I also tried updating keepalive but ran into problems. My OS is Ubuntu 18.04. To update i used:

1. apt update
2. apt install keepalived

But the only version that he can install is 1.3.9. Then I tried to upgrade as follows:

1. sudo apt-get install curl gcc libssl-dev libnl-3-dev libnl-genl-3-dev libsnmp-dev
2. wget http://keepalived.org/software/keepalived-2.0.18.tar.gz
3. tar -xvf keepalived-2.0.18.tar.gz
4. cd keepalived-2.0.18
5. ./configure
6. make
7. sudo apt install make

But I can not start keepalived due to an error:

> Failed to start keepalived.service: Unit keepalived.service not found.

**Comment by pqarmitage** [comment]
@newman0089 I'll answer you apt issues first:
`apt update` only downloads package information. To actually upgrade packages you want to execute`apt-dist-upgrade` after the `apt update`.

It looks like you have successfully built v2.0.18 of keepalived, and the executable will be keepalived-2.0.18/keepalived/keepalived. You can directly execute it from there, with the appropriate command line options. `sudo apt install make` is attempting to install make, but you presumably already have that installed since you ran it at step 6.

Since you are using Ubuntu, it might be simpler to use the snapped version of keepalived, and the stable version is currently v2.0.18. The edge version is automatically built when keepalived is updated on github.

**Comment by newman0089** [comment]
@pqarmitage 
Thanks, then I will use 1.3.9 until the update.

Are there any new ideas about my problem?

Thanks!

**Comment by pqarmitage** [comment]
Can you try tcpdump with the following flags:
`tcpdump -n -nn -v -e -i ens3`
so that we can see a decode of the messages.

**Comment by newman0089** [comment]
Hello!
Here is a part of the log from Master:

```
    173.23.0.1 > 196.29.34.49.52359: Flags [P.], cksum 0x86f8 (incorrect -> 0x4b52), seq 19917728:19917808, ack 11345, win 418, length 80
10:02:36.047785 0a:01:d5:d8:c4:c1 > d0:fe:00:00:67:84, ethertype IPv4 (0x0800), length 134: (tos 0x10, ttl 64, id 12522, offset 0, flags [DF], proto TCP (6), length 120)
    173.23.0.1 > 196.29.34.49.52359: Flags [P.], cksum 0x86f8 (incorrect -> 0xe41d), seq 19917808:19917888, ack 11345, win 418, length 80
10:02:36.047811 0a:01:d5:d8:c4:c1 > d0:fe:00:00:67:84, ethertype IPv4 (0x0800), length 134: (tos 0x10, ttl 64, id 12523, offset 0, flags [DF], proto TCP (6), length 120)
    173.23.0.1 > 196.29.34.49.52359: Flags [P.], cksum 0x86f8 (incorrect -> 0x5d18), seq 19917888:19917968, ack 11345, win 418, length 80
10:02:36.047843 0a:01:d5:d8:c4:c1 > d0:fe:00:00:67:84, ethertype IPv4 (0x0800), length 134: (tos 0x10, ttl 64, id 12524, offset 0, flags [DF], proto TCP (6), length 120)
    173.23.0.1 > 196.29.34.49.52359: Flags [P.], cksum 0x86f8 (incorrect -> 0xf35c), seq 19917968:19918048, ack 11345, win 418, length 80
10:02:36.047864 0a:01:d5:d8:c4:c1 > d0:fe:00:00:67:84, ethertype IPv4 (0x0800), length 118: (tos 0x10, ttl 64, id 12525, offset 0, flags [DF], proto TCP (6), length 104)
    173.23.0.1 > 196.29.34.49.52359: Flags [P.], cksum 0x86e8 (incorrect -> 0x0e3d), seq 19918048:19918112, ack 11345, win 418, length 64
10:02:36.047890 0a:01:d5:d8:c4:c1 > d0:fe:00:00:67:84, ethertype IPv4 (0x0800), length 134: (tos 0x10, ttl 64, id 12526, offset 0, flags [DF], proto TCP (6), length 120)
    173.23.0.1 > 196.29.34.49.52359: Flags [P.], cksum 0x86f8 (incorrect -> 0x2bc3), seq 19918112:19918192, ack 11345, win 418, length 80
10:02:36.047921 0a:01:d5:d8:c4:c1 > d0:fe:00:00:67:84, ethertype IPv4 (0x0800), length 150: (tos 0x10, ttl 64, id 12527, offset 0, flags [DF], proto TCP (6), length 136)
    173.23.0.1 > 196.29.34.49.52359: Flags [P.], cksum 0x8708 (incorrect -> 0x9b19), seq 19918192:19918288, ack 11345, win 418, length 96
10:02:36.048607 d0:ae:00:00:57:94 > 0a:01:d5:d8:c4:c1, ethertype IPv4 (0x0800), length 54: (tos 0x0, ttl 119, id 15772, offset 0, flags [DF], proto TCP (6), length 40)
    196.29.34.49.52359> 173.23.0.1: Flags [.], cksum 0xd367 (correct), ack 19912592, win 22, length 0
10:02:36.048607 d0:ae:00:00:57:94 > 0a:01:d5:d8:c4:c1, ethertype IPv4 (0x0800), length 54: (tos 0x0, ttl 120, id 15773, offset 0, flags [DF], proto TCP (6), length 40)
    196.29.34.49.52359> 173.23.0.1: Flags [.], cksum 0xd02a (correct), ack 19913424, win 19, length 0
10:02:36.048607 d0:ae:00:00:57:94 > 0a:01:d5:d8:c4:c1, ethertype IPv4 (0x0800), length 54: (tos 0x0, ttl 120, id 15774, offset 0, flags [DF], proto TCP (6), length 40)
    196.29.34.49.52359> 173.23.0.1: Flags [.], cksum 0xcd2d (correct), ack 19914192, win 16, length 0
10:02:36.048607 d0:ae:00:00:57:94 > 0a:01:d5:d8:c4:c1, ethertype IPv4 (0x0800), length 54: (tos 0x0, ttl 120, id 15775, offset 0, flags [DF], proto TCP (6), length 40)
    196.29.34.49.52359> 173.23.0.1: Flags [.], cksum 0xc9f0 (correct), ack 19915024, win 13, length 0
10:02:36.048607 d0:ae:00:00:57:94 > 0a:01:d5:d8:c4:c1, ethertype IPv4 (0x0800), length 54: (tos 0x0, ttl 119, id 15776, offset 0, flags [DF], proto TCP (6), length 40)
    196.29.34.49.52359> 173.23.0.1: Flags [.], cksum 0xc6d3 (correct), ack 19915824, win 10, length 0
10:02:36.048607 d0:ae:00:00:57:94 > 0a:01:d5:d8:c4:c1, ethertype IPv4 (0x0800), length 54: (tos 0x0, ttl 119, id 15777, offset 0, flags [DF], proto TCP (6), length 40)
    196.29.34.49.52359> 173.23.0.1: Flags [.], cksum 0xc387 (correct), ack 19916672, win 6, length 0
10:02:36.048942 d0:ae:00:00:57:94 > 0a:01:d5:d8:c4:c1, ethertype IPv4 (0x0800), length 54: (tos 0x0, ttl 119, id 15778, offset 0, flags [DF], proto TCP (6), length 40)
    196.29.34.49.52359> 173.23.0.1: Flags [.], cksum 0xc06a (correct), ack 19917472, win 3, length 0
10:02:36.049174 d0:ae:00:00:57:94 > 0a:01:d5:d8:c4:c1, ethertype IPv4 (0x0800), length 54: (tos 0x0, ttl 119, id 15779, offset 0, flags [DF], proto TCP (6), length 40)
    196.29.34.49.52359> 173.23.0.1: Flags [.], cksum 0xbd3d (correct), ack 19918288, win 0, length 0
10:02:36.052096 d0:ae:00:00:57:94 > 0a:01:d5:d8:c4:c1, ethertype IPv4 (0x0800), length 102: (tos 0x0, ttl 119, id 15780, offset 0, flags [DF], proto TCP (6), length 88)
    196.29.34.49.52359> 173.23.0.1: Flags [P.], cksum 0xbeed (correct), seq 11345:11393, ack 19918288, win 0, length 48
```

**Comment by pqarmitage** [comment]
The network traffic you have shown above covers a period of less that 5 milli-seconds. Since VRRP adverts (with your configuration) are only sent every 1 second, if is not surprising that there is no VRRP traffic in the dump, and it is ithe VRRP traffic that we are looking to see.

You will need to run the tcpdump over several seconds, and if the rate of traffic is as your dump above shows you will need to apply some filtering. It is probably best to filter on the VRRP protocol, which is protocol number 112.

**Comment by newman0089** [comment]
@pqarmitage 
Hi!:
I used the  `sudo tcpdump -n -nn -v -e -i ens3  proto \\vrrp` command and got the following output:
Master:
```
admin@test_master:~$ sudo tcpdump -n -nn -v -e -i ens3  proto \\vrrp
tcpdump: listening on ens3, link-type EN10MB (Ethernet), capture size 262144 bytes
13:59:56.984195 xx:xx:xx:xx:xx > xx:xx:xe:xx:xx:x, ethertype IPv4 (0x0800), length 54: (tos 0xc0, ttl 255, id 146, offset 0, flags [none], proto VRRP (112), length 40)
    173.23.0.1 > 224.0.0.18: vrrp 172.31.0.47 > 224.0.0.18: VRRPv2, Advertisement, vrid 100, prio 100, authtype none, intvl 1s, length 20, addrs: 173.23.0.100
13:59:57.985301 xx:xx:xx:xx:xx > xx:xx:xe:xx:xx:x, ethertype IPv4 (0x0800), length 54: (tos 0xc0, ttl 255, id 146, offset 0, flags [none], proto VRRP (112), length 40)
    173.23.0.1 > 224.0.0.18: vrrp 172.31.0.47 > 224.0.0.18: VRRPv2, Advertisement, vrid 100, prio 100, authtype none, intvl 1s, length 20, addrs: 173.23.0.100
13:59:58.986401 xx:xx:xx:xx:xx > xx:xx:xe:xx:xx:x, ethertype IPv4 (0x0800), length 54: (tos 0xc0, ttl 255, id 146, offset 0, flags [none], proto VRRP (112), length 40)
    173.23.0.1 > 224.0.0.18: vrrp 172.31.0.47 > 224.0.0.18: VRRPv2, Advertisement, vrid 100, prio 100, authtype none, intvl 1s, length 20, addrs: 173.23.0.100
13:59:59.987503 xx:xx:xx:xx:xx > xx:xx:xe:xx:xx:x, ethertype IPv4 (0x0800), length 54: (tos 0xc0, ttl 255, id 146, offset 0, flags [none], proto VRRP (112), length 40)
    173.23.0.1 > 224.0.0.18: vrrp 172.31.0.47 > 224.0.0.18: VRRPv2, Advertisement, vrid 100, prio 100, authtype none, intvl 1s, length 20, addrs: 173.23.0.100
14:00:00.988619 xx:xx:xx:xx:xx > xx:xx:xe:xx:xx:x, ethertype IPv4 (0x0800), length 54: (tos 0xc0, ttl 255, id 146, offset 0, flags [none], proto VRRP (112), length 40)
    173.23.0.1 > 224.0.0.18: vrrp 172.31.0.47 > 224.0.0.18: VRRPv2, Advertisement, vrid 100, prio 100, authtype none, intvl 1s, length 20, addrs: 173.23.0.100
14:00:01.989768 xx:xx:xx:xx:xx > xx:xx:xe:xx:xx:x, ethertype IPv4 (0x0800), length 54: (tos 0xc0, ttl 255, id 146, offset 0, flags [none], proto VRRP (112), length 40)
    173.23.0.1 > 224.0.0.18: vrrp 172.31.0.47 > 224.0.0.18: VRRPv2, Advertisement, vrid 100, prio 100, authtype none, intvl 1s, length 20, addrs: 173.23.0.100
14:00:02.990969 xx:xx:xx:xx:xx > xx:xx:xe:xx:xx:x, ethertype IPv4 (0x0800), length 54: (tos 0xc0, ttl 255, id 146, offset 0, flags [none], proto VRRP (112), length 40)
    173.23.0.1 > 224.0.0.18: vrrp 172.31.0.47 > 224.0.0.18: VRRPv2, Advertisement, vrid 100, prio 100, authtype none, intvl 1s, length 20, addrs: 173.23.0.100
14:00:03.992151 xx:xx:xx:xx:xx > xx:xx:xe:xx:xx:x, ethertype IPv4 (0x0800), length 54: (tos 0xc0, ttl 255, id 146, offset 0, flags [none], proto VRRP (112), length 40)
    173.23.0.1 > 224.0.0.18: vrrp 172.31.0.47 > 224.0.0.18: VRRPv2, Advertisement, vrid 100, prio 100, authtype none, intvl 1s, length 20, addrs: 173.23.0.100
14:00:04.993333 xx:xx:xx:xx:xx > xx:xx:xe:xx:xx:x, ethertype IPv4 (0x0800), length 54: (tos 0xc0, ttl 255, id 146, offset 0, flags [none], proto VRRP (112), length 40)
    173.23.0.1 > 224.0.0.18: vrrp 172.31.0.47 > 224.0.0.18: VRRPv2, Advertisement, vrid 100, prio 100, authtype none, intvl 1s, length 20, addrs: 173.23.0.100
14:00:05.994509 xx:xx:xx:xx:xx > xx:xx:xe:xx:xx:x, ethertype IPv4 (0x0800), length 54: (tos 0xc0, ttl 255, id 146, offset 0, flags [none], proto VRRP (112), length 40)
    173.23.0.1 > 224.0.0.18: vrrp 172.31.0.47 > 224.0.0.18: VRRPv2, Advertisement, vrid 100, prio 100, authtype none, intvl 1s, length 20, addrs: 173.23.0.100
14:00:06.995690 xx:xx:xx:xx:xx > xx:xx:xe:xx:xx:x, ethertype IPv4 (0x0800), length 54: (tos 0xc0, ttl 255, id 146, offset 0, flags [none], proto VRRP (112), length 40)
    173.23.0.1 > 224.0.0.18: vrrp 172.31.0.47 > 224.0.0.18: VRRPv2, Advertisement, vrid 100, prio 100, authtype none, intvl 1s, length 20, addrs: 173.23.0.100
14:00:07.996877 xx:xx:xx:xx:xx > xx:xx:xe:xx:xx:x, ethertype IPv4 (0x0800), length 54: (tos 0xc0, ttl 255, id 146, offset 0, flags [none], proto VRRP (112), length 40)
    173.23.0.1 > 224.0.0.18: vrrp 172.31.0.47 > 224.0.0.18: VRRPv2, Advertisement, vrid 100, prio 100, authtype none, intvl 1s, length 20, addrs: 173.23.0.100
14:00:08.998081 xx:xx:xx:xx:xx > xx:xx:xe:xx:xx:x, ethertype IPv4 (0x0800), length 54: (tos 0xc0, ttl 255, id 146, offset 0, flags [none], proto VRRP (112), length 40)
    173.23.0.1 > 224.0.0.18: vrrp 172.31.0.47 > 224.0.0.18: VRRPv2, Advertisement, vrid 100, prio 100, authtype none, intvl 1s, length 20, addrs: 173.23.0.100
14:00:09.998814 xx:xx:xx:xx:xx > xx:xx:xe:xx:xx:x, ethertype IPv4 (0x0800), length 54: (tos 0xc0, ttl 255, id 146, offset 0, flags [none], proto VRRP (112), length 40)
    173.23.0.1 > 224.0.0.18: vrrp 172.31.0.47 > 224.0.0.18: VRRPv2, Advertisement, vrid 100, prio 100, authtype none, intvl 1s, length 20, addrs: 173.23.0.100
^C
14 packets captured
14 packets received by filter
0 packets dropped by kernel
```

Slave:

```
admin@test_slave:~$  sudo tcpdump -n -nn -v -e -i ens3  proto \\vrrp
tcpdump: listening on ens3, link-type EN10MB (Ethernet), capture size 262144 bytes
14:00:32.948726 xx:xx:xx:xx:xx:xx > xx:xx:xx:xx:xx:xx, ethertype IPv4 (0x0800), length 54: (tos 0xc0, ttl 255, id 163, offset 0, flags [none], proto VRRP (112), length 40)
    173.23.0.2 > 224.0.0.18: vrrp 172.31.0.49 > 224.0.0.18: VRRPv2, Advertisement, vrid 100, prio 50, authtype none, intvl 1s, length 20, addrs: 173.23.0.100
14:00:33.950061 xx:xx:xx:xx:xx:xx > xx:xx:xx:xx:xx:xx, ethertype IPv4 (0x0800), length 54: (tos 0xc0, ttl 255, id 163, offset 0, flags [none], proto VRRP (112), length 40)
    173.23.0.2 > 224.0.0.18: vrrp 172.31.0.49 > 224.0.0.18: VRRPv2, Advertisement, vrid 100, prio 50, authtype none, intvl 1s, length 20, addrs: 173.23.0.100
14:00:34.951235 xx:xx:xx:xx:xx:xx > xx:xx:xx:xx:xx:xx, ethertype IPv4 (0x0800), length 54: (tos 0xc0, ttl 255, id 163, offset 0, flags [none], proto VRRP (112), length 40)
    173.23.0.2 > 224.0.0.18: vrrp 172.31.0.49 > 224.0.0.18: VRRPv2, Advertisement, vrid 100, prio 50, authtype none, intvl 1s, length 20, addrs: 173.23.0.100
14:00:35.952404 xx:xx:xx:xx:xx:xx > xx:xx:xx:xx:xx:xx, ethertype IPv4 (0x0800), length 54: (tos 0xc0, ttl 255, id 163, offset 0, flags [none], proto VRRP (112), length 40)
    173.23.0.2 > 224.0.0.18: vrrp 172.31.0.49 > 224.0.0.18: VRRPv2, Advertisement, vrid 100, prio 50, authtype none, intvl 1s, length 20, addrs: 173.23.0.100
14:00:36.953584 xx:xx:xx:xx:xx:xx > xx:xx:xx:xx:xx:xx, ethertype IPv4 (0x0800), length 54: (tos 0xc0, ttl 255, id 163, offset 0, flags [none], proto VRRP (112), length 40)
    173.23.0.2 > 224.0.0.18: vrrp 172.31.0.49 > 224.0.0.18: VRRPv2, Advertisement, vrid 100, prio 50, authtype none, intvl 1s, length 20, addrs: 173.23.0.100
14:00:37.954763 xx:xx:xx:xx:xx:xx > xx:xx:xx:xx:xx:xx, ethertype IPv4 (0x0800), length 54: (tos 0xc0, ttl 255, id 163, offset 0, flags [none], proto VRRP (112), length 40)
    173.23.0.2 > 224.0.0.18: vrrp 172.31.0.49 > 224.0.0.18: VRRPv2, Advertisement, vrid 100, prio 50, authtype none, intvl 1s, length 20, addrs: 173.23.0.100
14:00:38.955945 xx:xx:xx:xx:xx:xx > xx:xx:xx:xx:xx:xx, ethertype IPv4 (0x0800), length 54: (tos 0xc0, ttl 255, id 163, offset 0, flags [none], proto VRRP (112), length 40)
    173.23.0.2 > 224.0.0.18: vrrp 172.31.0.49 > 224.0.0.18: VRRPv2, Advertisement, vrid 100, prio 50, authtype none, intvl 1s, length 20, addrs: 173.23.0.100
14:00:39.957128 xx:xx:xx:xx:xx:xx > xx:xx:xx:xx:xx:xx, ethertype IPv4 (0x0800), length 54: (tos 0xc0, ttl 255, id 163, offset 0, flags [none], proto VRRP (112), length 40)
    173.23.0.2 > 224.0.0.18: vrrp 172.31.0.49 > 224.0.0.18: VRRPv2, Advertisement, vrid 100, prio 50, authtype none, intvl 1s, length 20, addrs: 173.23.0.100
14:00:40.958310 xx:xx:xx:xx:xx:xx > xx:xx:xx:xx:xx:xx, ethertype IPv4 (0x0800), length 54: (tos 0xc0, ttl 255, id 163, offset 0, flags [none], proto VRRP (112), length 40)
    173.23.0.2 > 224.0.0.18: vrrp 172.31.0.49 > 224.0.0.18: VRRPv2, Advertisement, vrid 100, prio 50, authtype none, intvl 1s, length 20, addrs: 173.23.0.100
14:00:41.959504 xx:xx:xx:xx:xx:xx > xx:xx:xx:xx:xx:xx, ethertype IPv4 (0x0800), length 54: (tos 0xc0, ttl 255, id 163, offset 0, flags [none], proto VRRP (112), length 40)
    173.23.0.2 > 224.0.0.18: vrrp 172.31.0.49 > 224.0.0.18: VRRPv2, Advertisement, vrid 100, prio 50, authtype none, intvl 1s, length 20, addrs: 173.23.0.100
^C
10 packets captured
10 packets received by filter
0 packets dropped by kernel
```

**Comment by newman0089** [comment]
@pqarmitage 
I tried to do it differently. I added unicast_src_ip and unicast_peer. My configuration files:
Master:
```
vrrp_instance VI_1 {
interface ens3                # interface to monitor
state MASTER
priority 100                  # 100 on master, 50 on backup

virtual_router_id 10          # Assign one ID for this route
unicast_src_ip 173.23.0.1
unicast_peer {
        173.23.0.2
}

virtual_ipaddress {
173.23.0.100            # the virtual IP
}
}
```
Backup:
```
vrrp_instance VI_1 {
interface ens3                # interface to monitor
state BACKUP
virtual_router_id 10          # Assign one ID for this route
priority 50                  # 100 on master, 50 on backup

unicast_src_ip 173.23.0.2
unicast_peer {
        173.23.0.1
}

virtual_ipaddress {
173.23.0.100            # the virtual IP
}
}
```

After that, the backup server began to become the main server only after the main server was turned off. The behavior is correct. But it turns out that the VIP is not compatible with these settings? In any case, the VIP does not respond drumming servers to the ping command.
Now vrrp packets go directly from server to server, and not through 224.0.0.18

**Comment by pqarmitage** [comment]
The tcpdump outputs on each system show the VRRP packets that that system is sending, but do not show any packets sent by the other system. This means that VRRP adverts of each of your systems are not being received by the other system, and hence each system becomes master.

Since it works when you change to use unicasting, it suggests that multicast packets are not being forwarded between the systems.

I am not clear what you mean by `But it turns out that the VIP is not compatible with these settings?`

**Comment by newman0089** [comment]
> Since it works when you change to use unicasting, it suggests that multicast packets are not being forwarded between the systems.
Any ideas? I do not know what to do(

**Comment by pqarmitage** [comment]
@newman0089 Unfortunately this is not the right place for diagnosing network configuration issues. From a keepalived perspective we have determined that it works using unicast, and also that multicast packets being sent from each system are not being received be the other system.

You have stated above that your server `is in the cloud infrastructure`. In this situation the most common cause of multicast traffic not being received is that the cloud provider has disabled multicasting. Sometimes this can be enabled by the user, sometimes the cloud provider just does not allow multicasting.
