### ISSUE TITLE
KeepAlived backup VM entering into Master VM state

### ISSUE THREAD

**Issue by MuhammadMunir12** [acassen/keepalived#2092]
**Describe the bug**
We have configured two keepalived instances on virtual machines with RHEL 7.9. 
One of virtual machine is running master instance of keepalived and other is running backup instance of keepalived. 
But, upon starting the service for keepalived on both VMs, they are entering into master state, even thouugh priority for backup is lower. 

**To Reproduce**
### Master Instance configs
```
vrrp_instance VI_1 {
    state MASTER
    interface ens3
    virtual_router_id 51
    priority 101
    advert_int 1
    authentication {
        auth_type PASS
        auth_pass 1234
    }
    virtual_ipaddress {
        192.168.10.232/24
    }
}

````

### Backup Instance configs

```
vrrp_instance VI_1 {
    state BACKUP
    interface ens3
    virtual_router_id 51
    priority 100
    advert_int 1
    authentication {
        auth_type PASS
        auth_pass 1234
    }
    virtual_ipaddress {
        192.168.10.232/24
    }
}

```

**Expected behavior**
Master should run as master, backup should run as backup not master. 

**Keepalived version**
```
Keepalived v1.3.5 (03/19,2017), git commit v1.3.5-6-g6fa32f2
```

**Distro (please complete the following information):**
 - Name: RHEL
 - Version: 7.9
 - Architecture:  x86_64

**System Log entries for backup instance**
```
# systemctl status keepalived
● keepalived.service - LVS and VRRP High Availability Monitor
   Loaded: loaded (/usr/lib/systemd/system/keepalived.service; enabled; vendor preset: disabled)
   Active: active (running) since Thu 2022-02-03 14:50:55 PKT; 5s ago
  Process: 2490 ExecStart=/usr/sbin/keepalived $KEEPALIVED_OPTIONS (code=exited, status=0/SUCCESS)
 Main PID: 2491 (keepalived)
   CGroup: /system.slice/keepalived.service
           ├─2491 /usr/sbin/keepalived -D
           ├─2492 /usr/sbin/keepalived -D
           └─2493 /usr/sbin/keepalived -D

Feb 03 14:50:55 backup Keepalived_vrrp[2493]: VRRP sockpool: [ifindex(2), proto(112), unicast(0), fd(10,11)]
Feb 03 14:50:59 backup Keepalived_vrrp[2493]: VRRP_Instance(VI_1) Transition to MASTER STATE
Feb 03 14:51:00 backup Keepalived_vrrp[2493]: VRRP_Instance(VI_1) Entering MASTER STATE
Feb 03 14:51:00 backup Keepalived_vrrp[2493]: VRRP_Instance(VI_1) setting protocol VIPs.
Feb 03 14:51:00 backup Keepalived_vrrp[2493]: Sending gratuitous ARP on ens3 for 192.168.10.232
Feb 03 14:51:00 backup Keepalived_vrrp[2493]: VRRP_Instance(VI_1) Sending/queueing gratuitous ARPs on ens3 for 192.168.10.232
Feb 03 14:51:00 backup Keepalived_vrrp[2493]: Sending gratuitous ARP on ens3 for 192.168.10.232
Feb 03 14:51:00 backup Keepalived_vrrp[2493]: Sending gratuitous ARP on ens3 for 192.168.10.232
Feb 03 14:51:00 backup Keepalived_vrrp[2493]: Sending gratuitous ARP on ens3 for 192.168.10.232
Feb 03 14:51:00 backup Keepalived_vrrp[2493]: Sending gratuitous ARP on ens3 for 192.168.10.232
```

**Additional context**
Both VMs are running on a server with network from same subnet. Backup VM is getting IP address on "ens3" because it goes into master state.

**Comment by pqarmitage** [comment]
There appears to be nothing wrong with your keepalived configuration.

The only reason that the backup instance can be in master state is because it is not receiving adverts from the master VM. One possibility is that multicast forwarding is disabled.

That neither VM appears to have keepalived log entries stating that while in master state keepalived is receiving adverts from elsewhere suggests that VRRP adverts that are being sent are not being received in the other VM.

You could test the following to try and identify what is happening:
1. Stop keepalived on the backup VM, and with keepalived running on the master VM, on the backup VM run `tcpdump -n -nn -v -i ens3` and see if any VRRP advert packets are being received.
2. Try using unicast (`unicast_src_ip` and `unicast_peer`) configuration (you could also run the tcpdump command to see further what is happening).

If test 1 above shows no packets are being received, but test 2 has keepalived working as you expect, then it suggests that multicast packets are not being forwarded.

**Comment by MuhammadMunir12** [comment]
@pqarmitage Thanks for quick response. 

As of point 1:  Yes the traffic is captured as shown below. 
```
# tcpdump -n -nn -v -i ens3
tcpdump: listening on ens3, link-type EN10MB (Ethernet), capture size 262144 bytes
15:48:13.828819 IP (tos 0x10, ttl 64, id 20731, offset 0, flags [DF], proto TCP (6), length 156)
    192.168.10.130.22 > 115.186.134.230.52689: Flags [P.], cksum 0x072e (correct), seq 2176861231:2176861347, ack 1033201938, win 356, length 116
15:48:13.829159 IP (tos 0x10, ttl 64, id 20732, offset 0, flags [DF], proto TCP (6), length 140)
    192.168.10.130.22 > 115.186.134.230.52689: Flags [P.], cksum 0x9ed5 (correct), seq 116:216, ack 1, win 356, length 100
15:48:13.829334 IP (tos 0x10, ttl 64, id 20733, offset 0, flags [DF], proto TCP (6), length 108)
    192.168.10.130.22 > 115.186.134.230.52689: Flags [P.], cksum 0xf04e (correct), seq 216:284, ack 1, win 356, length 68
15:48:13.829502 IP (tos 0x10, ttl 64, id 20734, offset 0, flags [DF], proto TCP (6), length 108)
    192.168.10.130.22 > 115.186.134.230.52689: Flags [P.], cksum 0x7921 (correct), seq 284:352, ack 1, win 356, length 68
15:48:13.829694 IP (tos 0x10, ttl 64, id 20735, offset 0, flags [DF], proto TCP (6), length 108)
    192.168.10.130.22 > 115.186.134.230.52689: Flags [P.], cksum 0xe3ac (correct), seq 352:420, ack 1, win 356, length 68
15:48:13.850118 IP (tos 0x0, ttl 126, id 61015, offset 0, flags [DF], proto TCP (6), length 40)
    115.186.134.230.52689 > 192.168.10.130.22: Flags [.], cksum 0xab8e (correct), ack 0, win 1020, length 0
15:48:13.850136 IP (tos 0x10, ttl 64, id 20736, offset 0, flags [DF], proto TCP (6), length 108)
    192.168.10.130.22 > 115.186.134.230.52689: Flags [P.], cksum 0xb9fd (correct), seq 420:488, ack 1, win 356, length 68
15:48:13.855265 IP (tos 0x0, ttl 126, id 61016, offset 0, flags [DF], proto TCP (6), length 40)
    115.186.134.230.52689 > 192.168.10.130.22: Flags [.], cksum 0xaab7 (correct), ack 216, win 1019, length 0
15:48:13.855278 IP (tos 0x10, ttl 64, id 20737, offset 0, flags [DF], proto TCP (6), length 140)
    192.168.10.130.22 > 115.186.134.230.52689: Flags [P.], cksum 0xc263 (correct), seq 488:588, ack 1, win 356, length 100
15:48:13.855493 IP (tos 0x10, ttl 64, id 20738, offset 0, flags [DF], proto TCP (6), length 140)
    192.168.10.130.22 > 115.186.134.230.52689: Flags [P.], cksum 0x31ce (correct), seq 588:688, ack 1, win 356, length 100
15:48:13.860294 IP (tos 0x0, ttl 126, id 61017, offset 0, flags [DF], proto TCP (6), length 40)
    115.186.134.230.52689 > 192.168.10.130.22: Flags [.], cksum 0xaa2a (correct), ack 352, win 1024, length 0
15:48:13.860306 IP (tos 0x10, ttl 64, id 20739, offset 0, flags [DF], proto TCP (6), length 108)
    192.168.10.130.22 > 115.186.134.230.52689: Flags [P.], cksum 0xce52 (correct), seq 688:756, ack 1, win 356, length 68
15:48:13.860521 IP (tos 0x10, ttl 64, id 20740, offset 0, flags [DF], proto TCP (6), length 140)
    192.168.10.130.22 > 115.186.134.230.52689: Flags [P.], cksum 0xd41f (correct), seq 756:856, ack 1, win 356, length 100
15:48:13.864469 IP (tos 0x0, ttl 126, id 61018, offset 0, flags [DF], proto TCP (6), length 40)
    115.186.134.230.52689 > 192.168.10.130.22: Flags [.], cksum 0xa9a3 (correct), ack 488, win 1023, length 0

```

Tried 2nd way you suggested, and it worked. Thanks a lot.

**Comment by pqarmitage** [comment]
@MuhammadMunir12 What the above tcpdump output shows is that no VRRP adverts were received in the 0.35 second interval shown above (all the packets are TCP). Since you have an advert interval of 1 second, it is possible that the system was receiving VRRP adverts still.

However, since it is now working with unicast, it suggests that multicast packets are not being forwarded between the two VMs. This is probably something that you want to sort out, since it may cause other problems. Once you have it sorted you could then remove the keepalvied unicast configuration that you have just added, since it keeps the configuration simpler using multicast.
