### ISSUE TITLE
CentOS 7 vrrp_strict firewalld

### ISSUE THREAD

**Issue by omarc1492** [acassen/keepalived#1373]
> OS: CentOS 7
Firewalld
 keepalived 2.0.18

Built from source.

```
curl https://www.keepalived.org/software/keepalived-2.0.18.tar.gz > keepalived-2.0.18.tar.gz
tar -xzvf keepalived-2.0.18.tar.gz
cd keepalived-2.0.18
./configure --prefix=/
make
make install
```

`/etc/keepalived/keepalived.conf`

```
global_defs {
   notification_email {
     email@address.com
   }
   notification_email_from email-from@address.com
   smtp_server 192.168.200.1
   smtp_connect_timeout 30
   router_id LVS_DEVEL
   vrrp_skip_check_adv_addr
   vrrp_strict
   vrrp_garp_interval 0
   vrrp_gna_interval 0
}

vrrp_instance VI_1 {
    state MASTER
    interface ens192
    virtual_router_id 51
    priority 101
    advert_int 1
    authentication {
        auth_type PASS
        auth_pass 1111
    }
    virtual_ipaddress {
        172.16.250.10
    }
}
```

I am unable to ping VIP `172.16.250.10` when `vrrp_strict` is enabled. (Too much time wasted to figure this out). When using` keepalived-2.0.10` or below it works with the above `keepalived,conf`. If I install HAProxy also, I'm unable to also access any HAProxy `backend` servers by using the VIP address `172.16.250.10`.

Running`systemctl stop firewalld` makes ping work for `172.16.250.10 (VIP)`.  Running `firewall-cmd --reload` also makes ping work, but also changes the firewall rules for keepalived. If i disable `vrrp_strict` on anything above keepalived 2.0.10 it also starts working.

`VRRP` works fine and switches between  `MASTER` and `BACKUP` when one is done.
I used the following to enable `VRRP`.

```
MASTER server IP: 172.16.250.20
BACKUP server IP: 172.16.250.21
 
#lb1 (MASTER)
firewall-cmd --permanent --add-rich-rule='rule family=ipv4 source address=172.16.250.21/32 destination address=224.0.0.18/32 protocol value=vrrp accept'

#lb2 (BACKUP)
firewall-cmd --permanent --add-rich-rule='rule family=ipv4 source address=172.16.250.20/32 destination address=224.0.0.18/32 protocol value=vrrp accept'
```

Logs
```
Aug 12 22:48:29 lb1 Keepalived[8325]: Starting Keepalived v2.0.18 (07/26,2019)
Aug 12 22:48:29 lb1 Keepalived[8325]: Running on Linux 3.10.0-957.27.2.el7.x86_64 #1 SMP Mon Jul 29 17:46:05 UTC 2019 (built for Linux 3.10.0)
Aug 12 22:48:29 lb1 Keepalived[8325]: Command line: '//sbin/keepalived' '-D'
Aug 12 22:48:29 lb1 Keepalived[8325]: Opening file '/etc/keepalived/keepalived.conf'.
Aug 12 22:48:29 lb1 Keepalived[8325]: (Line 15) number '0' outside range [1e-06, 4294]
Aug 12 22:48:29 lb1 Keepalived[8325]: (Line 15) vrrp_garp_interval '0' is invalid
Aug 12 22:48:29 lb1 Keepalived[8325]: (Line 16) number '0' outside range [1e-06, 4294]
Aug 12 22:48:29 lb1 Keepalived[8325]: (Line 16) vrrp_gna_interval '0' is invalid
Aug 12 22:48:29 lb1 Keepalived[8326]: Starting VRRP child process, pid=8327
Aug 12 22:48:29 lb1 Keepalived_vrrp[8327]: Registering Kernel netlink reflector
Aug 12 22:48:29 lb1 Keepalived_vrrp[8327]: Registering Kernel netlink command channel
Aug 12 22:48:29 lb1 Keepalived_vrrp[8327]: Opening file '/etc/keepalived/keepalived.conf'.
Aug 12 22:48:30 lb1 systemd: Started LVS and VRRP High Availability Monitor.
Aug 12 22:48:30 lb1 Keepalived_vrrp[8327]: (VI_1) State MASTER must match being address owner
Aug 12 22:48:30 lb1 Keepalived_vrrp[8327]: (VI_1) Strict mode does not support authentication. Ignoring.
Aug 12 22:48:30 lb1 Keepalived_vrrp[8327]: Assigned address 172.16.250.20 for interface ens192
Aug 12 22:48:30 lb1 Keepalived_vrrp[8327]: Assigned address fe80::20c:29ff:febd:d660 for interface ens192
Aug 12 22:48:30 lb1 Keepalived_vrrp[8327]: Registering gratuitous ARP shared channel
Aug 12 22:48:30 lb1 Keepalived_vrrp[8327]: (VI_1) removing VIPs.
Aug 12 22:48:30 lb1 Keepalived_vrrp[8327]: (VI_1) removing firewall drop rule
Aug 12 22:48:30 lb1 Keepalived_vrrp[8327]: (VI_1) Entering BACKUP STATE (init)
Aug 12 22:48:30 lb1 Keepalived_vrrp[8327]: VRRP sockpool: [ifindex(2), family(IPv4), proto(112), unicast(0), fd(11,12)]
Aug 12 22:48:33 lb1 Keepalived_vrrp[8327]: (VI_1) Receive advertisement timeout
Aug 12 22:48:33 lb1 Keepalived_vrrp[8327]: (VI_1) Entering MASTER STATE
Aug 12 22:48:33 lb1 Keepalived_vrrp[8327]: (VI_1) setting firewall drop rule
Aug 12 22:48:33 lb1 Keepalived_vrrp[8327]: (VI_1) setting VIPs.
Aug 12 22:48:33 lb1 Keepalived_vrrp[8327]: Sending gratuitous ARP on ens192 for 172.16.250.10
Aug 12 22:48:33 lb1 Keepalived_vrrp[8327]: (VI_1) Sending/queueing gratuitous ARPs on ens192 for 172.16.250.10
Aug 12 22:48:33 lb1 Keepalived_vrrp[8327]: Sending gratuitous ARP on ens192 for 172.16.250.10
Aug 12 22:48:33 lb1 Keepalived_vrrp[8327]: Sending gratuitous ARP on ens192 for 172.16.250.10
Aug 12 22:48:33 lb1 Keepalived_vrrp[8327]: Sending gratuitous ARP on ens192 for 172.16.250.10
Aug 12 22:48:33 lb1 Keepalived_vrrp[8327]: Sending gratuitous ARP on ens192 for 172.16.250.10
Aug 12 22:48:38 lb1 systemd: Reloading.
Aug 12 22:48:38 lb1 Keepalived_vrrp[8327]: Sending gratuitous ARP on ens192 for 172.16.250.10
Aug 12 22:48:38 lb1 Keepalived_vrrp[8327]: (VI_1) Sending/queueing gratuitous ARPs on ens192 for 172.16.250.10
Aug 12 22:48:38 lb1 Keepalived_vrrp[8327]: Sending gratuitous ARP on ens192 for 172.16.250.10
Aug 12 22:48:38 lb1 Keepalived_vrrp[8327]: Sending gratuitous ARP on ens192 for 172.16.250.10
Aug 12 22:48:38 lb1 Keepalived_vrrp[8327]: Sending gratuitous ARP on ens192 for 172.16.250.10
Aug 12 22:48:38 lb1 Keepalived_vrrp[8327]: Sending gratuitous ARP on ens192 for 172.16.250.10
```

Firewall
```
public (active)
  target: default
  icmp-block-inversion: no
  interfaces: ens192
  sources:
  services: ssh dhcpv6-client
  ports:
  protocols:
  masquerade: no
  forward-ports:
  source-ports:
  icmp-blocks:
  rich rules:


---BEFORE---
-P INPUT ACCEPT
-P FORWARD ACCEPT
-P OUTPUT ACCEPT
-N FORWARD_IN_ZONES
-N FORWARD_IN_ZONES_SOURCE
-N FORWARD_OUT_ZONES
-N FORWARD_OUT_ZONES_SOURCE
-N FORWARD_direct
-N FWDI_public
-N FWDI_public_allow
-N FWDI_public_deny
-N FWDI_public_log
-N FWDO_public
-N FWDO_public_allow
-N FWDO_public_deny
-N FWDO_public_log
-N INPUT_ZONES
-N INPUT_ZONES_SOURCE
-N INPUT_direct
-N IN_public
-N IN_public_allow
-N IN_public_deny
-N IN_public_log
-N OUTPUT_direct
-A INPUT -m conntrack --ctstate RELATED,ESTABLISHED -j ACCEPT
-A INPUT -i lo -j ACCEPT
-A INPUT -j INPUT_direct
-A INPUT -j INPUT_ZONES_SOURCE
-A INPUT -j INPUT_ZONES
-A INPUT -m conntrack --ctstate INVALID -j DROP
-A INPUT -j REJECT --reject-with icmp-host-prohibited
-A INPUT -m set --match-set keepalived dst -j DROP
-A FORWARD -m conntrack --ctstate RELATED,ESTABLISHED -j ACCEPT
-A FORWARD -i lo -j ACCEPT
-A FORWARD -j FORWARD_direct
-A FORWARD -j FORWARD_IN_ZONES_SOURCE
-A FORWARD -j FORWARD_IN_ZONES
-A FORWARD -j FORWARD_OUT_ZONES_SOURCE
-A FORWARD -j FORWARD_OUT_ZONES
-A FORWARD -m conntrack --ctstate INVALID -j DROP
-A FORWARD -j REJECT --reject-with icmp-host-prohibited
-A OUTPUT -j OUTPUT_direct
-A OUTPUT -m set --match-set keepalived src -j DROP
-A FORWARD_IN_ZONES -i ens192 -g FWDI_public
-A FORWARD_IN_ZONES -g FWDI_public
-A FORWARD_OUT_ZONES -o ens192 -g FWDO_public
-A FORWARD_OUT_ZONES -g FWDO_public
-A FWDI_public -j FWDI_public_log
-A FWDI_public -j FWDI_public_deny
-A FWDI_public -j FWDI_public_allow
-A FWDI_public -p icmp -j ACCEPT
-A FWDO_public -j FWDO_public_log
-A FWDO_public -j FWDO_public_deny
-A FWDO_public -j FWDO_public_allow
-A INPUT_ZONES -i ens192 -g IN_public
-A INPUT_ZONES -g IN_public
-A IN_public -j IN_public_log
-A IN_public -j IN_public_deny
-A IN_public -j IN_public_allow
-A IN_public -p icmp -j ACCEPT
-A IN_public_allow -p tcp -m tcp --dport 22 -m conntrack --ctstate NEW -j ACCEPT

---AFTER---
-P INPUT ACCEPT
-P FORWARD ACCEPT
-P OUTPUT ACCEPT
-N FORWARD_IN_ZONES
-N FORWARD_IN_ZONES_SOURCE
-N FORWARD_OUT_ZONES
-N FORWARD_OUT_ZONES_SOURCE
-N FORWARD_direct
-N FWDI_public
-N FWDI_public_allow
-N FWDI_public_deny
-N FWDI_public_log
-N FWDO_public
-N FWDO_public_allow
-N FWDO_public_deny
-N FWDO_public_log
-N INPUT_ZONES
-N INPUT_ZONES_SOURCE
-N INPUT_direct
-N IN_public
-N IN_public_allow
-N IN_public_deny
-N IN_public_log
-N OUTPUT_direct
-A INPUT -m conntrack --ctstate RELATED,ESTABLISHED -j ACCEPT
-A INPUT -i lo -j ACCEPT
-A INPUT -j INPUT_direct
-A INPUT -j INPUT_ZONES_SOURCE
-A INPUT -j INPUT_ZONES
-A INPUT -m conntrack --ctstate INVALID -j DROP
-A INPUT -j REJECT --reject-with icmp-host-prohibited
-A FORWARD -m conntrack --ctstate RELATED,ESTABLISHED -j ACCEPT
-A FORWARD -i lo -j ACCEPT
-A FORWARD -j FORWARD_direct
-A FORWARD -j FORWARD_IN_ZONES_SOURCE
-A FORWARD -j FORWARD_IN_ZONES
-A FORWARD -j FORWARD_OUT_ZONES_SOURCE
-A FORWARD -j FORWARD_OUT_ZONES
-A FORWARD -m conntrack --ctstate INVALID -j DROP
-A FORWARD -j REJECT --reject-with icmp-host-prohibited
-A OUTPUT -j OUTPUT_direct
-A FORWARD_IN_ZONES -i ens192 -g FWDI_public
-A FORWARD_IN_ZONES -g FWDI_public
-A FORWARD_OUT_ZONES -o ens192 -g FWDO_public
-A FORWARD_OUT_ZONES -g FWDO_public
-A FWDI_public -j FWDI_public_log
-A FWDI_public -j FWDI_public_deny
-A FWDI_public -j FWDI_public_allow
-A FWDI_public -p icmp -j ACCEPT
-A FWDO_public -j FWDO_public_log
-A FWDO_public -j FWDO_public_deny
-A FWDO_public -j FWDO_public_allow
-A INPUT_ZONES -i ens192 -g IN_public
-A INPUT_ZONES -g IN_public
-A IN_public -j IN_public_log
-A IN_public -j IN_public_deny
-A IN_public -j IN_public_allow
-A IN_public -p icmp -j ACCEPT
-A IN_public_allow -p tcp -m tcp --dport 22 -m conntrack --ctstate NEW -j ACCEPT
```

TCP Dump
```
---BEFORE---
tcpdump -nni ens192 icmp
tcpdump: verbose output suppressed, use -v or -vv for full protocol decode
listening on ens192, link-type EN10MB (Ethernet), capture size 262144 bytes
23:12:58.634449 IP 172.16.4.14 > 172.16.250.10: ICMP echo request, id 1, seq 32978, length 40
23:13:03.634570 IP 172.16.4.14 > 172.16.250.10: ICMP echo request, id 1, seq 32979, length 40
2 packets captured
2 packets received by filter
0 packets dropped by kernel

---AFTER---
tcpdump -nni ens192 icmp
tcpdump: verbose output suppressed, use -v or -vv for full protocol decode
listening on ens192, link-type EN10MB (Ethernet), capture size 262144 bytes
23:14:13.635936 IP 172.16.4.14 > 172.16.250.10: ICMP echo request, id 1, seq 32997, length 40
23:14:13.636041 IP 172.16.250.10 > 172.16.4.14: ICMP echo reply, id 1, seq 32997, length 40
23:14:14.636842 IP 172.16.4.14 > 172.16.250.10: ICMP echo request, id 1, seq 32998, length 40
23:14:14.636927 IP 172.16.250.10 > 172.16.4.14: ICMP echo reply, id 1, seq 32998, length 40
4 packets captured
4 packets received by filter
0 packets dropped by kernel
```

To reiterate the following works fine on any VM running CentOS 7 as long as I use any version of keepalived-2.0.10 or below without any more modifications.
```
curl https://www.keepalived.org/software/keepalived-x,x.x.tar.gz > keepalived-x.x.x.tar.gz
tar -xzvf keepalived-x.x.x.tar.gz
cd keepalived-x.x.x
./configure --prefix=/
make
make install

global_defs {
   notification_email {
     email@address.com
   }
   notification_email_from email-from@address.com
   smtp_server 192.168.200.1
   smtp_connect_timeout 30
   router_id LVS_DEVEL
   vrrp_skip_check_adv_addr
   vrrp_strict
   vrrp_garp_interval 0
   vrrp_gna_interval 0
}

vrrp_instance VI_1 {
    state MASTER
    interface ens192
    virtual_router_id 51
    priority 101
    advert_int 1
    authentication {
        auth_type PASS
        auth_pass 1111
    }
    virtual_ipaddress {
        172.16.250.10
    }
}
```

**Comment by pqarmitage** [comment]
The behaviour you describe is as intended. `vrrp_strict` means `Enforce strict VRRP protocol compliance`. RFC5798 states (for a VRRP instance in master state): `(650) - MUST accept packets addressed to the IPvX address(es) associated with the virtual router if it is the IPvX address owner or if Accept_Mode is True. Otherwise, MUST NOT accept these packets.`

You have enabled `vrrp_strict` and `accept` is not set and the vrrp instance is not the address owner (priority not 255), so packets addressed to the virtual IP addresses are dropped. keepalived currently uses the firewall (iptables or nftables) to drop the packets.

**Comment by omarc1492** [comment]
Thank you for the clarification. Since keepalived uses the firewall to drop the packets, is there a reason the packets are not dropped after doing `firewall-cmd --reload`? 

These are the only rules that disappear after running `firewall-cmd --reload` from iptables
```
-A INPUT -m set --match-set keepalived dst -j DROP
-A OUTPUT -m set --match-set keepalived src -j DROP
```

I can't access anything on the virtual IP address, ping or http with HAProxy until I do `firewall-cmd --reload`. If I restart the server, it stops working again. 

This is not an issue with keepalived-2.0.10 or older.

I'm using keepalived with HAProxy to do load balancing. I can only access the servers behind HAProxy by using the virtual IP address after running `firewall-cmd --reload` on the server running keepalived.

**Comment by pqarmitage** [comment]
When you reload the firewall, it deletes the rules that keepalived added, i.e. the two you list above, and as a consequence of that the firewall is no longer dropping packets addresses to the VIP.

keepalived is working as designed. Specifying `vrrp_strict` means the packets addresses to VIPs of vrrp instances whose priority is less than 255 will be dropped (which is what the VRRP RFC states should happen). If it is `not an issue with keepalived-2.0.10` then keepalvied-2.0.10 was not working properly. If you don't want the packets dropped, either configure `accept` on the vrrp instances, or don't specify `vrrp_strict`.

**Comment by omarc1492** [comment]
Just to clarify, `vrrp_strict` blocks all packets to the virtual IP address? Which in my case blocks `ping` from replying and `http` forwarding to the servers being load balanced by HAProxy?

**Comment by pqarmitage** [comment]
> Just to clarify, `vrrp_strict` blocks all packets to the virtual IP address? Which in my case blocks `ping` from replying and `http` forwarding to the servers being load balanced by HAProxy?

Yes, that is correct.

**Comment by omarc1492** [comment]
What is a good case scenario for `vrrp_strict` to be enabled? I haven't found anything useful online. It's enabled by default after a fresh install of `keepalived`.

**Comment by pqarmitage** [comment]
If you are using keepalived just for VRRP, and not using virtual servers, then it makes it more straightforward to make keepalived operate in compliance with the RFCs.

In the default configuration file that is installed, none of the virtual servers' addresses are VIPs, and so vrrp_strict does not block access to the virtual servers.
