### ISSUE TITLE
forcing new election without action

### ISSUE THREAD

**Issue by mrozentsvayg** [acassen/keepalived#950]
Hi,

This is pretty much the same issue as:
https://github.com/acassen/keepalived/issues/100
it has been closed without resolution, however it can occasionally reproduce.

slave:
```
Jul  9 14:41:42 i-<slave> Keepalived_vrrp[19036]: (instance1) Entering MASTER STATE
Jul  9 14:41:42 i-<slave> Keepalived_vrrp[19036]: (instance1) Master received advert from <master> with higher priority 122, ours 121
Jul  9 14:41:42 i-<slave> Keepalived_vrrp[19036]: (instance1) Entering BACKUP STATE
```

master:
```
Jul  9 14:41:42 i-<master> Keepalived_vrrp[10266]: (instance1) Received advert from <slave> with lower priority 121, ours 122, forcing new election
```

what happened here is that for a split second slave considered itself a master and executed a `notify_master` script. in our case it assigns a secondary ip in AWS.
master triggered a reelection, but as it kept considering itself a master, it didn't execute anything. the state didn't change it's got nothing to do.

as a result we got a broken vrrp pair, the ip in AWS was pointing to the instance in a backup state.

As mentioned in the issue 100, it could be worked around with journalctl in vrrp_script or some other ugly periodic checks,  but it would also potentially prone to the race cases.
What Is the recommended way to handle this ?

Thank you.

**Comment by pqarmitage** [comment]
Could you please provide the following details:
1. Version of keepalived being used
2. What distro you are running, what version and what kernel version
3. A description of the environment the systems are running in.

The only reasons a vrrp instance in backup mode can transition to master is if it doesn't receive an advert for three advert intervals, or following receipt of a priority 0 advert, it doesn't receive an advert within (256 - own priority)/256 * advert interval (or something close to that). In this case, you don't indicate that receipt of a 0 priority advert was logged, so I'll assume that was not the case. This leaves us with the backup instance not receiving an advert for 3 advert intervals, which suggests that there is some sort of (possibly intermittent) connectivity problem between the two systems.

You could try one or more of the following:
1. Use a `notify_backup` script to remove the secondary ip in AWS
2. Could you use keepalived itself to manage the secondary ip in AWS?
3. Increase the advert interval so that a short break in connectivity doesn't trigger a timeout on the backup instance.

**Comment by mrozentsvayg** [comment]
1. keepalived version 2.0.2
2. ubuntu xenial 4.4.0-1060-aws
3. aws m5.xlarge, keepalievd + unbound per box

> Use a notify_backup script to remove the secondary ip in AWS

we could use the `notify_backup` to unassign the secondary address from the instance, but it still needs to be assigned to the master to make it work.

> Could you use keepalived itself to manage the secondary ip in AWS?

sorry, what do you mean?

**Comment by pqarmitage** [comment]
I've learnt more about AWS and secondary IP addresses today, so I now see that my suggestions 1 and 2 above don't help.

The real issue to resolve is why is the backup not receiving adverts for 3 advert intervals. I would suggest seeing what happens if you increase the advert interval, but if that does improve the situation it would only be masking the real underlying problem. It would also be interesting if you could leave a ping running between the master and backup and seeing if you are experiencing packet loss, particularly at the time that the backup decides to become master.

One enhancement that could be made to keepalived, but again it would only be a workaround to the underlying problem of losing packets, would be to add a `notify_master_rx_lower_pri` script, which would be run when a master receives a lower priority advert, which would indicate that a vrrp instance that should be in backup state has erroneously transitioned to master. The script could then execute the necessary aws command to restore the secondary ip to the vrrp master.

**Comment by mrozentsvayg** [comment]
yes, there could be different intermittent issue when packets are lost.
something in aws, or security group regenerating etc.
the case is very unlikely to get reproduced any time soon, so i'd rather concentrate of how to properly detect and fix it when it occasionally happens, even once in a while, like a year.

> One enhancement that could be made to keepalived, but again it would only be a workaround to the underlying problem of losing packets, would be to add a notify_master_rx_lower_pri script, which would be run when a master receives a lower priority advert

it  sounds pretty much like what i would like to have.
all other workarounds are way more ugly

**Comment by mrozentsvayg** [comment]
@pqarmitage any eta about the `notify_master_rx_lower_pri`?

**Comment by mrozentsvayg** [comment]
That's great,  i'm going to try it out, thank you!
However, when is it going to get into the next release (or get tagged)?
It'd be a bit more preferable to build the released package in our infrastructure than from the branch/commit (even master).

**Comment by acassen** [comment]
new release scheduled for tomorrow

**Comment by mrozentsvayg** [comment]
during the initial phase there's still some race, may be another one.

master:
```
Jul 24 03:24:43 i-mmm Keepalived_vrrp[8899]: (instance1) Entering BACKUP STATE (init)
Jul 24 03:24:47 i-mmm Keepalived_vrrp[8899]: (instance1) Entering MASTER STATE
Jul 24 03:24:50 i-mmm Keepalived_vrrp[8899]: (instance1) Received advert from 10.11.2.190 with lower priority 101, ours 102, forcing new election
```
backup:
```
Jul 24 03:24:46 i-bbb Keepalived_vrrp[8852]: (instance1) Entering BACKUP STATE (init)
Jul 24 03:24:50 i-bbb Keepalived_vrrp[8852]: (instance1) Entering MASTER STATE
Jul 24 03:24:50 i-bbb Keepalived_vrrp[8852]: (instance1) Master received advert from 10.11.2.201 with higher priority 102, ours 101
Jul 24 03:24:50 i-bbb Keepalived_vrrp[8852]: (instance1) Entering BACKUP STATE
```

so the backup has inited 3 seconds later, and grabbed the vip ip from aws (using notify_master apparently)
master has forced the new election and got the interface ip back, but looks like it didn't execute neither of notify_master/notify_master_rx_lower_pri which are set the same.

**Comment by pqarmitage** [comment]
There appear to be two issues here:
1. Why does the backup transition to master when it starts
2. Why is the notify_master_rx_lower_pri script not running

Re 1, I suspect this is the same as [issue #951](https://github.com/acassen/keepalived/issues/951#issuecomment-404148519) - see comment re AWS security group.

2. Why is the notify_master_rx_lower_pri script not being run. This is strange since it works for me (although I have to simulate the backup not receiving adverts from the master by using iptables to block the master's adverts).
For what it is worth, this is the script I am using to simulate what you are experiencing:
```
#!/bin/bash

ip netns exec low iptables -I INPUT -p 112 -j DROP

echo Starting keepalived high
keepalived/keepalived -DRM -mf $(pwd)/../utils/configs/950.conf -G -g/tmp/sched.log --flush-log-file -i high

sleep 3

echo Starting keepalived low
keepalived/keepalived -DRM -mf $(pwd)/../utils/configs/950.conf -G -g/tmp/sched.log --flush-log-file -i low

sleep 4

echo Removing iptables DROP
ip netns exec low iptables -D INPUT -p 112 -j DROP
```

When I run this, I am seeing both the notify_master_rx_lower_pri script being run, and also messages on the notify FIFOs.

Looking at the code, in vrrp_state_master_rx(), if keepalived writes the log message `Received adver from ... with lower priority` then it cannot avoid invoking the notify_master_rx_lower_pri script if it is configured.

Could you please post the keepalived configurations of both the master and the backup, and also the full log output of the master and backup from when they start running. When doing this, could you please run both the master and backup keepalived processes with the `-D` and `-d` flags.

**Comment by mrozentsvayg** [comment]
> Why is the notify_master_rx_lower_pri script not running
> Re 1, I suspect this is the same as issue #951 - see comment re AWS security group.

it's not the case unfortunately
all the VRRP pairs members are in the same subnet, and VRRPv2 advertisements go through without the explicit rules:
```
root@i-<slave-id>:~# tcpdump -ann ip proto 112
tcpdump: verbose output suppressed, use -v or -vv for full protocol decode
listening on ens5, link-type EN10MB (Ethernet), capture size 262144 bytes
00:38:46.720972 IP <master-ip> > <slave-ip>: VRRPv2, Advertisement, vrid 26, prio 122, authtype none, intvl 1s, length 20
00:38:47.722025 IP <master-ip> > <slave-ip>: VRRPv2, Advertisement, vrid 26, prio 122, authtype none, intvl 1s, length 20
00:38:48.723067 IP <master-ip> > <slave-ip>: VRRPv2, Advertisement, vrid 26, prio 122, authtype none, intvl 1s, length 20
00:38:49.724116 IP <master-ip> > <slave-ip>: VRRPv2, Advertisement, vrid 26, prio 122, authtype none, intvl 1s, length 20
00:38:50.725160 IP <master-ip> > <slave-ip>: VRRPv2, Advertisement, vrid 26, prio 122, authtype none, intvl 1s, length 20
^C
```


> Could you please post the keepalived configurations of both the master and the backup
config is pretty trivial, backup:
```
vrrp_script health-check {
    script "/usr/local/bin/unbound_check.sh"
    interval 1
    timeout 1
    rise 1
    fall 1
    weight 20
}

vrrp_instance instance1 {
    state BACKUP
    priority 101
    interface ens5
    virtual_router_id 26
    advert_int 1
    unicast_src_ip <slave-ip>
    unicast_peer {
       <master-ip>
    }

    notify_master "/usr/local/bin/grab_ip.sh"
    notify_master_rx_lower_pri "/usr/local/bin/grab_ip.sh"
    virtual_ipaddress {
        <vip-ip>
    }

    track_script {
        health-check weight 20
    }
}
```
and on master reversed `unicast_src_ip` and `unicast_peer` and:
```
    state MASTER
    priority 102
```

> and also the full log output of the master and backup from when they start running. When doing this, could you please run both the master and backup keepalived processes with the -D and -d flags.

will do.
though debug would contain some instance ids, ips and private zone aws info that i wouldn't disclose publicly, while a bit harder to mask.
could i send it somewhere else like email?

**Comment by pqarmitage** [comment]
@mrozentsvayg Happy for you to email it to me. You'll find my email address in the message of most commits.

**Comment by dfosborne2** [comment]
Hi I have the same issues currently in AWS. nginx + keepalived. Whenever the secondary reboots it steals the address on the EC2 side of the house. Within linux itself, the vip manages to find its way back to the higher priority instance. Please let me know if I should expound here further or how you'd like me to proceed. One other item, I tried the notify_master_rx_lower_pri as such:

`        notify_master_rx_lower_pri "/bin/manually_swing_aws_vip.sh notify master_rx_lower_pri"`

And get this in messages log:

`Apr 16 04:03:54 gsavaldlb200 Keepalived_vrrp[24348]: Error exec-ing command '/usr/bin/manually_swing_aws_vip.sh', error 8: Exec format error`

**Comment by pqarmitage** [comment]
@dfosborne2 I suggest you use the new configuration option `vrrp_startup_delay`, which delays keepalived vrrp instances coming up into backup state for a specified number of seconds. This is to allow the networking components time to come up after a reboot. What you are experiencing is that keepalived starts running, but since the network components haven't come up fully, it doesn't receive any adverts and so transitions to master and sends an advert, which is then received by the real master. `vrrp_startup_delay` was added in keepalived v2.0.14, so you will need to upgrade to that or a later version.

Regarding the `Error exec-ing command`, my first guess is that the script doesn't start with `#!/bin/bash` on the first line. If that is not the case, can you please open a new issue, attach a copy of the script, a copy of your configuration, and the output of `keepalived -v`.

**Comment by dfosborne2** [comment]
@ pqarmitage - Many thanks for your help. The exec error was in fact due to the interpreter not being in place. Works a charm now.  I am noticing that vrrp advertisements dont flow into the BACKUP server until it starts sending to its peer due to receiving advertisement timeout. I am running t2.medium instances in AWS. 

/var/log/messages from the just rebooted BACKUP server:

`Apr 18 01:31:40 gsavaldlb101 Keepalived_vrrp[5249]: Opening file '/etc/keepalived/keepalived.conf'.
Apr 18 01:31:40 gsavaldlb101 Keepalived_vrrp[5249]: Assigned address 10.191.208.64 for interface eth0
Apr 18 01:31:40 gsavaldlb101 Keepalived_vrrp[5249]: Warning - script chk_manual_failover is not used
Apr 18 01:31:40 gsavaldlb101 Keepalived_vrrp[5249]: Warning - script chk_nginx_service is not used
Apr 18 01:31:40 gsavaldlb101 Keepalived_vrrp[5249]: Registering gratuitous ARP shared channel
Apr 18 01:31:40 gsavaldlb101 Keepalived_vrrp[5249]: (VI_1) removing VIPs.
Apr 18 01:31:40 gsavaldlb101 Keepalived_vrrp[5249]: Delaying startup for 20 seconds
Apr 18 01:32:00 gsavaldlb101 Keepalived_vrrp[5249]: (VI_1) Entering BACKUP STATE (init)
Apr 18 01:32:00 gsavaldlb101 Keepalived_vrrp[5249]: VRRP sockpool: [ifindex(2), family(IPv4), proto(112), unicast(1), fd(11,12)]
Apr 18 01:32:00 gsavaldlb101 Keepalived_vrrp[5249]: VRRP_Script(check_nginx) succeeded
Apr 18 01:32:00 gsavaldlb101 Keepalived_vrrp[5249]: (VI_1) Changing effective priority from 100 to 120
Apr 18 01:32:02 gsavaldlb101 nginx-ha-keepalived: Transition to state 'BACKUP' on VRRP instance 'VI_1'.
Apr 18 01:32:04 gsavaldlb101 Keepalived_vrrp[5249]: (VI_1) Receive advertisement timeout
Apr 18 01:32:04 gsavaldlb101 Keepalived_vrrp[5249]: (VI_1) Entering MASTER STATE
Apr 18 01:32:04 gsavaldlb101 Keepalived_vrrp[5249]: (VI_1) using locally configured advertisement interval (1000 milli-sec)
Apr 18 01:32:04 gsavaldlb101 Keepalived_vrrp[5249]: (VI_1) setting VIPs.
Apr 18 01:32:04 gsavaldlb101 Keepalived_vrrp[5249]: Sending gratuitous ARP on eth0 for 10.191.208.149
Apr 18 01:32:04 gsavaldlb101 Keepalived_vrrp[5249]: (VI_1) Sending/queueing gratuitous ARPs on eth0 for 10.191.208.149
Apr 18 01:32:04 gsavaldlb101 Keepalived_vrrp[5249]: Sending gratuitous ARP on eth0 for 10.191.208.149
Apr 18 01:32:04 gsavaldlb101 Keepalived_vrrp[5249]: Sending gratuitous ARP on eth0 for 10.191.208.149
Apr 18 01:32:04 gsavaldlb101 Keepalived_vrrp[5249]: Sending gratuitous ARP on eth0 for 10.191.208.149
Apr 18 01:32:04 gsavaldlb101 Keepalived_vrrp[5249]: Sending gratuitous ARP on eth0 for 10.191.208.149
Apr 18 01:32:04 gsavaldlb101 Keepalived_vrrp[5249]: (VI_1) Master received advert from 10.191.208.225 with higher priority 170, ours 120
Apr 18 01:32:04 gsavaldlb101 Keepalived_vrrp[5249]: (VI_1) Entering BACKUP STATE
Apr 18 01:32:04 gsavaldlb101 Keepalived_vrrp[5249]: (VI_1) removing VIPs.
Apr 18 01:32:05 gsavaldlb101 nginx-ha-keepalived: Transition to state 'MASTER' on VRRP instance 'VI_1'.
Apr 18 01:32:05 gsavaldlb101 nginx-ha-keepalived: Transition to state 'BACKUP' on VRRP instance 'VI_1'.`


messages on the MASTER at the same time. The "issued aws cmd" log entry below is output from the script invoked by notify_master_rx_lower_pri successfully pulling back the VIP (from BACKUP server) on the EC2 side of the house.

`Apr 18 01:32:04 gsavaldlb100 Keepalived_vrrp[5083]: (VI_1) Received advert from 10.191.208.64 with lower priority 120, ours 170, forcing new election
Apr 18 01:32:04 gsavaldlb100 Keepalived_vrrp[5083]: Sending gratuitous ARP on eth0 for 10.191.208.149
Apr 18 01:32:04 gsavaldlb100 Keepalived_vrrp[5083]: (VI_1) Sending/queueing gratuitous ARPs on eth0 for 10.191.208.149
Apr 18 01:32:04 gsavaldlb100 Keepalived_vrrp[5083]: Sending gratuitous ARP on eth0 for 10.191.208.149
Apr 18 01:32:04 gsavaldlb100 Keepalived_vrrp[5083]: Sending gratuitous ARP on eth0 for 10.191.208.149
Apr 18 01:32:04 gsavaldlb100 Keepalived_vrrp[5083]: Sending gratuitous ARP on eth0 for 10.191.208.149
Apr 18 01:32:04 gsavaldlb100 Keepalived_vrrp[5083]: Sending gratuitous ARP on eth0 for 10.191.208.149
Apr 18 01:32:07 gsavaldlb100 nginx-ha-keepalived: issued aws cmd to pull ip address as I have it on linux side of the house
Apr 18 01:32:09 gsavaldlb100 Keepalived_vrrp[5083]: Sending gratuitous ARP on eth0 for 10.191.208.149
Apr 18 01:32:09 gsavaldlb100 Keepalived_vrrp[5083]: (VI_1) Sending/queueing gratuitous ARPs on eth0 for 10.191.208.149
Apr 18 01:32:09 gsavaldlb100 Keepalived_vrrp[5083]: Sending gratuitous ARP on eth0 for 10.191.208.149
Apr 18 01:32:09 gsavaldlb100 Keepalived_vrrp[5083]: Sending gratuitous ARP on eth0 for 10.191.208.149
Apr 18 01:32:09 gsavaldlb100 Keepalived_vrrp[5083]: Sending gratuitous ARP on eth0 for 10.191.208.149
Apr 18 01:32:09 gsavaldlb100 Keepalived_vrrp[5083]: Sending gratuitous ARP on eth0 for 10.191.208.149`


The vrrp_startup_delay does work properly but it seems that the BACKUP has to initiate talks across vrrp protocol before the advertisements from the true MASTER actually make it into the BACKUP. vrrp proto 112 is opened on the firewalls to both servers. All this being said, the "smackdown" script invoked via notify_master_rx_lower_pri does take the VIP back successfully each time. 


tcpdump of vrrp on the BACKUP . You will notice that the 1st vrrp packet sent is from the BACKUP (servername ending in 101) to the MASTER (servername ending in 100)


`root@gsavaldlb101 dosborne # tcpdump vrrp
tcpdump: verbose output suppressed, use -v or -vv for full protocol decode
listening on eth0, link-type EN10MB (Ethernet), capture size 262144 bytes


01:32:04.075602 IP gsavaldlb101.REDACTED > gsavaldlb100.REDACTED: VRRPv3, Advertisement, vrid 100, prio 120, intvl 100cs, length 12
01:32:04.076570 IP gsavaldlb100.REDACTED > gsavaldlb101.REDACTED: VRRPv3, Advertisement, vrid 100, prio 170, intvl 100cs, length 12
01:32:05.077340 IP gsavaldlb100.REDACTED > gsavaldlb101.REDACTED: VRRPv3, Advertisement, vrid 100, prio 170, intvl 100cs, length 12`

Thought I'd pass along my experience. To clarify, notify_master_rx_lower_pri handles pulling the IP addresses back from the BACKUP server but real problem seems to be vrrp comm. (Or my ignorance in understanding it)

**Comment by dfosborne2** [comment]
VRRP not enabled in AWS security group. If youre here and youre using AWS, create a rule in AWS sec group. Rule should be "Custom Protocol" and value should be "112". All ports opened. Folks at NGINX could update their docs to be more explicit for AWS/clouds.

**Comment by pqarmitage** [comment]
@dfosborne2 Many thanks for the information. I have updated the INSTALL file to include the information. This will be merged upstream when I next push some code.

**Comment by suslikas** [comment]
Hi, I have bad news, workaround with SG on AWS not work. My SG configuration (112 open to both side)

![Screenshot 2019-05-10 at 14 22 15](https://user-images.githubusercontent.com/10547842/57523955-15ecac00-732f-11e9-9e70-f7c4ffafb0da.png)

**Comment by pqarmitage** [comment]
@suslikas Thanks for the update. Can you track down the cause of the problem and provide a solution that we can then add to the INSTALL file.

**Comment by suslikas** [comment]
Problem somewhere in AWS network layer. Now I checked @dfosborne2 solution and wos review [Nginx Guide](https://docs.nginx.com/nginx/deployment-guides/aws-high-availability-keepalived/#caveats) No solution on this moment, and I can't catch problem for analyzing, not enough information from log's. May be you can implement future request and add deep (debug) logging? Then I can create test system with log all network flow and may be we can find problem.

**Comment by pqarmitage** [comment]
@suslikas So far as I am aware keepalived instances successfully send adverts, but the other keepalived instances do not receive the adverts; if they did then either the advert would be processed or there would be a log entry saying what was wrong. On that basis, it is rather hard to add any logging to keepalived since the problem occurs outside the keepalived processes.

Prior to keepalived v2.0.16 if a vrrp instance was not using unicast peers it would silently ignore any send errors; since v2.0.16 this is now logged.

**Comment by suslikas** [comment]
Ok, I need some time to test, but any way, main simptoms with I found is:

if A miss B and A became MASTER, I can restart keepalived service on B and after A recover communication with B.

As I understood network problem is first reasons why A miss B, but why A and B dose try restore communication without service restart? Also I define peer's:

```
 unicast_peer {
     172.16.1.11
     172.16.1.12
 }
```

Any way, I will try reproduce problem and write some feedback.

**Comment by suslikas** [comment]
HI, i'm try solve this problem again and I want ask again about deep logging, because now in log's i see

```
root@srv-2:~# cat /var/log/syslog| grep -i keepalived
Jul 25 08:18:53 srv-2 Keepalived_vrrp[13897]: VRRP_Instance(VI_vip1) Transition to MASTER STATE
Jul 25 08:18:54 srv-2 Keepalived_vrrp[13897]: VRRP_Instance(VI_vip1) Entering MASTER STATE
Jul 25 08:18:54 srv-2 Keepalived_vrrp[13897]: Opening script file /etc/keepalived/scripts/script_vip1.sh
Jul 25 08:18:54 srv-2 Keepalived_vrrp[13897]: VRRP_Instance(VI_vip1) Received advert with higher  priority 2, ours 1
Jul 25 08:18:54 srv-2 Keepalived_vrrp[13897]: VRRP_Instance(VI_vip1) Entering BACKUP STATE
```

_Transition to MASTER STATE_ but why? who trigger this action? network or some internal logic...

**Comment by pqarmitage** [comment]
The only reason a vrrp instance can transition to master state is if it has not received a higher or equal priority advert within the timeout period. The timeout period is normally 3 advert intervals, but it can be one advert interval when keepalived starts if `state MASTER` is configured for the vrrp instance, and it can be a fraction of an advert interval if a priority 0 advert has been received.

**Comment by suslikas** [comment]
OK, than we back to network problem. Now I try to solve this with AWS Support. I update status when will receive some information. Thank you.

**Comment by dfosborne2** [comment]
Obvious question, @suslikas,  but  have you enabled VRRP on the local OS firewall for both Nginx instances?

**Comment by suslikas** [comment]
Of course, all work fine, all switches and failover works as expected. Just times to time I got false alarm when master try again execute `notify_master` or fast switch to backup and then roll back to master.

**Comment by suslikas** [comment]
I got answer from AWS Support, so, if short, my configuration is correct and AWS don't limit any protocol or network traffic, also, in same time, when I had problem not detected any anomalies... And they offered me to try analyze network flows and play with different TCP settings in OS.

**Comment by mikaku** [comment]
Hi,

I came here because I had recently the same issue (a broken vrrp) with the latest version (2.0.19) in both servers, and with the option `notify_master_rx_lower_pri` set either in the master and backup servers with the hope the master will execute such script and will gain the VIP.

Unfortunately the `notify_master_rx_lower_pri` didn't call the script, so the VIP remain pointing to the backup server.

Moreover, I have the option `nopreempt` in the backup server with the hope it will keep as master even when the master server resumes communication and forces a new election.

This is what happened:

BACKUP
```
Nov 22 12:46:49 backup Keepalived_vrrp[1144]: (VI_1) Receive advertisement timeout
Nov 22 12:46:49 backup Keepalived_vrrp[1144]: (VI_1) Entering MASTER STATE
Nov 22 12:46:49 backup Keepalived_vrrp[1144]: (VI_1) Master received advert from <master_ip> with higher priority 150, ours 50
Nov 22 12:46:49 backup Keepalived_vrrp[1144]: (VI_1) Entering BACKUP STATE
```

Why the backup server enters in the BACKUP STATE if it has set the `nopreempt` option?

MASTER
```
Nov 22 12:46:50 master Keepalived_vrrp[1146]: (VI_1) Received advert from <backup_ip> with lower priority 50, ours 150, forcing new election
```

Why the master server didn't run `notify_master_rx_lower_pri` after gaining the election?

Configuration MASTER
```
global_defs {
   router_id HAP1_L2
   script_user root root
   enable_script_security off
}

vrrp_script chk_haproxy {
   script "/usr/sbin/pidof haproxy"
   interval 2
}

vrrp_instance VI_1 {
   state MASTER
   interface eth0
   virtual_router_id 1
   priority 150
   advert_int 1

   unicast_src_ip <master_ip>
   unicast_peer {
      backup_ip
   }

   virtual_ipaddress {
      <vip>
   }
   track_script {
     chk_haproxy
   }

   notify_master "/etc/keepalived/change_to.sh master"
   notify_master_rx_lower_pri "/etc/keepalived/change_to.sh master"

   notify_backup "/etc/keepalived/change_to.sh backup"
   notify_fault "/etc/keepalived/change_to.sh fault"
}
```

Configuration BACKUP
```
   state BACKUP
   priority 50
   nopreempt

   unicast_src_ip <backup_ip>
   unicast_peer {
      master_ip
   }
```

Any help would be greatly appreciated.
