### ISSUE TITLE
keepalived cannot failover,when nic of one node is down.

### ISSUE THREAD

**Issue by eagle2016** [acassen/keepalived#827]
now, I have two node ,and I have configured  keepalived. 
1. one node, execute "ifdown  eth0"  .
2. now vip cannot find in another node.
3. env: rhel 6.5  [root@bak-finnginx1 ~]# keepalived -v
Keepalived v1.2.13 (03/19,2015)

anyone answer me ?

**Comment by pqarmitage** [comment]
In order to understand what is happening here, we need to have:
- Copies of the keepalived configurations from both nodes
- Copies of the keepalived entries in the syslog for both of your nodes at the time of execution of `ifdown eth0`

**Comment by eagle2016** [comment]
ok.
Copies of the keepalived configurations from both nodes:
one node:[root@bak-finnginx1 keepalived]# cat keepalived.conf 
global_defs {  
     notification_email {  
     fyzjhh@163.com 
     }  
     notification_email_from fyzjhh@163.com  
     smtp_server 127.0.0.1  
     smtp_connect_timeout 30  
     router_id proxysql-ha  
     }  
vrrp_script checkproxysql {
   script "/etc/keepalived/checkapp.sh"
   interval 6
   weight  2 
} 
vrrp_instance VI_2 {  
     state BACKUP   
     interface eth0  
     virtual_router_id  59 
     priority 100   
     advert_int 1  
     nopreempt  
     authentication {  
     auth_type PASS  
     auth_pass 1111  
     }  
     virtual_ipaddress {  
     10.80.41.27  
     } 
     track_script {
      checkproxysql
     } 
other node:
[root@bak-finnginx2 keepalived]# cat keepalived.conf 
global_defs {  
     notification_email {  
     fyzjhh@163.com 
     }  
     notification_email_from fyzjhh@163.com  
     smtp_server 127.0.0.1  
     smtp_connect_timeout 30  
     router_id proxysql-ha  
     }  
vrrp_script checkproxysql {
   script "/etc/keepalived/checkapp.sh"
   interval 6
   weight  2 
} 
vrrp_instance VI_2 {  
     state BACKUP   
     interface eth0  
     virtual_router_id  59 
     priority 10   
     advert_int 1  
     nopreempt  
     authentication {  
     auth_type PASS  
     auth_pass 1111  
     }  
     virtual_ipaddress {  
     10.80.41.27  
     } 
     track_script {
      checkproxysql
     } 
}

Copies of the keepalived entries in the syslog for both of your nodes at the time of execution of ifdown eth0:
message of ifdown node：
Apr  2 17:03:04 localhost NetworkManager[1526]: <info> (eth0): device state change: 8 -> 3 (reason 39)
Apr  2 17:03:04 localhost NetworkManager[1526]: <info> (eth0): deactivating device (reason: 39).
Apr  2 17:03:04 localhost Keepalived_healthcheckers[11270]: Netlink reflector reports IP 10.80.41.20 removed
Apr  2 17:03:04 localhost Keepalived_vrrp[11271]: Netlink reflector reports IP 10.80.41.20 removed
Apr  2 17:03:04 localhost Keepalived_healthcheckers[11270]: Netlink reflector reports IP 10.80.41.27 removed
Apr  2 17:03:04 localhost Keepalived_vrrp[11271]: Netlink reflector reports IP 10.80.41.27 removed
Apr  2 17:03:05 localhost ntpd[1827]: Deleting interface #11 eth0, 10.80.41.27#123, interface stats: received=0, sent=0, dropped=0, active_time=180 secs
Apr  2 17:03:05 localhost ntpd[1827]: Deleting interface #10 eth0, 10.80.41.20#123, interface stats: received=0, sent=2, dropped=0, active_time=231 secs
Apr  2 17:03:05 localhost ntpd[1827]: 10.80.36.2 interface 10.80.41.20 -> (none)
Apr  2 17:03:05 localhost ntpd[1827]: peers refreshed
other node  : 
there is no info in file of messages.

**Comment by eagle2016** [comment]
now I found another problem.
node1  and node2
at node2:  I have executed: tcpdump -i eth0 -nn vrrp
and I received some messages,as follows:
14:41:29.120503 IP 10.80.41.20 > 224.0.0.18: VRRPv2, Advertisement, vrid 59, prio 102, authtype simple, intvl 1s, length 20
14:41:30.121781 IP 10.80.41.20 > 224.0.0.18: VRRPv2, Advertisement, vrid 59, prio 102, authtype simple, intvl 1s, length 20
14:41:31.123020 IP 10.80.41.20 > 224.0.0.18: VRRPv2, Advertisement, vrid 59, prio 102, authtype simple, intvl 1s, length 20
14:41:32.124266 IP 10.80.41.20 > 224.0.0.18: VRRPv2, Advertisement, vrid 59, prio 102, authtype simple, intvl 1s, length 20
14:41:33.124707 IP 10.80.41.20 > 224.0.0.18: VRRPv2, Advertisement, vrid 59, prio 102, authtype simple, intvl 1s, length 20
14:41:34.126019 IP 10.80.41.20 > 224.0.0.18: VRRPv2, Advertisement, vrid 59, prio 102, authtype simple, intvl 1s, length 20
14:41:35.127160 IP 10.80.41.20 > 224.0.0.18: VRRPv2, Advertisement, vrid 59, prio 102, authtype simple, intvl 1s, length 20
14:41:36.128318 IP 10.80.41.20 > 224.0.0.18: VRRPv2, Advertisement, vrid 59, prio 102, authtype simple, intvl 1s, length 20

BUT , at node1,when I execute:  ifdown eth0:
I recevied the same messages 
14:41:36.128318 IP 10.80.41.20 > 224.0.0.18: VRRPv2, Advertisement, vrid 59, prio 102, authtype simple, intvl 1s, length 20,
anyone tell me cause of this scenario?

**Comment by pqarmitage** [comment]
It looks as though keepalived isn't recognising that eth0 is down, and is continuing to send VRRP advertisements.

Keepalived v1.2.13 is VERY old, and I can't remember how it handled interfaces going down; it certainly isn't reporting that it is seeing the interface going down.

Can you try executing `ip link set eth0 down` and seeing if that makes any difference.

Also if you could build and try a more recent version of keepalived, e.g. v1.2.13, you may find that it resolves your problem.

**Comment by eagle2016** [comment]
ok,I will retry the most newest version of keepalived.
If I have same trouble,and I will tell you.
thanks.

**Comment by eagle2016** [comment]
now I am downloading  V1.4.2 .

**Comment by eagle2016** [comment]
now I have tested v1.4.2. and I have find same thing.
node1: I execute ifdown eth0,  
node2 have received vrrp package from node1

**Comment by pqarmitage** [comment]
Can you see what happens if you execute `ip link set eth0 down` instead of `ifdown eth0`.

**Comment by pqarmitage** [comment]
Closing due to no response for 17 days. If the problem persists and more information becomes available this issue can be reopened.
