### ISSUE TITLE
VRRP Advertisement does not match the configuration advert_int

### ISSUE THREAD

**Issue by swimlessbird** [acassen/keepalived#2235]
**Describe the bug**
VRRP Advertisement does not match the configuration advert_int.
I set 'advert_int 5' in conf,but it send advertisement  interval is 16s.

**To Reproduce**
Any steps necessary to reproduce the behaviour:
Just start keepalived,and use tcpdump get package to host 224.0.0.18.

**Expected behavior**
advertisement  interval is 5s.

**Keepalived version**
```
Output of `keepalived -v`
Keepalived v2.2.4 (08/21,2021)

Copyright(C) 2001-2021 Alexandre Cassen, <acassen@gmail.com>

Built with kernel headers for Linux 5.10.0
Running on Linux 5.10.0-60.18.0.50.h642.eulerosv2r11.x86_64 #1 SMP Tue Dec 13 04:12:23 UTC 2022
Distro: EulerOS 2.0 (SP11x86_64)

configure options: --build=x86_64-openEuler-linux-gnu --host=x86_64-openEuler-linux-gnu --program-prefix= --disable-dependency-tracking --prefix=/usr --exec-prefix=/usr --bindir=/usr/bin --sbindir=/usr/sbin --sysconfdir=/etc --datadir=/usr/share --includedir=/usr/include --libdir=/usr/lib64 --libexecdir=/usr/libexec --localstatedir=/var --sharedstatedir=/var/lib --mandir=/usr/share/man --infodir=/usr/share/info --enable-sha1 --with-init=systemd --enable-snmp --enable-snmp-rfc build_alias=x86_64-openEuler-linux-gnu host_alias=x86_64-openEuler-linux-gnu PKG_CONFIG_PATH=:/usr/lib64/pkgconfig:/usr/share/pkgconfig CFLAGS=-O2 -g -pipe -Wall -Werror=format-security -Wp,-D_FORTIFY_SOURCE=2 -Wp,-D_GLIBCXX_ASSERTIONS -fstack-protector-strong -grecord-gcc-switches -specs=/usr/lib/rpm/generic-hardened-cc1 -m64 -mtune=generic -fasynchronous-unwind-tables -fstack-clash-protection  LDFLAGS=-Wl,-z,relro -Wl,-z,now -specs=/usr/lib/rpm/generic-hardened-ld

Config options:  LIBIPSET_DYNAMIC NFTABLES LVS VRRP VRRP_AUTH VRRP_VMAC OLD_CHKSUM_COMPAT SNMP_V3_FOR_V2 SNMP_VRRP SNMP_CHECKER SNMP_RFCV2 SNMP_RFCV3 INIT=systemd

System options:  VSYSLOG MEMFD_CREATE IPV4_DEVCONF LIBNL3 RTA_ENCAP RTA_EXPIRES RTA_NEWDST RTA_PREF FRA_SUPPRESS_PREFIXLEN FRA_SUPPRESS_IFGROUP FRA_TUN_ID RTAX_CC_ALGO RTAX_QUICKACK RTEXT_FILTER_SKIP_STATS FRA_L3MDEV FRA_UID_RANGE RTAX_FASTOPEN_NO_COOKIE RTA_VIA FRA_PROTOCOL FRA_IP_PROTO FRA_SPORT_RANGE FRA_DPORT_RANGE RTA_TTL_PROPAGATE IFA_FLAGS LWTUNNEL_ENCAP_MPLS LWTUNNEL_ENCAP_ILA IPTABLES NET_LINUX_IF_H_COLLISION LIBIPVS_NETLINK IPVS_DEST_ATTR_ADDR_FAMILY IPVS_SYNCD_ATTRIBUTES IPVS_64BIT_STATS IPVS_TUN_TYPE IPVS_TUN_CSUM IPVS_TUN_GRE VRRP_IPVLAN IFLA_LINK_NETNSID GLOB_BRACE GLOB_ALTDIRFUNC INET6_ADDR_GEN_MODE VRF SO_MARK
```

**Distro (please complete the following information):**
 - Name: [e.g. Fedora, Ubuntu] openEuler
 - Version: [e.g. 29] 22.03
 - Architecture: [e.g. x86_64]x86_64

**Details of any containerisation or hosted service (e.g. AWS)**
If keepalived is being run in a container or on a hosted service, provide full details
Master:
**Configuration file:**
```
A full copy of the configuration file, obfuscated if necessary to protect passwords and IP addresses
! Configuration File for keepalived

local_address_group laddr_g1 {
    xx.xx.xx.xx
}

vrrp_script chk_lvs {
    script "/etc/keepalived/chk_lvs.sh"
    interval 1
    weight 5
}

vrrp_instance VI_1 {
    state MASTER
    interface eth1
    virtual_router_id 22
    priority 100
    advert_int 5
    virtual_ipaddress {
        xx.xx.xx.xx
    }

    track_script {
        chk_lvs
    }

    track_interface {
        eth2
    }
}

virtual_server xx.xx.xx.xx 80 {
    delay_loop 6
    lb_algo rr
    lb_kind NAT
    protocol TCP
    laddr_group_name laddr_g1

    real_server xx.xx.xx.xx {
        weight 1
        TCP_CHECK {
            connect_port 80
            connect_timeout 5
            nb_get_retry 1
            delay_before_retry 1
        }
    }
}

Backup:
! Configuration File for keepalived

local_address_group laddr_g1 {
    xx.xx.xx.xx
}

vrrp_script chk_lvs {
    script "/etc/keepalived/chk_lvs.sh"
    interval 1
}

vrrp_instance VI_1 {
    state BACKUP
    interface eth1
    virtual_router_id 22
    priority 103
    advert_int 5
    virtual_ipaddress {
        xx.xx.xx.xx
    }

    track_script {
        chk_lvs
    }

    track_interface {
        eth2
    }
}

virtual_server xx.xx.xx.xx 80 {
    delay_loop 6
    lb_algo rr
    lb_kind NAT
    protocol TCP
    laddr_group_name laddr_g1

    real_server xx.xx.xx.xx 80 {
        weight 1
        TCP_CHECK {
            connect_port 80
            connect_timeout 5
            nb_get_retry 1
            delay_before_retry 1
        }
    }
}

```

**Notify and track scripts**
```
If any notify or track scripts are in use, please provide copies of them
not necessary
```

**System Log entries**
```
Full keepalived system log entries from when keepalived started
Dec 13 20:13:35 localhost systemd[1]: Starting LVS and VRRP High Availability Monitor...
Dec 13 20:13:35 localhost Keepalived[209302]: Starting Keepalived v2.2.4 (08/21,2021)
Dec 13 20:13:35 localhost Keepalived[209302]: Running on Linux 5.10.0-60.18.0.50.h642.oe2203.x86_64 #1 SMP Tue Dec 13 04:12:23 UTC 2022 (built for Linux 5.10.0)
Dec 13 20:13:35 localhost Keepalived[209302]: Command line: '/usr/sbin/keepalived' '-D' '--all'
Dec 13 20:13:35 localhost Keepalived[209302]: Opening file '/etc/keepalived/keepalived.conf'.
Dec 13 20:13:35 localhost Keepalived[209302]: Configuration file /etc/keepalived/keepalived.conf
Dec 13 20:13:35 localhost Keepalived[209304]: NOTICE: setting config option max_auto_priority should result in better keepalived performance
Dec 13 20:13:35 localhost Keepalived[209304]: Starting Healthcheck child process, pid=209305
Dec 13 20:13:35 localhost Keepalived[209304]: Starting VRRP child process, pid=209306
Dec 13 20:13:35 localhost Keepalived_vrrp[209306]: Registering Kernel netlink reflector
Dec 13 20:13:35 localhost Keepalived_vrrp[209306]: Registering Kernel netlink command channel
Dec 13 20:13:35 localhost Keepalived_vrrp[209306]: WARNING - default user 'keepalived_script' for script execution does not exist - please create.
Dec 13 20:13:35 localhost keepalived-start-post.sh[209307]: exec started post
Dec 13 20:13:35 localhost systemd[1]: Started LVS and VRRP High Availability Monitor.
Dec 13 20:13:35 localhost Keepalived_vrrp[209306]: SECURITY VIOLATION - scripts are being executed but script_security not enabled.
Dec 13 20:13:35 localhost Keepalived_vrrp[209306]: Assigned address xx.xx.xx.xx for interface eth1
Dec 13 20:13:35 localhost Keepalived_vrrp[209306]: Registering gratuitous ARP shared channel
Dec 13 20:13:35 localhost Keepalived_vrrp[209306]: (VI_1) removing VIPs.
Dec 13 20:13:35 localhost Keepalived_healthcheckers[209305]: Gained quorum 1+0=1 <= 1 for VS [xx.xx.xx.xx]:tcp:80
Dec 13 20:13:35 localhost Keepalived_vrrp[209306]: (VI_1) Entering BACKUP STATE (init)
Dec 13 20:13:35 localhost Keepalived[209304]: Startup complete
Dec 13 20:13:35 localhost Keepalived_vrrp[209306]: VRRP sockpool: [ifindex(  3), family(IPv4), proto(112), fd(13,14)]
Dec 13 20:13:35 localhost Keepalived_vrrp[209306]: VRRP_Script(chk_lvs) succeeded
Dec 13 20:13:35 localhost Keepalived_vrrp[209306]: (VI_1) Changing effective priority from 100 to 105
Dec 13 20:13:35 localhost [/bin/bash]: [systemctl restart keepalived.service] return code=[0], execute success by [root(uid=0)] from [pts/1 (9.2.65.56)]
Dec 13 20:13:36 localhost Keepalived_healthcheckers[209305]: TCP connection to [xx.xx.xx.xx]:tcp:80 success.
Dec 13 20:13:40 localhost Keepalived_vrrp[209306]: (VI_1) received lower priority (103) advert from xx.xx.xx.xx - discarding
```

**Did keepalived coredump?**
```
If so, can you please provide a stacktrace from the coredump, using gdb.
```

**Additional context**
tcpdump log
```
dropped privs to tcpdump
tcpdump: verbose output suppressed, use -v[v]... for full protocol decode
listening on eth1, link-type EN10MB (Ethernet), snapshot length 262144 bytes
11:16:33.907612 IP 9.82.186.114 > 224.0.0.18: VRRPv2, Advertisement, vrid 51, prio 100, authtype none, intvl 1s, length 28
11:16:34.160328 IP 22.22.23.69 > 224.0.0.18: VRRPv2, Advertisement, vrid 22, prio 100, authtype none, intvl 1s, length 20
11:16:34.160329 IP 22.22.8.178 > 224.0.0.18: VRRPv2, Advertisement, vrid 22, prio 100, authtype none, intvl 1s, length 20
11:16:34.907784 IP 9.82.186.114 > 224.0.0.18: VRRPv2, Advertisement, vrid 51, prio 100, authtype none, intvl 1s, length 28
11:16:35.161388 IP 22.22.23.69 > 224.0.0.18: VRRPv2, Advertisement, vrid 22, prio 100, authtype none, intvl 1s, length 20
11:16:35.161757 IP 22.22.8.178 > 224.0.0.18: VRRPv2, Advertisement, vrid 22, prio 100, authtype none, intvl 1s, length 20
11:16:35.908192 IP 9.82.186.114 > 224.0.0.18: VRRPv2, Advertisement, vrid 51, prio 100, authtype none, intvl 1s, length 28
11:16:36.162861 IP 22.22.23.69 > 224.0.0.18: VRRPv2, Advertisement, vrid 22, prio 100, authtype none, intvl 1s, length 20
11:16:36.163421 IP 22.22.8.178 > 224.0.0.18: VRRPv2, Advertisement, vrid 22, prio 100, authtype none, intvl 1s, length 20
11:16:36.908162 IP 9.82.186.114 > 224.0.0.18: VRRPv2, Advertisement, vrid 51, prio 100, authtype none, intvl 1s, length 28
11:16:37.164660 IP 22.22.23.69 > 224.0.0.18: VRRPv2, Advertisement, vrid 22, prio 100, authtype none, intvl 1s, length 20
11:16:37.164660 IP 22.22.8.178 > 224.0.0.18: VRRPv2, Advertisement, vrid 22, prio 100, authtype none, intvl 1s, length 20
11:16:37.908193 IP 9.82.186.114 > 224.0.0.18: VRRPv2, Advertisement, vrid 51, prio 100, authtype none, intvl 1s, length 28
11:16:38.166108 IP 22.22.23.69 > 224.0.0.18: VRRPv2, Advertisement, vrid 22, prio 100, authtype none, intvl 1s, length 20
11:16:38.166578 IP 22.22.8.178 > 224.0.0.18: VRRPv2, Advertisement, vrid 22, prio 100, authtype none, intvl 1s, length 20
11:16:38.908407 IP 9.82.186.114 > 224.0.0.18: VRRPv2, Advertisement, vrid 51, prio 100, authtype none, intvl 1s, length 28
11:16:39.167905 IP 22.22.23.69 > 224.0.0.18: VRRPv2, Advertisement, vrid 22, prio 100, authtype none, intvl 1s, length 20
11:16:39.168119 IP 22.22.8.178 > 224.0.0.18: VRRPv2, Advertisement, vrid 22, prio 100, authtype none, intvl 1s, length 20
11:16:39.908731 IP 9.82.186.114 > 224.0.0.18: VRRPv2, Advertisement, vrid 51, prio 100, authtype none, intvl 1s, length 28
11:16:40.169157 IP 22.22.23.69 > 224.0.0.18: VRRPv2, Advertisement, vrid 22, prio 100, authtype none, intvl 1s, length 20
11:16:40.169611 IP 22.22.8.178 > 224.0.0.18: VRRPv2, Advertisement, vrid 22, prio 100, authtype none, intvl 1s, length 20
11:16:40.908888 IP 9.82.186.114 > 224.0.0.18: VRRPv2, Advertisement, vrid 51, prio 100, authtype none, intvl 1s, length 28
11:16:41.171097 IP 22.22.23.69 > 224.0.0.18: VRRPv2, Advertisement, vrid 22, prio 100, authtype none, intvl 1s, length 20
11:16:41.171131 IP 22.22.8.178 > 224.0.0.18: VRRPv2, Advertisement, vrid 22, prio 100, authtype none, intvl 1s, length 20
11:16:41.908850 IP 9.82.186.114 > 224.0.0.18: VRRPv2, Advertisement, vrid 51, prio 100, authtype none, intvl 1s, length 28
11:16:42.172489 IP 22.22.23.69 > 224.0.0.18: VRRPv2, Advertisement, vrid 22, prio 100, authtype none, intvl 1s, length 20
11:16:42.172918 IP 22.22.8.178 > 224.0.0.18: VRRPv2, Advertisement, vrid 22, prio 100, authtype none, intvl 1s, length 20
11:16:42.504461 IP 22.22.93.16 > 224.0.0.18: VRRPv2, Advertisement, vrid 22, prio 103, authtype none, intvl 5s, length 20
11:16:42.504958 IP 22.22.91.178 > 224.0.0.18: VRRPv2, Advertisement, vrid 22, prio 105, authtype none, intvl 5s, length 20
11:16:42.908956 IP 9.82.186.114 > 224.0.0.18: VRRPv2, Advertisement, vrid 51, prio 100, authtype none, intvl 1s, length 28
11:16:43.506902 IP 22.22.23.69 > 224.0.0.18: VRRPv2, Advertisement, vrid 22, prio 100, authtype none, intvl 1s, length 20
11:16:43.507359 IP 22.22.8.178 > 224.0.0.18: VRRPv2, Advertisement, vrid 22, prio 100, authtype none, intvl 1s, length 20
11:16:43.909143 IP 9.82.186.114 > 224.0.0.18: VRRPv2, Advertisement, vrid 51, prio 100, authtype none, intvl 1s, length 28
11:16:44.508585 IP 22.22.23.69 > 224.0.0.18: VRRPv2, Advertisement, vrid 22, prio 100, authtype none, intvl 1s, length 20
11:16:44.508596 IP 22.22.8.178 > 224.0.0.18: VRRPv2, Advertisement, vrid 22, prio 100, authtype none, intvl 1s, length 20
11:16:44.909244 IP 9.82.186.114 > 224.0.0.18: VRRPv2, Advertisement, vrid 51, prio 100, authtype none, intvl 1s, length 28
11:16:45.510577 IP 22.22.8.178 > 224.0.0.18: VRRPv2, Advertisement, vrid 22, prio 100, authtype none, intvl 1s, length 20
11:16:45.510578 IP 22.22.23.69 > 224.0.0.18: VRRPv2, Advertisement, vrid 22, prio 100, authtype none, intvl 1s, length 20
11:16:45.909528 IP 9.82.186.114 > 224.0.0.18: VRRPv2, Advertisement, vrid 51, prio 100, authtype none, intvl 1s, length 28
11:16:46.512031 IP 22.22.23.69 > 224.0.0.18: VRRPv2, Advertisement, vrid 22, prio 100, authtype none, intvl 1s, length 20
11:16:46.909669 IP 9.82.186.114 > 224.0.0.18: VRRPv2, Advertisement, vrid 51, prio 100, authtype none, intvl 1s, length 28
11:16:47.511962 IP 22.22.23.69 > 224.0.0.18: VRRPv2, Advertisement, vrid 22, prio 100, authtype none, intvl 1s, length 20
11:16:47.910667 IP 9.82.186.114 > 224.0.0.18: VRRPv2, Advertisement, vrid 51, prio 100, authtype none, intvl 1s, length 28
11:16:48.512262 IP 22.22.23.69 > 224.0.0.18: VRRPv2, Advertisement, vrid 22, prio 100, authtype none, intvl 1s, length 20
11:16:48.910836 IP 9.82.186.114 > 224.0.0.18: VRRPv2, Advertisement, vrid 51, prio 100, authtype none, intvl 1s, length 28
11:16:49.124835 IP 22.22.93.54 > 224.0.0.18: VRRPv2, Advertisement, vrid 22, prio 99, authtype none, intvl 1s, length 20
11:16:49.911153 IP 9.82.186.114 > 224.0.0.18: VRRPv2, Advertisement, vrid 51, prio 100, authtype none, intvl 1s, length 28
11:16:50.125029 IP 22.22.93.54 > 224.0.0.18: VRRPv2, Advertisement, vrid 22, prio 99, authtype none, intvl 1s, length 20
11:16:50.911385 IP 9.82.186.114 > 224.0.0.18: VRRPv2, Advertisement, vrid 51, prio 100, authtype none, intvl 1s, length 28
11:16:51.124966 IP 22.22.93.54 > 224.0.0.18: VRRPv2, Advertisement, vrid 22, prio 99, authtype none, intvl 1s, length 20
11:16:51.911456 IP 9.82.186.114 > 224.0.0.18: VRRPv2, Advertisement, vrid 51, prio 100, authtype none, intvl 1s, length 28
11:16:52.124953 IP 22.22.93.54 > 224.0.0.18: VRRPv2, Advertisement, vrid 22, prio 99, authtype none, intvl 1s, length 20
11:16:52.911684 IP 9.82.186.114 > 224.0.0.18: VRRPv2, Advertisement, vrid 51, prio 100, authtype none, intvl 1s, length 28
11:16:53.125211 IP 22.22.93.54 > 224.0.0.18: VRRPv2, Advertisement, vrid 22, prio 99, authtype none, intvl 1s, length 20
11:16:53.911557 IP 9.82.186.114 > 224.0.0.18: VRRPv2, Advertisement, vrid 51, prio 100, authtype none, intvl 1s, length 28
11:16:54.126626 IP 22.22.23.69 > 224.0.0.18: VRRPv2, Advertisement, vrid 22, prio 100, authtype none, intvl 1s, length 20
11:16:54.129765 IP 22.22.93.54 > 224.0.0.18: VRRPv2, Advertisement, vrid 22, prio 99, authtype none, intvl 1s, length 20
11:16:54.912007 IP 9.82.186.114 > 224.0.0.18: VRRPv2, Advertisement, vrid 51, prio 100, authtype none, intvl 1s, length 28
11:16:55.129802 IP 22.22.93.54 > 224.0.0.18: VRRPv2, Advertisement, vrid 22, prio 99, authtype none, intvl 1s, length 20
11:16:55.130405 IP 22.22.23.69 > 224.0.0.18: VRRPv2, Advertisement, vrid 22, prio 100, authtype none, intvl 1s, length 20
11:16:55.912205 IP 9.82.186.114 > 224.0.0.18: VRRPv2, Advertisement, vrid 51, prio 100, authtype none, intvl 1s, length 28
11:16:56.131060 IP 22.22.23.69 > 224.0.0.18: VRRPv2, Advertisement, vrid 22, prio 100, authtype none, intvl 1s, length 20
11:16:56.131691 IP 22.22.93.54 > 224.0.0.18: VRRPv2, Advertisement, vrid 22, prio 99, authtype none, intvl 1s, length 20
11:16:56.912520 IP 9.82.186.114 > 224.0.0.18: VRRPv2, Advertisement, vrid 51, prio 100, authtype none, intvl 1s, length 28
11:16:57.132738 IP 22.22.93.54 > 224.0.0.18: VRRPv2, Advertisement, vrid 22, prio 99, authtype none, intvl 1s, length 20
11:16:57.133614 IP 22.22.8.178 > 224.0.0.18: VRRPv2, Advertisement, vrid 22, prio 100, authtype none, intvl 1s, length 20
11:16:57.133615 IP 22.22.23.69 > 224.0.0.18: VRRPv2, Advertisement, vrid 22, prio 100, authtype none, intvl 1s, length 20
11:16:57.912726 IP 9.82.186.114 > 224.0.0.18: VRRPv2, Advertisement, vrid 51, prio 100, authtype none, intvl 1s, length 28
11:16:58.106129 IP 22.22.93.16 > 224.0.0.18: VRRPv2, Advertisement, vrid 22, prio 103, authtype none, intvl 5s, length 20
11:16:58.107224 IP 22.22.91.178 > 224.0.0.18: VRRPv2, Advertisement, vrid 22, prio 105, authtype none, intvl 5s, length 20

70 packets captured
70 packets received by filter
0 packets dropped by kernel
```

**Comment by pqarmitage** [comment]
You have a keyword `laddr_group_name` in your configuration which is not a keepalived keyword. keepalived must be reporting a configuration error, although it is not show in the log entries you have provided.

I assume that the 16 second interval you are referring to is rfom 11:16:41 to 11:16:58. With an advert interval of 5 seconds and a priority of about 100, when isung VRRPv2 as you are the skew time will be approx 15.6 seconds (3 * advert int + (256 - priority) / 256). It is probably this that you are seeing, but why that is happening is not clear.

One thing that is quite strange is that the configuration that you identify as being the backup has priority 103 for the vrrp instance, whereas the other configuration (presumably for the nominal master) has a lower priority of 100. I can see that on the priority 100 system the track script is returning 5 and so the priority is increased to 105; what is not clear is whether in the backup system the priority also is reduced by 5, although it appears not since the adverts are being sent with priority 103.

You appear to have 2 virtual routers on eth1, one with VRID 22 and the other with VRID 51 (which appears not to be part of the issue).

So looking at VRID 22, you appear to have a number of problems. First of all 22.22.23.69, 22.22.8.178 and 22.22.93.54 all have advert interval 1s whereas 22.22.93.16 and 22.22.91.178 both have advert interval 5s. This is **never** going to work. After 22.22.93.16 or 22.22.91.178 sends an advert, 22.22.23.69, 22.22.8.178 and 22.22.93.54 will all time out their skew time after approx 3.5s, and since the first two have the same priority they will both become master at the same time (one will then backoff, but by then you will have already had a problem). Different instances of the same virtual router (i.e. same VRID) should **NEVER** have the same priority. You need to change the configurations so that all 4 instances use the same advert interval and also have different priorities.

Why 22.22.93.54 appears at 11:16:49, with the lowest priority of anyone, I don't understand, and also why no-one else (all of whom are higher priority) sends an advert between 11:16:49 and 11:16:53 is quite inexplicable.
 
The next problem is that none of the 5 systems appear to be seeing the adverts from any of the other systems (or at the very least 22.22.93.16, 22.22.91.178 and 22.22.93.54 are not seeing anyone else's adverts, and 22.22.93.16 is not seeing 22.22.91.178's adverts, but it looks to me as though none of them are seeing any other adverts). This looks to me like a severe network problem, although it could be down to firewalls not permitting protocol 112 (VRRP).

All the above issues need resolving first, and if you then still believe there is an issue with advert intervals, you will need to provide the full details of what is then happening and we can reopen this issue.

It would be helpful in any event if you could update this issue with what you find once the issues above are resolved, so that we, and other users, can learn from your experience.
