### ISSUE TITLE
Healthcheck child process  died

### ISSUE THREAD

**Issue by Sankaranarayanans** [acassen/keepalived#876]
[keepalived.conf.txt](https://github.com/acassen/keepalived/files/2022871/keepalived.conf.txt)
[keepalived-issue.txt](https://github.com/acassen/keepalived/files/2022872/keepalived-issue.txt)

HI

Actually, i am moving to new keepalive version v1.4.0 to achieve  ipv6 virtual server with ipv4 real server.
I have done my new version compilation and trying to start it. while starting am getting the mentioned error.

**Comment by pqarmitage** [comment]
Commit 4955985 resolved this issue. The first version this was included in v1.4.1.

Since you are upgrading your version of keepalived, it would probably be sensible to upgrade to v1.4.4. So far there have been no issues reported against v1.4.4.

**Comment by Sankaranarayanans** [comment]
Have moved to  v1.4.4 . Still IPV6 virtual_server to IPV4 real_server is not working from client side. In lvs  virtual address show as 255.255.255.255 instead of IPv6 ip. Kidly check and let me know if any config issue with my config. or do i need to install any NAT64 packages to achieve this

**Ipvsadm output**
root@l3-newversion-1~#ipvsadm -Ln
IP Virtual Server version 1.2.1 (size=4096)
Prot LocalAddress:Port Scheduler Flags
  -> RemoteAddress:Port           Forward Weight ActiveConn InActConn
TCP  **255.255.255.255:**80 sh persistent 300
  -> 172.20.16.227:80             Tunnel  1      0          0         
TCP  **255.255.255.255:443** sh persistent 300
  -> 172.20.16.227:443            Tunnel  1      0          0  

**tcpdump status**
14:08:38.342244 IP6 (hlim 64, next-header TCP (6) payload length: 40) fe80::ec4:7aff:fe55:d6e4.nimhub > **fd21:d1aa:194a:3515:0:1::.http: Flags [S]**, cksum 0xad91 (correct), seq 3299755589, win 28800, options [mss 1440,sackOK,TS val 1828813710 ecr 0,nop,wscale 7], length 0
14:08:38.342277 IP6 (hlim 64, next-header TCP (6) payload length: 20) fd21:d1aa:194a:3515:0:1::.http > **fe80::ec4:7aff:fe55:d6e4.nimhub: Flags [R.]**, cksum 0x7ac6 (incorrect -> 0x6e5d), seq 0, ack 3299755590, win 0, length 0
14:08:38.349746 IP6 (hlim 64, next-header TCP (6) payload length: 40) fe80::ec4:7aff:fe55:d6e4.nimbusdb > fd21:d1aa:194a:3515:0:1::.http: Flags [S], cksum 0x61b0 (correct), seq 3121388734, win 28800, options [mss 1440,sackOK,TS val 1828813718 ecr 0,nop,wscale 7], length 0
14:08:38.349773 IP6 (hlim 64, next-header TCP (6) payload length: 20) fd21:d1aa:194a:3515:0:1::.http > fe80::ec4:7aff:fe55:d6e4.nimbusdb: Flags [R.], cksum 0x7ac6 (incorrect -> 0x2284), seq 0, ack 3121388735, win 0, length 0
14:08:38.356569 IP6 (hlim 64, next-header TCP (6) payload length: 40) fe80::ec4:7aff:fe55:d6e4.48006 > fd21:d1aa:194a:3515:0:1::.http: Flags [S], cksum 0x2611 (correct), seq 4026114663, win 28800, options [mss 1440,sackOK,TS val 1828813725 ecr 0,nop,wscale 7], length 0


****Keepalived version****
oot@l3-newversion-1~#keepalived  -v
Keepalived v1.4.4 (05/08,2018)

Copyright(C) 2001-2018 Alexandre Cassen, <acassen@gmail.com>

Built with kernel headers for Linux 3.10.0
Running on Linux 3.10.0-693.11.6.el7.x86_64 #1 SMP Thu Jan 4 01:06:37 UTC 2018

Build options:  PIPE2 LIBNL3 RTA_ENCAP RTA_EXPIRES FRA_TUN_ID RTAX_CC_ALGO RTAX_QUICKACK FRA_OIFNAME NET_LINUX_IF_H_COLLISION LIBIPTC_LINUX_NET_IF_H_COLLISION LVS LIBIPVS_NETLINK VRRP VRRP_AUTH VRRP_VMAC SOCK_NONBLOCK SOCK_CLOEXEC O_PATH GLOB_BRACE OLD_CHKSUM_COMPAT FIB_ROUTING INET6_ADDR_GEN_MODE SO_MARK

**Ipvsadm Version**
root@l3-newversion-1~#ipvsadm -v
ipvsadm v1.29 2016/12/23 (compiled with popt and IPVS v1.2.1)

**keepalive.conf**
vrrp_sync_group VG1 {
	group {
		VI_1
		VI_GATEWAY
	}
}
vrrp_instance VI_GATEWAY {
	state EQUAL
	interface bond0
	lvs_sync_daemon_inteface bond0
	virtual_router_id 91
	priority 100
	advert_int 1
	smtp_alert
	authentication {
		auth_type PASS
		auth_pass sdasd
	}
	virtual_ipaddress {
		172.20.131.115

	}
}
vrrp_instance VI_1 {
	state EQUAL
	interface bond0
	lvs_sync_daemon_inteface bond0
	virtual_router_id 90
	priority 100
	advert_int 1
	smtp_alert
	authentication {
		auth_type PASS
		auth_pass safdasfd
	}
	virtual_ipaddress {
		fd21:d1aa:194a:3515:0:1:0:0
	}
}
virtual_server  fd21:d1aa:194a:3515:0:1:0:0 80 {
	delay_loop 10
	lb_algo sh
	lb_kind TUN
	
	persistence_timeout 300
	protocol TCP
	real_server  172.20.16.227 80 {
		weight 1
		uthreshold 0
		lthreshold 0

		MISC_CHECK {
                                        misc_path "/root/mon/http_lb.sh 172.20.16.227 80"
                                        misc_timeout 30
                                }	
	}
}
virtual_server  fd21:d1aa:194a:3515:0:1:0:0 443 {
	delay_loop 10
	lb_algo sh
	lb_kind TUN
	
	persistence_timeout 300
	protocol TCP
	real_server 172.20.16.227 443 {
		weight 1
		uthreshold 0
		lthreshold 0

		MISC_CHECK {
                                        misc_path "/root/mon/http_lb.sh 172.20.16.227 443"
                                        misc_timeout 30
                                }
	}
}

**Comment by pqarmitage** [comment]
I can reproduce the problem. For some reason the virtual servers are
not being configured with IPv6 addresses, but rather they appear to be
being interpreted by keepalived as IPv4 addresses when adding the IPVS
configuration.
I'll have a look at this later.
Quentin ARmitage

**Comment by pqarmitage** [comment]
This issue is now:

Virtual server with IPv6 address and real server with IPv4 address causes the virtual server address to be interpreted as IPv4. The virtual server IPv6 addresses are fd21:d1aa:194a:3515:0:1:0:0
```
# ipvsadm -ln
IP Virtual Server version 1.2.1 (size=4096)
Prot LocalAddress:Port Scheduler Flags
  -> RemoteAddress:Port           Forward Weight ActiveConn InActConn
TCP  255.255.255.255:80 sh persistent 300
  -> 172.20.16.227:80             Tunnel  1      0          0         
TCP  255.255.255.255:443 sh persistent 300
  -> 172.20.16.227:443            Tunnel  1      0          0  
```

**Comment by pqarmitage** [comment]
@Sankaranarayanans Can you try adding `ip_family inet6` to the virtual_server block, and report if that resolves your problem. I think there is a bug in keepalived whereby we don't set IPv6 automatically if the virtual server address is an IPv6 address.

If the problem still persists, can you check that you can configure the same IPVS setup that you want by using the `ipvsadm` command. I haven't fully understood this yet, but I'm finding that the kernel rejects some configuration when using mixed IPv6/IPv4 VS/RS configurations, although this may relate to using network namespaces.

**Comment by Sankaranarayanans** [comment]
ip_family inet6  not helped. So I have manually added via ipvsadm.

In that real server are show as mixed of ipv4 and ipv6
root@l3-newversion-1~#ipvsadm -Ln
IP Virtual Server version 1.2.1 (size=4096)
Prot LocalAddress:Port Scheduler Flags
  -> RemoteAddress:Port           Forward Weight ActiveConn InActConn
TCP  [fd21:d1aa:194a:3515:0:1::]:80 rr
  -> [**ac14:10e3:194a:3515:0:1:**:]:80 Tunnel  1      0          0         
TCP  [fd21:d1aa:194a:3515:0:1::]:443 rr
  -> [**ac14:10e3:194a:3515:0:1::**]:443 Tunnel  1      0          1  

But still IPv6 is not accessible from client side.

root@l3-newversion-1~#tcpdump -i bond0 -vv ip6
12:18:03.203234 IP6 (hlim 64, next-header TCP (6) payload length: 40) fe80::ec4:7aff:fe55:d6e4.48196 > fd21:d1aa:194a:3515:0:1::.https: Flags [S], cksum 0xb61e (correct), seq 112383472, win 28800, options [mss 1440,sackOK,TS val 1908578916 ecr 0,nop,wscale 7], length 0
12:18:03.203286 IP6 (hlim 64, next-header ICMPv6 (58) payload length: 88) fd21:d1aa:194a:3515:0:1:: > **fe80::ec4:7aff:fe55:d6e4: [icmp6 sum ok] ICMP6, destination unreachable, unreachable address fd21:d1aa:194a:3515:0:1::**
12:18:03.404842 IP6 (class 0xc0, hlim 255, next-header VRRP (112) payload length: 24) l3-newversion-1 > ff02::12: ip-proto-112 24
12:18:04.405192 IP6 (class 0xc0, hlim 255, next-header VRRP (112) payload length: 24) l3-newversion-1 > ff02::12: ip-proto-112 24

**Comment by pqarmitage** [comment]
Can you try adding the IPVS config matching the configuration file, i.e.
```
virtual_server fd21:d1aa:194a:3515:0:1:0:0 80
 real_server  172.20.16.227 80
```
and
```
virtual_server fd21:d1aa:194a:3515:0:1:0:0 443
 real_server  172.20.16.227 443
```
The first thing we need to resolve is keepalived adding the correct IPVS configuration.

**Comment by Sankaranarayanans** [comment]
root@l3-newversion-1~#ipvsadm
IP Virtual Server version 1.2.1 (size=4096)
Prot LocalAddress:Port Scheduler Flags
  -> RemoteAddress:Port           Forward Weight ActiveConn InActConn
TCP  255.255.255.255:http sh persistent 300
  -> 172.csez.zohocorpin.com:http Route   1      0          0         
TCP  255.255.255.255:https sh persistent 300
  -> 172.csez.zohocorpin.com:http Route   1      0          0         
TCP  [fd21:d1aa:194a:3515:0:1::]:http rr
  -> [ac14:10e3:194a:3515:0:1::]:http Tunnel  1      0          0         
TCP  [fd21:d1aa:194a:3515:0:1::]:https rr
  -> [ac14:10e3:194a:3515:0:1::]:https Tunnel  1      0          0

**Comment by pqarmitage** [comment]
I have push commit 05adf4f which fixes setting the address family of virtual servers, and so the virtual servers should have IPv6 addresses once you have built keepalived using this commit.

After you have incorporated the commit, can you run keepalived again and post the output of `ipvsadm -ln` and a copy of the matching configuration. Can you please also provide details of the environment you are running in, e.g. what Linux distro and version, and whether you are running keepalived in a container.

**Comment by pqarmitage** [comment]
@Sankaranarayanans You seem to keep changing your configuration, so that I cannot tell what the `ipvsadm -ln` output should be, since I do not know what configuration you are using. Can you please post your configuration (if it is not the latest configuration you have posted) whenever you post the output of `ipvsadm -ln`.

I'm assuming that the keepalived configuration is along the lines of:
```
virtual_server fd21:d1aa:194a:3515:0:1:: 80
   real_server ac14:10e3:: 80
virtual_server fd21:d1aa:194a:3515:0:1:: 443
   real_server ac14:10e3:: 443
```

If that is correct, then keepalived is correctly configuring the kernel IPVS. If the above is not your configuration, then keepalived is doing something wrong, and you will need to post the matching keepalived configuration file, the output of `ipvsadm -ln` and the system logs for keepalived.

If your keepalived configuration does match my assumption above, then it is the IPVS configuration that is not working. I suggest you try manually configuring IPVS using `ipvsadm` to set up your IPVS configuration without using keepalived, and see if that works. Once you have that working, then migrate the configuration to keepalived. If you need any help getting the IPVS configuration working, then the lvs-users mailing list, details at (http://www.linuxvirtualserver.org/mailing.html) is the place to go.

**Comment by Sankaranarayanans** [comment]
[keepalived.conf.txt](https://github.com/acassen/keepalived/files/2030665/keepalived.conf.txt)

**Comment by Sankaranarayanans** [comment]
[keepalived.conf.txt](https://github.com/acassen/keepalived/files/2030668/keepalived.conf.txt)

**Comment by pqarmitage** [comment]
@Sankaranarayanans Thanks for the configuration.

With commit 05adf4f keepalived is now configuring the virtual server IP address as IPv6. The problem is that the real server IP address is also being configured as IPv6. The reason for this is that it wasn't until Linux 3.18 that the netlink IPVS_DEST_ATTR_ADDR_FAMILY option was added, which allowed the real server address to belong to a different address family to the virtual server address family (but only for tunnelling).

Since you are using a 3.10 kernel the tunnel will need to be an IPv6 tunnel if the virtual server is IPv6.

See keepalived/check/libipvs.c function ipvs_nl_fill_dest_attr():
```
#if HAVE_DECL_IPVS_DEST_ATTR_ADDR_FAMILY
        NLA_PUT_U16(msg, IPVS_DEST_ATTR_ADDR_FAMILY, dst->af);
#endif
```
and configure.ac:
```
  dnl -- Since Linux 3.18
  AC_CHECK_DECLS([IPVS_DEST_ATTR_ADDR_FAMILY], [add_build_opt([IPVS_DEST_ATTR_ADDR_FAMILY])], [], [#include <linux/ip_vs.h>])
```

**Comment by Sankaranarayanans** [comment]
OK Thanks pqarmitage for your suggestions. I will upgrade my kernel and test

**Comment by Sankaranarayanans** [comment]
Hi

Have upgraded my kernel to  4.16. But still VS IPV6 and RS ipv4 is not working as expected

root@172.20.28.92~#uname -a
Linux 172.20.28.92 **4.16.11-1**.el7.elrepo.x86_64 #1 SMP Tue May 22 15:34:16 EDT 2018 x86_64 x86_64 x86_64 GNU/Linux
root@172.20.28.92~#keepalived -v
**Keepalived v1.4.4** (unknown)

Copyright(C) 2001-2018 Alexandre Cassen, <acassen@gmail.com>

Built with kernel headers for Linux 3.10.0
Running on Linux 4.16.11-1.el7.elrepo.x86_64 #1 SMP Tue May 22 15:34:16 EDT 2018

Build options:  PIPE2 LIBNL3 RTA_ENCAP RTA_EXPIRES FRA_TUN_ID RTAX_CC_ALGO RTAX_QUICKACK FRA_OIFNAME NET_LINUX_IF_H_COLLISION LIBIPTC_LINUX_NET_IF_H_COLLISION LVS LIBIPVS_NETLINK VRRP VRRP_AUTH VRRP_VMAC SOCK_NONBLOCK SOCK_CLOEXEC O_PATH GLOB_BRACE OLD_CHKSUM_COMPAT FIB_ROUTING INET6_ADDR_GEN_MODE SO_MARK
root@172.20.28.92~#ipvsadm -v
**ipvsadm v1.29** 2016/12/23 (compiled with popt and IPVS v1.2.1)

Keepalived.conf
global_defs {
	notification_email {
		zzzz@xxxxx
	}
	notification_email_from i1@xxxx
	smtp_server 192.168.1.16
	smtp_connect_timeout 30
	router_id LVSID01
}
vrrp_sync_group VG1 {
	group {
		VI_1
		VI_GATEWAY
	}
}
vrrp_instance VI_GATEWAY {
	state EQUAL
	interface bond0
	lvs_sync_daemon_inteface bond0
	virtual_router_id 203 
	priority 100
	advert_int 1
	smtp_alert
	authentication {
		auth_type PASS
		auth_pass dsfsdfds
	}
	virtual_ipaddress {
		172.20.1.7

	}
}
vrrp_instance VI_1 {
	state EQUAL
	interface bond0
	lvs_sync_daemon_inteface bond0
	virtual_router_id 204
	priority 100
	advert_int 1
	smtp_alert
	ip_family inet6
	authentication {
		auth_type PASS
		auth_pass sdfdsf
	}
	virtual_ipaddress {
		fd21:d1aa:194a:3515:0:1:0:0
	}
}
virtual_server  fd21:d1aa:194a:3515:0:1:0:0 80 {
	delay_loop 10
	lb_algo sh
	lb_kind TUN
	
	persistence_timeout 300
	protocol TCP
	real_server  172.20.16.227 80 {
		weight 1
		uthreshold 0
		lthreshold 0

	}
}
virtual_server  fd21:d1aa:194a:3515:0:1:0:0 443 {
	delay_loop 10
	lb_algo sh
	lb_kind TUN
	
	persistence_timeout 300
	protocol TCP
	real_server 172.20.16.227 443 {
		weight 1
		uthreshold 0
		lthreshold 0

	}
}

**Keepalived warning message**
Jun 12 11:56:10 172 Keepalived_healthcheckers[5676]: Opening file '/etc/keepalived/keepalived.conf'.
Jun 12 11:56:10 172 Keepalived_healthcheckers[5676]: Your kernel doesn't support mixed IPv4/IPv6 for virtual/real servers
Jun 12 11:56:10 172 Keepalived_healthcheckers[5676]: Your kernel doesn't support mixed IPv4/IPv6 for virtual/real servers
Jun 12 11:56:10 172 Keepalived_healthcheckers[5676]: Virtual server [fd21:d1aa:194a:3515:0:1::]:tcp:80 has no real servers - ignoring
Jun 12 11:56:10 172 Keepalived_healthcheckers[5676]: Virtual server [fd21:d1aa:194a:3515:0:1::]:tcp:443 has no real servers - ignoring


.

**Comment by pqarmitage** [comment]
The keepalived -v output shows `Built with kernel headers for Linux 3.10.0`. You need to upgrade the kernel-headers package as well as the kernel in order for keepalived to detect at build time that there is support for mixed IPv4/IPv6 tunnelling. After upgrading the kernel headers, you will need to run `configure` again, and then re-build keepalived.

**Comment by pqarmitage** [comment]
If you want keepalived to use the features of the installed kernel, then keepalvied needs to be built with the kernel headers for that kernel. When you built the 4.6.11 kernel package, there should also have been built a matching kernel-headers package, and that needs to be installed as well.

**Comment by Sankaranarayanans** [comment]
Stood. Let me clearly tell you. My updated kernel version is 4.16.11-1.el7.elrepo.x86_64. During the kernel upgrade, kernel-header is not upgraded by default. Now I have upgraded the kernel-header version to 4.9.86-30.el7.x86_64. This is the latest version available in the centos repository

root@172.20.28.92~#uname -a
Linux 172.20.28.92 **4.16.11-1.el7.elrepo.x86_64** #1 SMP Tue May 22 15:34:16 EDT 2018 x86_64 x86_64 x86_64 GNU/Linux

root@172.20.28.92~#keepalived -v
Keepalived v1.4.4 (unknown)

Copyright(C) 2001-2018 Alexandre Cassen, <acassen@gmail.com>

Built with kernel headers for **Linux 4.9.86**
Running on Linux 4.16.11-1.el7.elrepo.x86_64 #1 SMP Tue May 22 15:34:16 EDT 2018

Build options:  PIPE2 IPV4_DEVCONF LIBNL3 RTA_ENCAP RTA_EXPIRES RTA_NEWDST RTA_PREF FRA_SUPPRESS_PREFIXLEN FRA_SUPPRESS_IFGROUP FRA_TUN_ID RTAX_CC_ALGO RTAX_QUICKACK RTEXT_FILTER_SKIP_STATS FRA_L3MDEV RTA_VIA FRA_OIFNAME LWTUNNEL_ENCAP_MPLS LWTUNNEL_ENCAP_ILA LIBIPTC_LINUX_NET_IF_H_COLLISION LVS LIBIPVS_NETLINK IPVS_DEST_ATTR_ADDR_FAMILY IPVS_SYNCD_ATTRIBUTES IPVS_64BIT_STATS VRRP VRRP_AUTH VRRP_VMAC SOCK_NONBLOCK SOCK_CLOEXEC O_PATH GLOB_BRACE OLD_CHKSUM_COMPAT FIB_ROUTING INET6_ADDR_GEN_MODE SO_MARK

Jun 12 16:34:15 172 Keepalived_healthcheckers[7053]: Opening file '/etc/keepalived/keepalived.conf'.
Jun 12 16:34:15 172 Keepalived_healthcheckers[7053]: Address family of virtual server and real server 172.20.22.229 don't match - skipping real server.
Jun 12 16:34:15 172 Keepalived_healthcheckers[7053]: Address family of virtual server and real server 172.20.22.229 don't match - skipping real server.
Jun 12 16:34:15 172 Keepalived_healthcheckers[7053]: Virtual server [fd21:d1aa:194a:3515:0:1::]:tcp:80 has no real servers - ignoring
Jun 12 16:34:15 172 Keepalived_healthcheckers[7053]: Virtual server [fd21:d1aa:194a:3515:0:1::]:tcp:443 has no real servers - ignoring

**Comment by pqarmitage** [comment]
No that you have IPVS_DEST_ATTR_ADDR_FAMILY available, this can now work.

I've had a quick look at the code and I think the lb_kind is not being inherited properly by the real server from the virtual server. Can you try configuring `lvs_method TUN` in the real server and see if that helps.

**Comment by pqarmitage** [comment]
I've just tested your configuration in comment https://github.com/acassen/keepalived/issues/876#issuecomment-390909934 on my system with keepalived v1.4.4 and it works as expected. However, your configuration has clearly changed since the IPv4 address being reported is 172.20.22.229 which isn't in the configuration above.

Could you please post a copy of the latest configuration you are using so we can try and track down where the problem is.

**Comment by Sankaranarayanans** [comment]
After changing lb_kind to lvs_method keepalive worked as expected.
