### ISSUE TITLE
UDP load-balanced sessions are not updated/moved after a real server is removed/fails

### ISSUE THREAD

**Issue by alexsrb** [acassen/keepalived#2163]
**Describe the bug**
When used as an UDP round-robin load balancer, keepalived does not move ongoing session from a realserver when this realserver is removed or fails. 
Production scenario that was investigated:
- VM dedicated to load-balancing purposes.
- VIP used for listening for inbound Netflow traffic (UDP, destination port 4729)
- Round-robin distribution thereof to two Netflow processing nodes.

After the realserver to which UDP traffic was allocated is removed, the sessions are not moved to the other nodes.
This does not allow for graceful (i.e. without packets/data being lost) removal of realservers, e.g. for maintenance operations etc.

root@<redacted>:~# /sbin/ipvsadm -L -n
IP Virtual Server version 1.2.1 (size=4096)
Prot LocalAddress:Port Scheduler Flags
  -> RemoteAddress:Port           Forward Weight ActiveConn InActConn
UDP  <redacted>.6.7:4729 rr
  -> <redacted>.0.69:4729             Masq    1      0          0
  -> <redacted>.0.70:4729             Masq    1      0          0

root@<redacted>:~# tcpdump -i any 'port 4729' -n
tcpdump: data link type LINUX_SLL2
tcpdump: verbose output suppressed, use -v[v]... for full protocol decode
listening on any, link-type LINUX_SLL2 (Linux cooked v2), snapshot length 262144 bytes
14:56:41.476631 ens192 In  IP <redacted>.29.4.52753 > <redacted>.6.7.4729: UDP, length 72
14:56:41.476643 ens192 Out IP <redacted>.6.4.52753 > <redacted>.0.69.4729: UDP, length 72
14:56:42.787608 ens192 In  IP <redacted>.29.4.52753 > <redacted>.6.7.4729: UDP, length 40
14:56:42.787639 ens192 Out IP <redacted>.6.4.52753 > <redacted>.0.69.4729: UDP, length 40
14:56:55.690345 ens192 In  IP <redacted>.29.35.55823 > <redacted>.6.7.4729: UDP, length 40
14:56:55.690357 ens192 Out IP <redacted>.6.4.55823 > <redacted>.0.69.4729: UDP, length 40
14:56:58.074236 ens192 In  IP <redacted>.29.35.55823 > <redacted>.6.7.4729: UDP, length 38
14:56:58.074248 ens192 Out IP <redacted>.6.4.55823 > <redacted>.0.69.4729: UDP, length 38
14:57:03.076050 ens192 In  IP <redacted>.29.35.55823 > <redacted>.6.7.4729: UDP, length 52
14:57:03.076064 ens192 Out IP <redacted>.6.4.55823 > <redacted>.0.69.4729: UDP, length 52

root@<redacted>:~# /sbin/ipvsadm -d -u <redacted>.6.7:4729 -r <redacted>.0.69:4729

root@<redacted>:~# /sbin/ipvsadm -L -n
IP Virtual Server version 1.2.1 (size=4096)
Prot LocalAddress:Port Scheduler Flags
  -> RemoteAddress:Port           Forward Weight ActiveConn InActConn
UDP  <redacted>.6.7:4729 rr
  -> <redacted>.0.70:4729             Masq    1      0          0

root@<redacted>:~# tcpdump -i any 'port 4729' -n
tcpdump: data link type LINUX_SLL2
tcpdump: verbose output suppressed, use -v[v]... for full protocol decode
listening on any, link-type LINUX_SLL2 (Linux cooked v2), snapshot length 262144 bytes
15:41:37.816115 ens192 In  IP <redacted>.29.4.52753 > <redacted>.6.7.4729: UDP, length 72
15:41:37.816130 ens192 Out IP <redacted>.6.4.52753 > <redacted>.0.69.4729: UDP, length 72
15:41:42.759844 ens192 In  IP <redacted>.29.4.52753 > <redacted>.6.7.4729: UDP, length 40
15:41:42.759856 ens192 Out IP <redacted>.6.4.52753 > <redacted>.0.69.4729: UDP, length 40
15:41:44.117642 ens192 In  IP <redacted>.29.35.55823 > <redacted>.6.7.4729: UDP, length 38
15:41:44.117656 ens192 Out IP <redacted>.6.4.55823 > <redacted>.0.69.4729: UDP, length 38

^^^ Although the .0.69 realserver was removed, sessions are not shifted to the other realservers.

**Expected behavior**
The sessions should have been reassigned to any of the remaining realservers.

**Keepalived version**
```
Output of `keepalived -v`
```
root@<redacted>~# /usr/sbin/keepalived -v
Keepalived v2.1.5 (07/13,2020)

Copyright(C) 2001-2020 Alexandre Cassen, <acassen@gmail.com>

Built with kernel headers for Linux 5.10.70
Running on Linux 5.10.0-9-amd64 #1 SMP Debian 5.10.70-1 (2021-09-30)

configure options: --build=x86_64-linux-gnu --prefix=/usr --includedir=${prefix}/include --mandir=${prefix}/share/man --infodir=${prefix}/share/info --sysconfdir=/etc --localstatedir=/var --disable-option-checking --disable-silent-rules --libdir=${prefix}/lib/x86_64-linux-gnu --runstatedir=/run --disable-maintainer-mode --disable-dependency-tracking --with-kernel-dir=debian/ --enable-snmp --enable-sha1 --enable-snmp-rfcv2 --enable-snmp-rfcv3 --enable-dbus --enable-json --enable-bfd --enable-regex build_alias=x86_64-linux-gnu CFLAGS=-g -O2 -ffile-prefix-map=/build/keepalived-jCUlld/keepalived-2.1.5=. -fstack-protector-strong -Wformat -Werror=format-security LDFLAGS=-Wl,-z,relro CPPFLAGS=-Wdate-time -D_FORTIFY_SOURCE=2

Config options:  NFTABLES LVS REGEX VRRP VRRP_AUTH JSON BFD OLD_CHKSUM_COMPAT FIB_ROUTING SNMP_V3_FOR_V2 SNMP_VRRP SNMP_CHECKER SNMP_RFCV2 SNMP_RFCV3 DBUS

System options:  PIPE2 SIGNALFD INOTIFY_INIT1 VSYSLOG EPOLL_CREATE1 IPV4_DEVCONF IPV6_ADVANCED_API LIBNL3 RTA_ENCAP RTA_EXPIRES RTA_NEWDST RTA_PREF FRA_SUPPRESS_PREFIXLEN FRA_SUPPRESS_IFGROUP FRA_TUN_ID RTAX_CC_ALGO RTAX_QUICKACK RTEXT_FILTER_SKIP_STATS FRA_L3MDEV FRA_UID_RANGE RTAX_FASTOPEN_NO_COOKIE RTA_VIA FRA_OIFNAME FRA_PROTOCOL FRA_IP_PROTO FRA_SPORT_RANGE FRA_DPORT_RANGE RTA_TTL_PROPAGATE IFA_FLAGS IP_MULTICAST_ALL LWTUNNEL_ENCAP_MPLS LWTUNNEL_ENCAP_ILA NET_LINUX_IF_H_COLLISION LIBIPVS_NETLINK IPVS_DEST_ATTR_ADDR_FAMILY IPVS_SYNCD_ATTRIBUTES IPVS_64BIT_STATS IPVS_TUN_TYPE IPVS_TUN_CSUM IPVS_TUN_GRE VRRP_VMAC VRRP_IPVLAN IFLA_LINK_NETNSID CN_PROC SOCK_NONBLOCK SOCK_CLOEXEC O_PATH GLOB_BRACE INET6_ADDR_GEN_MODE VRF SO_MARK SCHED_RESET_ON_FORK

**Distro (please complete the following information):**
 - Name: Debian
 - Version: 11
 - Architecture: x64
root@<redacted>:~# uname -a
Linux lb-cs-2a 5.10.0-9-amd64 #1 SMP Debian 5.10.70-1 (2021-09-30) x86_64 GNU/Linux

root@<redacted>:~# lsb_release -a
No LSB modules are available.
Distributor ID: Debian
Description:    Debian GNU/Linux 11 (bullseye)
Release:        11
Codename:       bullseye

**Details of any containerisation or hosted service (e.g. AWS)**
If keepalived is being run in a container or on a hosted service, provide full details
NOT APPLICABLE

**Configuration file:**
```
A full copy of the configuration file, obfuscated if necessary to protect passwords and IP addresses
```
vrrp_instance vip2 {
    interface ens192
    version 2
    state BACKUP
    priority 150
    virtual_router_id 2
    preempt
    preempt_delay 10
    advert_int 1
    unicast_src_ip <redacted /24>.6.4
    unicast_peer {
        <redacted /24>.6.5
    }
    check_unicast_src
    track_src_ip
    authentication {
        auth_type AH
        auth_pass <redacted>
    }
    virtual_ipaddress {
        <redacted /24>.6.7
    }
    track_interface {
        ens192
    }
}

virtual_server <redacted>.6.7 4729 {
    lb_algo rr
    lb_kind NAT
    protocol UDP
    real_server <redacted /28>.0.69 4729 {
        weight 1
    }
    real_server <redacted /28>.0.70 4729 {
        weight 1
    }
}

**Notify and track scripts**
```
If any notify or track scripts are in use, please provide copies of them
```
Not applicable / not used

**System Log entries**
```
Full keepalived system log entries from when keepalived started
```
systemctl status keepalived.service
● keepalived.service - Keepalive Daemon (LVS and VRRP)
     Loaded: loaded (/lib/systemd/system/keepalived.service; enabled; vendor preset: enabled)
     Active: active (running) since Fri 2022-07-15 14:48:10 EEST; 36min ago
   Main PID: 744 (keepalived)
      Tasks: 3 (limit: 2337)
     Memory: 2.0M
        CPU: 214ms
     CGroup: /system.slice/keepalived.service
             ├─744 /usr/sbin/keepalived --dont-fork
             ├─745 /usr/sbin/keepalived --dont-fork
             └─746 /usr/sbin/keepalived --dont-fork

Jul 15 14:48:10 <redacted> Keepalived_vrrp[746]: Registering Kernel netlink reflector
Jul 15 14:48:10 <redacted> Keepalived_vrrp[746]: Registering Kernel netlink command channel
Jul 15 14:48:10 <redacted> Keepalived_vrrp[746]: Opening file '/etc/keepalived/keepalived.conf'.
Jul 15 14:48:10 <redacted> Keepalived_vrrp[746]: (/etc/keepalived/keepalived.conf: Line 66) Truncating auth_pass to 8 characters
Jul 15 14:48:10 <redacted> Keepalived_vrrp[746]: (/etc/keepalived/keepalived.conf: Line 130) Truncating auth_pass to 8 characters
Jul 15 14:48:10 <redacted> Keepalived_vrrp[746]: Registering gratuitous ARP shared channel
Jul 15 14:48:10 <redacted> Keepalived_vrrp[746]: (vip1) Entering BACKUP STATE (init)
Jul 15 14:48:10 <redacted> Keepalived_vrrp[746]: (vip2) Entering BACKUP STATE (init)
Jul 15 14:48:14 <redacted> Keepalived_vrrp[746]: (vip1) Entering MASTER STATE
Jul 15 14:48:14 <redacted> Keepalived_vrrp[746]: (vip2) Entering MASTER STATE

**Comment by pqarmitage** [comment]
This is not a keepalived issue, but rather an issue relating to IPVS in the Linux kernel. All keepalived does is add and remove virtual and real servers, just as you have done when removing the real server. It is the kernel that then handles the forwarding of the packets. The `ipvsadm -Lc` command should show you the ipvs connection table, and will probably help with understanding what the kernel is doing.

If you can sort out an IPVS configuration using ipvsadm commands that achieves what you want, then if keepalived can't set up that IPVS configuration and you post the IPVS configuration here, then we will update keepalived to be able to set it up.

Whilst you refer to UDP sessions, UDP is stateless and has no concept of sessions; each packet will be treated independently. However, since you are using masquerading (essentiall NAT), then IPVS has to maintain some state information so that it can do the necessary translation for packets in the return direction. I presume, although it is a while since I have read the kernel code for this, that the NAT entries are maintained for a while and that subsequent packets with the same IP addresses and ports will be forwarded to the same destination until the NAT entry times out.

You shouldn't really be removing real servers that keepalived has configured. keepalived can do that for you if you use checkers.
