### ISSUE TITLE
keepalived standby not receiving advertise packets

### ISSUE THREAD

**Issue by tsrinialr** [acassen/keepalived#2405]
Hi Team,

We have 2 VMs deployed on top of OpenStack platform, where keepalived is installed.

We assume, from the tcpdump, we can see the advertisement are sent from master to standby for every 5 secs. Could confirm this from the source IP address from the tcpdump packets? Are we seeing the packets sent from master in standby?

Master:

```
[root@test1 user]# ip a
1: lo: <LOOPBACK,UP,LOWER_UP> mtu 65536 qdisc noqueue state UNKNOWN group default qlen 1000
    link/loopback 00:00:00:00:00:00 brd 00:00:00:00:00:00
    inet 127.0.0.1/8 scope host lo
       valid_lft forever preferred_lft forever
    inet6 ::1/128 scope host
       valid_lft forever preferred_lft forever
2: eth0: <BROADCAST,MULTICAST,UP,LOWER_UP> mtu 1500 qdisc fq_codel state UP group default qlen 1000
    link/ether fa:16:3e:36:85:72 brd ff:ff:ff:ff:ff:ff
    altname enp1s0
    inet6 2001:420:27c1:917::420/128 scope global nodad deprecated
       valid_lft forever preferred_lft 0sec
    inet6 2001:420:27c1:917::405/64 scope global
       valid_lft forever preferred_lft forever
    inet6 **fe80::f816:3eff:fe36:8572**/64 scope link
       valid_lft forever preferred_lft forever

[root@test1 user]# tcpdump -i any -ln 'proto 112'
dropped privs to tcpdump
tcpdump: verbose output suppressed, use -v or -vv for full protocol decode
listening on any, link-type LINUX_SLL (Linux cooked v1), capture size 262144 bytes
17:02:53.480957 IP6 **fe80::f816:3eff:fe36:8572** > ff02::12: ip-proto-112 24
17:02:58.488359 IP6 fe80::f816:3eff:fe36:8572 > ff02::12: ip-proto-112 24
17:03:03.489354 IP6 fe80::f816:3eff:fe36:8572 > ff02::12: ip-proto-112 24
17:03:08.489422 IP6 fe80::f816:3eff:fe36:8572 > ff02::12: ip-proto-112 24

[root@test1 user]# kill -USR2 $(cat /var/run/.keepalived.pid)
[root@test1 user]# cat /tmp/keepalived.stats
VRRP Instance: esc_control_eth_vrrp
  Advertisements:
    Received: 0
    **Sent: 248**
  Became master: 1
  Released master: 0
  Packet Errors:
    Length: 0
    TTL: 0
    Invalid Type: 0
    Advertisement Interval: 0
    Address List: 0
  Authentication Errors:
    Invalid Type: 0
    Type Mismatch: 0
    Failure: 0
  Priority Zero:
    Received: 0
    Sent: 0

```
Standby:

```
[root@test2 esc]# ip a
1: lo: <LOOPBACK,UP,LOWER_UP> mtu 65536 qdisc noqueue state UNKNOWN group default qlen 1000
    link/loopback 00:00:00:00:00:00 brd 00:00:00:00:00:00
    inet 127.0.0.1/8 scope host lo
       valid_lft forever preferred_lft forever
    inet6 ::1/128 scope host
       valid_lft forever preferred_lft forever
2: eth0: <BROADCAST,MULTICAST,UP,LOWER_UP> mtu 1500 qdisc fq_codel state UP group default qlen 1000
    link/ether fa:16:3e:10:c8:c6 brd ff:ff:ff:ff:ff:ff
    altname enp1s0
    inet6 2001:420:27c1:917::406/64 scope global
       valid_lft forever preferred_lft forever
    inet6 **fe80::f816:3eff:fe10:c8c6**/64 scope link
       valid_lft forever preferred_lft forever

[root@test2 user]# tcpdump -i any -ln 'proto 112'
dropped privs to tcpdump
tcpdump: verbose output suppressed, use -v or -vv for full protocol decode
listening on any, link-type LINUX_SLL (Linux cooked v1), capture size 262144 bytes
17:03:02.850573 IP6 **fe80::f816:3eff:fe10:c8c6** > ff02::12: ip-proto-112 24
17:03:07.850638 IP6 fe80::f816:3eff:fe10:c8c6 > ff02::12: ip-proto-112 24
17:03:12.850710 IP6 fe80::f816:3eff:fe10:c8c6 > ff02::12: ip-proto-112 24
17:03:17.850818 IP6 fe80::f816:3eff:fe10:c8c6 > ff02::12: ip-proto-112 24
17:03:22.851046 IP6 fe80::f816:3eff:fe10:c8c6 > ff02::12: ip-proto-112 24

[root@test2 user]# cat /tmp/keepalived.stats
VRRP Instance: esc_control_eth_vrrp
  Advertisements:
    **Received: 0**					------> Nothing is received, though is it sent from master
    Sent: 246
  Became master: 2
  Released master: 1
  Packet Errors:
    Length: 0
    TTL: 0
    Invalid Type: 0
    Advertisement Interval: 0
    Address List: 0
  Authentication Errors:
    Invalid Type: 0
    Type Mismatch: 0
    Failure: 0
  Priority Zero:
    Received: 0
    Sent: 1

```
But standby is not receiving the advertisement from master and getting "Receive advertisement timeout". Due to this, the standby node is trying to become master.

```
2024-04-16T17:14:14.784099+00:00 test2 Keepalived_vrrp[30366]: VRRP_Script(kad_check_esc) succeeded
2024-04-16T17:14:14.784444+00:00 test2 Keepalived_vrrp[30366]: (esc_control_eth_vrrp) Entering BACKUP STATE
2024-04-16T17:14:32.812257+00:00 test2 Keepalived_vrrp[30366]: (esc_control_eth_vrrp) **Receive advertisement timeout**
2024-04-16T17:14:32.812619+00:00 test2 Keepalived_vrrp[30366]: (esc_control_eth_vrrp) **Entering MASTER STATE**
2024-04-16T17:14:32.812701+00:00 test2 Keepalived_vrrp[30366]: (esc_control_eth_vrrp) using locally configured advertisement interval (5000 milli-sec)
2024-04-16T17:14:32.812774+00:00 test2 Keepalived_vrrp[30366]: (esc_control_eth_vrrp) setting VIPs.
2024-04-16T17:14:32.812826+00:00 test2 Keepalived_vrrp[30366]: (esc_control_eth_vrrp) Sending/queueing Unsolicited Neighbour Adverts on eth0 for 2001:420:27c1:917::420

```
When keepalived is started, it seems the multicast forwarding is enabled for eth0 in ff02::12

In both Master & standby:

```
[root@test1 user]# netstat -g
IPv6/IPv4 Group Memberships
Interface       RefCnt Group
--------------- ------ ---------------------
lo              1      224.0.0.1
eth0            1      224.0.0.1
lo              1      ff02::1
lo              1      ff01::1
eth0            1      ff02::1:ff00:420
eth0            1      **ff02::12**
eth0            1      ff02::1:3
eth0            1      ff02::1:ff00:405
eth0            1      ff02::1:ff36:8572
eth0            1      ff02::1
eth0            1      ff01::1

```
FYI, firewall (iptables & ip6tables) is disabled in both the nodes. Selinux is also disabled.

Keepalived version:

```
Keepalived v2.1.5 (07/13,2020)

Copyright(C) 2001-2020 Alexandre Cassen, <acassen@gmail.com>

Built with kernel headers for Linux 4.18.0
Running on Linux 4.18.0-477.27.2.el8_8.x86_64 #1 SMP Sat Oct 7 08:59:50 UTC 2023

configure options: --build=x86_64-redhat-linux-gnu --host=x86_64-redhat-linux-gnu --program-prefix= --disable-dependency-tracking --prefix=/usr --exec-prefix=/usr --bindir=/usr/bin --sbindir=/usr/sbin --sysconfdir=/etc --datadir=/usr/share --includedir=/usr/include --libdir=/usr/lib64 --libexecdir=/usr/libexec --localstatedir=/var --sharedstatedir=/var/lib --mandir=/usr/share/man --infodir=/usr/share/info --disable-libiptc --disable-ipset --enable-snmp --enable-snmp-rfc --enable-sha1 --with-init=systemd build_alias=x86_64-redhat-linux-gnu host_alias=x86_64-redhat-linux-gnu PKG_CONFIG_PATH=:/usr/lib64/pkgconfig:/usr/share/pkgconfig CFLAGS=-O2 -g -pipe -Wall -Werror=format-security -Wp,-D_FORTIFY_SOURCE=2 -Wp,-D_GLIBCXX_ASSERTIONS -fexceptions -fstack-protector-strong -grecord-gcc-switches -specs=/usr/lib/rpm/redhat/redhat-hardened-cc1 -specs=/usr/lib/rpm/redhat/redhat-annobin-cc1 -m64 -mtune=generic -fasynchronous-unwind-tables -fstack-clash-protection -fcf-protection LDFLAGS=-Wl,-z,relro -Wl,-z,now -specs=/usr/lib/rpm/redhat/redhat-hardened-ld

Config options:  LVS VRRP VRRP_AUTH OLD_CHKSUM_COMPAT FIB_ROUTING SNMP_V3_FOR_V2 SNMP_VRRP SNMP_CHECKER SNMP_RFCV2 SNMP_RFCV3

System options:  PIPE2 SIGNALFD INOTIFY_INIT1 VSYSLOG EPOLL_CREATE1 IPV4_DEVCONF IPV6_ADVANCED_API LIBNL3 RTA_ENCAP RTA_EXPIRES RTA_NEWDST RTA_PREF FRA_SUPPRESS_PREFIXLEN FRA_SUPPRESS_IFGROUP FRA_TUN_ID RTAX_CC_ALGO RTAX_QUICKACK RTEXT_FILTER_SKIP_STATS FRA_L3MDEV FRA_UID_RANGE RTAX_FASTOPEN_NO_COOKIE RTA_VIA FRA_OIFNAME FRA_PROTOCOL FRA_IP_PROTO FRA_SPORT_RANGE FRA_DPORT_RANGE RTA_TTL_PROPAGATE IFA_FLAGS IP_MULTICAST_ALL LWTUNNEL_ENCAP_MPLS LWTUNNEL_ENCAP_ILA NET_LINUX_IF_H_COLLISION LIBIPTC_LINUX_NET_IF_H_COLLISION LIBIPVS_NETLINK IPVS_DEST_ATTR_ADDR_FAMILY IPVS_SYNCD_ATTRIBUTES IPVS_64BIT_STATS VRRP_VMAC VRRP_IPVLAN IFLA_LINK_NETNSID CN_PROC SOCK_NONBLOCK SOCK_CLOEXEC O_PATH GLOB_BRACE INET6_ADDR_GEN_MODE VRF SO_MARK SCHED_RESET_ON_FORK

```
Let us know the the possible reason for the advertisement packets received in interface but not to keepalived.

Regards,
Srini

**Comment by tsrinialr** [comment]
Please ignore this, this seems to be a setup issue in the underlying OpenStack platform where multicast messages are not sent between the VMs.
