### ISSUE TITLE
keepalived fails to switch last node to master state in nopreempt mode with 3 nodes

### ISSUE THREAD

**Issue by suichangyin** [acassen/keepalived#2323]
**Describe the bug**
We have 3 keepalived nodes, and all running in BACKUP and nopreempt mode with same priority.
the 2 and 3 node are switching to master mode, and the 1 can't switch to master for a long time...

**To Reproduce**
vrrp_scipt must configure with ipv4、all BACKUP、nopreempt.

**Expected behavior**
all 3 nodes can switch to master mode.

**Keepalived version**
```
[root@node31 ~]# keepalived -v
Keepalived v2.2.8 (04/04,2023), git commit v2.2.7-154-g292b299e+

and v2.0.20, v1.3.5, and so on...
```

**Distro (please complete the following information):**
 - Name: centos
 - Version: 7.9
 - Architecture: x86_64

**Details of any containerisation or hosted service (e.g. AWS)**
root     1380458  0.0  0.0 139160  1532 ?        Ss   10:18   0:00 keepalived -P -f /var/lib/keepalived/keepalived.conf -p /var/lib/keepalived/9cfc7986-1c10-46f5-923c-7a62cc2f6cfd.pid.keepalived -r /var/lib/keepalived/9cfc7986-1c10-46f5-923c-7a62cc2f6cfd.pid.keepalived-vrrp -D
root     1380459  0.0  0.0 141284  2992 ?        S    10:18   0:00 keepalived -P -f /var/lib/keepalived/9cfc7986-1c10-46f5-923c-7a62cc2f6cfd/keepalived.conf -p /var/lib/keepalived/9cfc7986-1c10-46f5-923c-7a62cc2f6cfd.pid.keepalived -r /var/lib/keepalived/9cfc7986-1c10-46f5-923c-7a62cc2f6cfd.pid.keepalived-vrrp -D

**Configuration file:**
```
node1:
keepalived.conf
`global_defs {
    notification_email_from xja@kde.com
    router_id kde
}

vrrp_script ha_health_check {
    script "/var/lib/keepalived/ha_check_script.sh"
    interval 5
    fall 2
    rise 2
}

vrrp_instance VR_112 {
    state BACKUP
    interface ha-267f3d18-96
    virtual_router_id 112
    priority 50
    garp_master_delay 60
    nopreempt
    advert_int 2
    track_interface {
        ha-267f3d18-96
    }
    virtual_ipaddress {
        169.254.0.112/24 dev ha-267f3d18-96
    }
    virtual_ipaddress_excluded {
        10.0.100.4/24 dev qg-35cf863e-08 no_track
        fe80::f816:3eff:fe33:5d52/64 dev qg-35cf863e-08 scope link no_track
    }
    virtual_routes {
        0.0.0.0/0 via 10.0.100.1 dev qg-35cf863e-08 no_track
    }
    track_script {
        ha_health_check
    }
}`
```

**Notify and track scripts**
```
`#!/bin/bash -eu
ip a | grep 10.0.100.4 || exit 0
ping -c 1 -w 1 10.0.100.1 1>/dev/null || exit 1`
```

**System Log entries**
```
It can be seen from the packet capture that the master is only switched before 2 and 3.

10:58:12.127846 IP 169.254.192.2 > 224.0.0.18: VRRPv2, Advertisement, vrid 112, prio 50, authtype none, intvl 2s, length 20
10:58:14.127926 IP 169.254.192.2 > 224.0.0.18: VRRPv2, Advertisement, vrid 112, prio 50, authtype none, intvl 2s, length 20
10:58:16.127973 IP 169.254.192.2 > 224.0.0.18: VRRPv2, Advertisement, vrid 112, prio 50, authtype none, intvl 2s, length 20
10:58:18.128018 IP 169.254.192.2 > 224.0.0.18: VRRPv2, Advertisement, vrid 112, prio 50, authtype none, intvl 2s, length 20
10:58:19.595283 IP 169.254.192.2 > 224.0.0.18: VRRPv2, Advertisement, vrid 112, prio 0, authtype none, intvl 2s, length 20
10:58:19.595295 IP 169.254.192.2 > 224.0.0.18: VRRPv2, Advertisement, vrid 112, prio 0, authtype none, intvl 2s, length 20
10:58:20.400125 IP 169.254.192.3 > 224.0.0.18: VRRPv2, Advertisement, vrid 112, prio 50, authtype none, intvl 2s, length 20
10:58:20.400489 IP 169.254.192.1 > 224.0.0.18: VRRPv2, Advertisement, vrid 112, prio 50, authtype none, intvl 2s, length 20
10:58:20.401323 IP 169.254.192.3 > 224.0.0.18: VRRPv2, Advertisement, vrid 112, prio 50, authtype none, intvl 2s, length 20
10:58:22.401588 IP 169.254.192.3 > 224.0.0.18: VRRPv2, Advertisement, vrid 112, prio 50, authtype none, intvl 2s, length 20
10:58:24.401674 IP 169.254.192.3 > 224.0.0.18: VRRPv2, Advertisement, vrid 112, prio 50, authtype none, intvl 2s, length 20
10:58:26.401751 IP 169.254.192.3 > 224.0.0.18: VRRPv2, Advertisement, vrid 112, prio 50, authtype none, intvl 2s, length 20
10:58:28.401819 IP 169.254.192.3 > 224.0.0.18: VRRPv2, Advertisement, vrid 112, prio 50, authtype none, intvl 2s, length 20
10:58:29.321198 IP 169.254.192.3 > 224.0.0.18: VRRPv2, Advertisement, vrid 112, prio 0, authtype none, intvl 2s, length 20
10:58:29.321238 IP 169.254.192.3 > 224.0.0.18: VRRPv2, Advertisement, vrid 112, prio 0, authtype none, intvl 2s, length 20
10:58:30.126273 IP 169.254.192.1 > 224.0.0.18: VRRPv2, Advertisement, vrid 112, prio 50, authtype none, intvl 2s, length 20
10:58:30.126664 IP 169.254.192.2 > 224.0.0.18: VRRPv2, Advertisement, vrid 112, prio 50, authtype none, intvl 2s, length 20
10:58:30.127055 IP 169.254.192.2 > 224.0.0.18: VRRPv2, Advertisement, vrid 112, prio 50, authtype none, intvl 2s, length 20
10:58:32.127354 IP 169.254.192.2 > 224.0.0.18: VRRPv2, Advertisement, vrid 112, prio 50, authtype none, intvl 2s, length 20
10:58:34.127960 IP 169.254.192.2 > 224.0.0.18: VRRPv2, Advertisement, vrid 112, prio 50, authtype none, intvl 2s, length 20
10:58:36.128171 IP 169.254.192.2 > 224.0.0.18: VRRPv2, Advertisement, vrid 112, prio 50, authtype none, intvl 2s, length 20
10:58:38.128242 IP 169.254.192.2 > 224.0.0.18: VRRPv2, Advertisement, vrid 112, prio 50, authtype none, intvl 2s, length 20
10:58:39.597886 IP 169.254.192.2 > 224.0.0.18: VRRPv2, Advertisement, vrid 112, prio 0, authtype none, intvl 2s, length 20
10:58:39.597938 IP 169.254.192.2 > 224.0.0.18: VRRPv2, Advertisement, vrid 112, prio 0, authtype none, intvl 2s, length 20
10:58:40.402718 IP 169.254.192.3 > 224.0.0.18: VRRPv2, Advertisement, vrid 112, prio 50, authtype none, intvl 2s, length 20
10:58:40.403524 IP 169.254.192.1 > 224.0.0.18: VRRPv2, Advertisement, vrid 112, prio 50, authtype none, intvl 2s, length 20
10:58:40.403881 IP 169.254.192.3 > 224.0.0.18: VRRPv2, Advertisement, vrid 112, prio 50, authtype none, intvl 2s, length 20
10:58:42.404108 IP 169.254.192.3 > 224.0.0.18: VRRPv2, Advertisement, vrid 112, prio 50, authtype none, intvl 2s, length 20
10:58:44.404178 IP 169.254.192.3 > 224.0.0.18: VRRPv2, Advertisement, vrid 112, prio 50, authtype none, intvl 2s, length 20
10:58:46.404252 IP 169.254.192.3 > 224.0.0.18: VRRPv2, Advertisement, vrid 112, prio 50, authtype none, intvl 2s, length 20
10:58:48.404327 IP 169.254.192.3 > 224.0.0.18: VRRPv2, Advertisement, vrid 112, prio 50, authtype none, intvl 2s, length 20
10:58:49.322000 IP 169.254.192.3 > 224.0.0.18: VRRPv2, Advertisement, vrid 112, prio 0, authtype none, intvl 2s, length 20
10:58:49.322032 IP 169.254.192.3 > 224.0.0.18: VRRPv2, Advertisement, vrid 112, prio 0, authtype none, intvl 2s, length 20
10:58:50.127103 IP 169.254.192.1 > 224.0.0.18: VRRPv2, Advertisement, vrid 112, prio 50, authtype none, intvl 2s, length 20
10:58:50.127452 IP 169.254.192.2 > 224.0.0.18: VRRPv2, Advertisement, vrid 112, prio 50, authtype none, intvl 2s, length 20
10:58:50.128156 IP 169.254.192.2 > 224.0.0.18: VRRPv2, Advertisement, vrid 112, prio 50, authtype none, intvl 2s, length 20
10:58:52.128623 IP 169.254.192.2 > 224.0.0.18: VRRPv2, Advertisement, vrid 112, prio 50, authtype none, intvl 2s, length 20
10:58:54.128723 IP 169.254.192.2 > 224.0.0.18: VRRPv2, Advertisement, vrid 112, prio 50, authtype none, intvl 2s, length 20
10:58:56.128817 IP 169.254.192.2 > 224.0.0.18: VRRPv2, Advertisement, vrid 112, prio 50, authtype none, intvl 2s, length 20
10:58:58.128907 IP 169.254.192.2 > 224.0.0.18: VRRPv2, Advertisement, vrid 112, prio 50, authtype none, intvl 2s, length 20
10:58:59.595942 IP 169.254.192.2 > 224.0.0.18: VRRPv2, Advertisement, vrid 112, prio 0, authtype none, intvl 2s, length 20
10:58:59.595981 IP 169.254.192.2 > 224.0.0.18: VRRPv2, Advertisement, vrid 112, prio 0, authtype none, intvl 2s, length 20
10:59:00.400774 IP 169.254.192.3 > 224.0.0.18: VRRPv2, Advertisement, vrid 112, prio 50, authtype none, intvl 2s, length 20
10:59:00.401890 IP 169.254.192.1 > 224.0.0.18: VRRPv2, Advertisement, vrid 112, prio 50, authtype none, intvl 2s, length 20
```

**Did keepalived coredump?**
```
If so, can you please provide a stacktrace from the coredump, using gdb.
```

**Additional context**
i change the track scripts to ipv6, and it looks like it will work fine.
`#!/bin/bash -eu
ip a | grep fe80::f816:3eff:fe33:5d52 || exit 0
ping -c 1 -w 1 10.0.100.1 1>/dev/null || exit 1`

**Comment by pqarmitage** [comment]
It is bad practice to have VRRP instances with the same VRID having the same priority. You can see the problem at 10:58:19.595283. keepalived on 169.254.192.2 is shutdown, so it sends priority 0 adverts. You are running VRRPv2, so the timeout after receiving a priority 0 advert to taking over as master is (256 - priority) / 256 seconds, i.e. between 2/256 and 255/256 of a second, and in your case with priority 50 it is 206/256 of a second. When you have equal priority VRRP instances, they will both attempt to become master at the same time, which is why you can see both 169.254.192.1 and 169.254.192.3 sending adverts at 10:58:20.400. The VRRP RFCs state that if a master receives an advert with equal priority to its own adverts, and if the sender's IP address is greater that the IP address the local VRRP instance is using, then the local VRRP instance must revert to backup mode

So when 169.254.192.2 stops being master, both 169.254.192.1 and .3 become master and then .1 reverts to backup mode. Later, when .3 stops being master both .1 and .2 become master, but then .1 reverts to backup mode because the .2 address is higher.

So what you are observing is correct behaviour.

Configuring the same priority on different nodes is essentially a configuration error, but the VRRP RFC has a workaround so that there is defined behaviour in the case of this particular error. `nopreempt` can never work with equal priorities configured. RFC5798 (the current VRRP RFC) states `Preempt_mode: Controls whether a (starting or restarting) higher-priority Backup router preempts a lower-priority Master router`, so it does not deal with equal priority routers.

If you fix your configuration so that the nodes have different priorities, then `nopreempt` will work.
