### ISSUE TITLE
VRRP Advertisement Packets are not sent out with source address as the user-configured link-local address

### ISSUE THREAD

**Issue by arulkumar9690** [acassen/keepalived#1932]
**Describe the bug**
Create a VLAN interface and it consists of the system assigned link local address. Create a virtual group and assign the virtal-address to create a vmac-sub-interface.

Example: Create a VLAN 100 (br100) and configure a vrrp-group with group id 1 and assign the virtal-address to create a vmac sub interface(br100.v1) 

Now configure a link-local address to the parent interface (br100). 

VRRP advertisement packets are sent out with source address as system assigned link-local address instead of user assigned link-local address

**To Reproduce**

Step 1:

Create a VLAN (br100). Configure a vrrp-group and virtual addreess to create vmac sub interface (br100.v1). In tcpdump we can notice that the VRRP Advertisement packets are sent out with source address as system assigned link-local address (fe80::92b1:1cff:fef4:999f)

**_ifconfig br100_**

br100: flags=4419<UP,BROADCAST,RUNNING,PROMISC,MULTICAST>  mtu 1500
        inet 11.1.1.1  netmask 255.255.255.0  broadcast 11.1.1.255
        inet6 1111::1  prefixlen 64  scopeid 0x0<global>
        inet6 **fe80::92b1:1cff:fef4:999f**  prefixlen 64  scopeid 0x20<link>
        ether 90:b1:1c:f4:99:9f  txqueuelen 1000  (Ethernet)
        RX packets 2546  bytes 117568 (114.8 KiB)
        RX errors 0  dropped 0  overruns 0  frame 0
        TX packets 865  bytes 68490 (66.8 KiB)
        TX errors 0  dropped 0 overruns 0  carrier 0  collisions 0

**_ifconfig br100.v1_**

br100.v1: flags=4163<UP,BROADCAST,RUNNING,MULTICAST>  mtu 1500
        inet6 fe80::200:5eff:fe00:201  prefixlen 64  scopeid 0x20<link>
        inet6 1111::ffff  prefixlen 128  scopeid 0x0<global>
        inet6 **fe80::92b1:1cff:fef4:999f**  prefixlen 64  scopeid 0x20<link>
        ether 00:00:5e:00:02:01  txqueuelen 1000  (Ethernet)
        RX packets 26  bytes 1560 (1.5 KiB)
        RX errors 0  dropped 0  overruns 0  frame 0
        TX packets 855  bytes 67294 (65.7 KiB)
        TX errors 0  dropped 0 overruns 0  carrier 0  collisions 0

**_tcpdump -i br100.v1_**

tcpdump: verbose output suppressed, use -v or -vv for full protocol decode
listening on br100.v1, link-type EN10MB (Ethernet), capture size 262144 bytes
05:04:28.626981 IP6 fe80::92b1:1cff:fef4:999f > ff02::12: ip-proto-112 24
05:04:29.627255 IP6 fe80::92b1:1cff:fef4:999f > ff02::12: ip-proto-112 24
05:04:30.627527 IP6 fe80::92b1:1cff:fef4:999f > ff02::12: ip-proto-112 24
05:04:31.627770 IP6 fe80::92b1:1cff:fef4:999f > ff02::12: ip-proto-112 24
05:04:32.628059 IP6 fe80::92b1:1cff:fef4:999f > ff02::12: ip-proto-112 24
05:04:33.628356 IP6 fe80::92b1:1cff:fef4:999f > ff02::12: ip-proto-112 24
05:04:34.628686 IP6 fe80::92b1:1cff:fef4:999f > ff02::12: ip-proto-112 24
05:04:35.628964 IP6 fe80::92b1:1cff:fef4:999f > ff02::12: ip-proto-112 24

Step 2:
Now we configure the link-local address(fe80::abcd/64) to parent interface(br100). The configured link-local address(fe80::abcd/64) is not updated in vmac sub-interface(br100.v1). The vmac sub-interface still has the system assigned link-local address(fe80::92b1:1cff:fef4:999f). In tcpdump we can notice that the VRRP Advertisement packets are still sent out with source address as system assigned link-local address(fe80::92b1:1cff:fef4:999f) instead of user configured link-local address (fe80::abcd)

**_ifconfig br100_**

br100: flags=4419<UP,BROADCAST,RUNNING,PROMISC,MULTICAST>  mtu 1500
        inet 11.1.1.1  netmask 255.255.255.0  broadcast 11.1.1.255
        inet6 1111::1  prefixlen 64  scopeid 0x0<global>
        inet6 **fe80::abcd**  prefixlen 64  scopeid 0x20<link>
        ether 90:b1:1c:f4:99:9f  txqueuelen 1000  (Ethernet)
        RX packets 2748  bytes 126860 (123.8 KiB)
        RX errors 0  dropped 0  overruns 0  frame 0
        TX packets 1075  bytes 85214 (83.2 KiB)
        TX errors 0  dropped 0 overruns 0  carrier 0  collisions 0

**_ifconfig br100.v1_**

br100.v1: flags=4163<UP,BROADCAST,RUNNING,MULTICAST>  mtu 1500
        inet6 fe80::200:5eff:fe00:201  prefixlen 64  scopeid 0x20<link>
        inet6 1111::ffff  prefixlen 128  scopeid 0x0<global>
        inet6 **fe80::92b1:1cff:fef4:999f**  prefixlen 64  scopeid 0x20<link>
        ether 00:00:5e:00:02:01  txqueuelen 1000  (Ethernet)
        RX packets 34  bytes 2040 (1.9 KiB)
        RX errors 0  dropped 0  overruns 0  frame 0
        TX packets 1062  bytes 83440 (81.4 KiB)
        TX errors 0  dropped 0 overruns 0  carrier 0  collisions 0

**_tcpdump -i br100.v1_**

tcpdump: verbose output suppressed, use -v or -vv for full protocol decode
listening on br100.v1, link-type EN10MB (Ethernet), capture size 262144 bytes
05:08:23.682979 IP6 fe80::92b1:1cff:fef4:999f > ff02::12: ip-proto-112 24
05:08:24.683208 IP6 fe80::92b1:1cff:fef4:999f > ff02::12: ip-proto-112 24
05:08:25.683499 IP6 fe80::92b1:1cff:fef4:999f > ff02::12: ip-proto-112 24
05:08:26.683766 IP6 fe80::92b1:1cff:fef4:999f > ff02::12: ip-proto-112 24
05:08:27.684033 IP6 fe80::92b1:1cff:fef4:999f > ff02::12: ip-proto-112 24
05:08:28.684287 IP6 fe80::92b1:1cff:fef4:999f > ff02::12: ip-proto-112 24
05:08:29.684548 IP6 fe80::92b1:1cff:fef4:999f > ff02::12: ip-proto-112 24
05:08:30.684809 IP6 fe80::92b1:1cff:fef4:999f > ff02::12: ip-proto-112 24
05:08:31.685093 IP6 fe80::92b1:1cff:fef4:999f > ff02::12: ip-proto-112 24
05:08:32.685383 IP6 fe80::92b1:1cff:fef4:999f > ff02::12: ip-proto-112 24
05:08:33.685706 IP6 fe80::92b1:1cff:fef4:999f > ff02::12: ip-proto-112 24
05:08:34.685977 IP6 fe80::92b1:1cff:fef4:999f > ff02::12: ip-proto-112 24
root@test:~#

**Expected behavior**

The vmac sub-interface should have the parent interface link-local address(fe80::abcd/64) so that VRRP Neighbor advertisement will be sent out with source address as user configured link-local address(fe80::abcd)

**_ifconfig br100_**

br100: flags=4419<UP,BROADCAST,RUNNING,PROMISC,MULTICAST>  mtu 1500
        inet 11.1.1.1  netmask 255.255.255.0  broadcast 11.1.1.255
        inet6 1111::1  prefixlen 64  scopeid 0x0<global>
        inet6 **fe80::abcd**  prefixlen 64  scopeid 0x20<link>
        ether 90:b1:1c:f4:99:9f  txqueuelen 1000  (Ethernet)
        RX packets 2748  bytes 126860 (123.8 KiB)
        RX errors 0  dropped 0  overruns 0  frame 0
        TX packets 1075  bytes 85214 (83.2 KiB)
        TX errors 0  dropped 0 overruns 0  carrier 0  collisions 0

**_ifconfig br100.v1_**

br100.v1: flags=4163<UP,BROADCAST,RUNNING,MULTICAST>  mtu 1500
        inet6 fe80::200:5eff:fe00:201  prefixlen 64  scopeid 0x20<link>
        inet6 1111::ffff  prefixlen 128  scopeid 0x0<global>
        inet6 **fe80::abcd**  prefixlen 64  scopeid 0x20<link>
        ether 00:00:5e:00:02:01  txqueuelen 1000  (Ethernet)
        RX packets 34  bytes 2040 (1.9 KiB)
        RX errors 0  dropped 0  overruns 0  frame 0
        TX packets 1062  bytes 83440 (81.4 KiB)
        TX errors 0  dropped 0 overruns 0  carrier 0  collisions 0

**Keepalived version**

Keepalived v2.0.19 (07/05,2021), git commit integration_good_build_6120-2-g8ca902f+

Copyright(C) 2001-2021 Alexandre Cassen, <acassen@gmail.com>

Built with kernel headers for Linux 4.19.37
Running on Linux 4.19.171 #99999d SMP Debian 4.19.171-2

configure options: --build=x86_64-linux-gnu --prefix=/usr --includedir=${prefix}/include --mandir=${prefix}/share/man --infodir=${prefix}/share/info --sysconfdir=/etc --localstatedir=/var --disable-silent-rules --libdir=${prefix}/lib/x86_64-linux-gnu --libexecdir=${prefix}/lib/x86_64-linux-gnu --disable-maintainer-mode --disable-dependency-tracking --with-kernel-dir=debian/ --enable-snmp --enable-sha1 --enable-snmp-rfcv2 --enable-snmp-rfcv3 --enable-dbus --enable-json --enable-bfd build_alias=x86_64-linux-gnu CFLAGS=-g -O2 -fdebug-prefix-map=/mnt/repos/open-source-keepalived=. -fstack-protector-strong -Wformat -Werror=format-security LDFLAGS=-Wl,-z,relro CPPFLAGS=-Wdate-time -D_FORTIFY_SOURCE=2

Config options:  NFTABLES LVS VRRP VRRP_AUTH JSON BFD OLD_CHKSUM_COMPAT FIB_ROUTING SNMP_V3_FOR_V2 SNMP_VRRP SNMP_CHECKER SNMP_RFCV2 SNMP_RFCV3 DBUS

System options:  PIPE2 SIGNALFD INOTIFY_INIT1 VSYSLOG EPOLL_CREATE1 IPV4_DEVCONF IPV6_ADVANCED_API LIBNL3 RTA_ENCAP RTA_EXPIRES RTA_NEWDST RTA_PREF FRA_SUPPRESS_PREFIXLEN FRA_SUPPRESS_IFGROUP FRA_TUN_ID RTAX_CC_ALGO RTAX_QUICKACK RTEXT_FILTER_SKIP_STATS FRA_L3MDEV FRA_UID_RANGE RTAX_FASTOPEN_NO_COOKIE RTA_VIA FRA_OIFNAME FRA_PROTOCOL FRA_IP_PROTO FRA_SPORT_RANGE FRA_DPORT_RANGE RTA_TTL_PROPAGATE IFA_FLAGS IP_MULTICAST_ALL LWTUNNEL_ENCAP_MPLS LWTUNNEL_ENCAP_ILA NET_LINUX_IF_H_COLLISION LIBIPTC_LINUX_NET_IF_H_COLLISION LIBIPVS_NETLINK IPVS_DEST_ATTR_ADDR_FAMILY IPVS_SYNCD_ATTRIBUTES IPVS_64BIT_STATS VRRP_VMAC VRRP_IPVLAN IFLA_LINK_NETNSID CN_PROC SOCK_NONBLOCK SOCK_CLOEXEC O_PATH GLOB_BRACE INET6_ADDR_GEN_MODE VRF SO_MARK SCHED_RT SCHED_RESET_ON_FORK

**Configuration file:**

_/etc/keepalived/keepalived.default.conf_

instance default
global_defs {
  vrrp_version 3
  enable_dbus
  dbus_service_name org.keepaliveddefault
  vrrp_bfd_status_pipe_name keepalived.default.bfd_status
  vrrp_netlink_cmd_rcv_bufs 31457280
  vrrp_netlink_cmd_rcv_bufs_force
  vrrp_netlink_monitor_rcv_bufs 31457280
  vrrp_netlink_monitor_rcv_bufs_force
}
#st_br100_v6_1
vrrp_instance br100_v6_1 {
  state BACKUP
  interface br100
  virtual_router_id 1
  priority 110
  advert_int 1.000000
  use_vmac br100.v1
  virtual_ipaddress {
    1111::ffff
  }
}
#end_br100_v6_1

**System Log entries**

Jul 08 04:49:47 3866 Keepalived[9265]: Starting Keepalived v2.0.19 (07/05,2021), git commit integration_good_build_6120-2-g8ca902f+
Jul 08 04:49:47 3866 Keepalived[9265]: Running on Linux 4.19.171 #99999d SMP Debian 4.19.171-2 (built for Linux 4.19.37)
Jul 08 04:49:47 3866 Keepalived[9265]: Command line: 'keepalived' '-P' '-f' '/etc/keepalived/keepalived.default.conf'
Jul 08 04:49:47 3866 Keepalived[9265]: Opening file '/etc/keepalived/keepalived.default.conf'.
Jul 08 04:49:47 3866 Keepalived[9265]: Changing syslog ident to Keepalived_default
Jul 08 04:49:47 3866 Keepalived_default[9266]: Starting VRRP child process, pid=9267
Jul 08 04:49:47 3866 Keepalived_vrrp_default[9267]: Registering Kernel netlink reflector
Jul 08 04:49:47 3866 Keepalived_vrrp_default[9267]: Registering Kernel netlink command channel
Jul 08 04:49:47 3866 Keepalived_vrrp_default[9267]: Opening file '/etc/keepalived/keepalived.default.conf'.
Jul 08 04:49:47 3866 Keepalived_vrrp_default[9267]: Acquired DBus bus org.keepaliveddefault
Jul 08 04:49:47 3866 Keepalived_vrrp_default[9267]: Acquired the name org.keepaliveddefault on the session bus
Jul 08 04:49:53 3866 Keepalived_vrrp_default[9267]: Reloading
Jul 08 04:49:53 3866 Keepalived_vrrp_default[9267]: Opening file '/etc/keepalived/keepalived.default.conf'.
Jul 08 04:49:53 3866 Keepalived_vrrp_default[9267]: (br100_v6_1) the first IPv6 VIP address must be link local
Jul 08 04:49:53 3866 Keepalived_vrrp_default[9267]: (br100_v6_1): Success creating VMAC interface br100.v1
Jul 08 04:49:53 3866 Keepalived_vrrp_default[9267]: (br100.v1 - br100.v1) total priority = 105 , priority cost = 0
Jul 08 04:49:53 3866 Keepalived_vrrp_default[9267]: Registering gratuitous NDISC shared channel
Jul 08 04:49:53 3866 Keepalived_vrrp_default[9267]: (br100_v6_1) Entering BACKUP STATE (init)
Jul 08 04:49:57 3866 Keepalived_vrrp_default[9267]: (br100_v6_1) Entering MASTER STATE
Jul 08 04:49:57 3866 Keepalived_vrrp_default[9267]: (br100_v6_1) using locally configured advertisement interval (1000 milli-sec)
Jul 08 04:54:56 3866 Keepalived_vrrp_default[9267]: Printing VRRP data for process(9267) on signal
Jul 08 05:08:55 3866 Keepalived_vrrp_default[9267]: Printing VRRP data for process(9267) on signal

**Additional context**

Keepalived_data and vrrp_data : 
[Keepalived_data and vrrp_data.txt](https://github.com/acassen/keepalived/files/6782209/Keepalived_data.and.vrrp_data.txt)

**Comment by pqarmitage** [comment]
@arulkumar9690 We don't have a commit 8ca902f in our source tree, and you also appear to have uncommitted changes to the code, so we can't tell what code you are running. If you have added useful additional features to keepalived it would be much appreciated if you could submit them as pull requests so that we can consider incorporating them for other users.

The Keepalived.data looks somewhat strange. You don't appear to have an lo interface, and you also mentioned that br100 was created as a Vlan interface, and yet there is no interface that br100 was created on top of (have you moved br100 into a separate network namespace?). In addition, br100.v1 lists the fe80::200:5eff:fe00:201 address twice; so far as I am aware this is not possible.

In Keepalived.data both br100 and br100.v1 have link-local IPv6 address fe80::cdef. This does not seem to represent the scenario you have put forward above.

What is /tmp/vrrp_data? While it could be produced by a notify_fifo (or a notify_script although that would not be reliable), you don't appear to have a notify_fifo or notify_script configured.

In addition to the above your configuration has a global_defs item `vrrp_bfd_status_pipe_name` which is not a keyword that I am familiar with. I also don't recognise the log message `(br100.v1 - br100.v1) total priority = 105 , priority cost = 0`.

Now to the issue you raised, and it would help if you could explain the following points:
1. Why is the link-local source address of an advert important?
1. Can you not change the link-local address of br100 before keepalived runs?

I am investigating this further, but in the mean time your responses to the above would be helpful.

**Comment by arulkumar9690** [comment]
Please find the response below

**1.Why is the link-local source address of an advert important?**

Response:

1. Consider the following case where we have vrrp configured in 2 devices with the following configuration

_Device 1:_

root@7848:~# ifconfig br100
br100: flags=4419<UP,BROADCAST,RUNNING,PROMISC,MULTICAST>  mtu 1500
        inet 11.1.1.2  netmask 255.255.255.0  broadcast 11.1.1.255
        inet6 1111::2  prefixlen 64  scopeid 0x0<global>
        inet6 fe80::cdef  prefixlen 64  scopeid 0x20<link>
        ether 14:18:77:16:84:31  txqueuelen 1000  (Ethernet)
        RX packets 159453  bytes 9924460 (9.4 MiB)
        RX errors 0  dropped 0  overruns 0  frame 0
        TX packets 2808  bytes 236912 (231.3 KiB)
        TX errors 0  dropped 0 overruns 0  carrier 0  collisions 0

root@7848:~# ifconfig br100.v1
br100.v1: flags=4163<UP,BROADCAST,RUNNING,MULTICAST>  mtu 1500
        inet6 1111::ffff  prefixlen 128  scopeid 0x0<global>
        inet6 fe80::200:5eff:fe00:201  prefixlen 64  scopeid 0x20<link>
        inet6 fe80::cdef  prefixlen 64  scopeid 0x20<link>
        ether 00:00:5e:00:02:01  txqueuelen 1000  (Ethernet)
        RX packets 108659  bytes 143340 (139.9 KiB)
        RX errors 0  dropped 0  overruns 0  frame 0
        TX packets 2601  bytes 217474 (212.3 KiB)
        TX errors 0  dropped 0 overruns 0  carrier 0  collisions 0

root@7848:~#

Interface        Group   Priority   Prempt       State        Version    Master addr(s)                  Virtual addr
---------------------------------------------------------------------------------------------------------------------
vlan100          IPv6 1    110       true      master-state     3         fe80::cdef                      1111::ffff



_Device 2:_

root@3866:~# ifconfig br100
br100: flags=4419<UP,BROADCAST,RUNNING,PROMISC,MULTICAST>  mtu 1500
        inet 11.1.1.1  netmask 255.255.255.0  broadcast 11.1.1.255
        inet6 1111::1  prefixlen 64  scopeid 0x0<global>
        inet6 fe80::92b1:1cff:fef4:999f  prefixlen 64  scopeid 0x20<link>
        ether 90:b1:1c:f4:99:9f  txqueuelen 1000  (Ethernet)
        RX packets 137  bytes 8784 (8.5 KiB)
        RX errors 0  dropped 0  overruns 0  frame 0
        TX packets 17  bytes 2106 (2.0 KiB)
        TX errors 0  dropped 0 overruns 0  carrier 0  collisions 0

root@3866:~# ifconfig br100.v1
br100.v1: flags=4163<UP,BROADCAST,RUNNING,MULTICAST>  mtu 1500
        inet6 fe80::92b1:1cff:fef4:999f  prefixlen 64  scopeid 0x20<link>
        inet6 fe80::200:5eff:fe00:201  prefixlen 64  scopeid 0x20<link>
        ether 00:00:5e:00:02:01  txqueuelen 1000  (Ethernet)
        RX packets 71  bytes 0 (0.0 B)
        RX errors 0  dropped 0  overruns 0  frame 0
        TX packets 10  bytes 1288 (1.2 KiB)
        TX errors 0  dropped 0 overruns 0  carrier 0  collisions 0

root@3866:~#

Interface        Group   Priority   Prempt       State        Version    Master addr(s)                  Virtual addr
---------------------------------------------------------------------------------------------------------------------
vlan100          IPv6 1    105       true      backup-state     3         fe80::cdef                      1111::ffff


**dual master is observed while doing the following confiugrations on device 2**
- configured the link-local address(fe80::abcd/64) to vlan interface 100 
- configured vrrp ipv6 group with priority 120

_Device 2:_

Keepalived logs:-

root@3866:~# journalctl -f | grep Keep
Jul 09 12:15:47 3866 Keepalived_vrrp_default[5818]: Reloading
Jul 09 12:15:47 3866 Keepalived_vrrp_default[5818]: Entered : reload_vrrp_thread
Jul 09 12:15:47 3866 Keepalived_vrrp_default[5818]: Opening file '/etc/keepalived/keepalived.default.conf'.
Jul 09 12:15:47 3866 Keepalived_vrrp_default[5818]: (br100_v6_1) the first IPv6 VIP address must be link local
Jul 09 12:15:47 3866 Keepalived_vrrp_default[5818]: (br100_v6_1) Found matching interface br100.v1
Jul 09 12:15:47 3866 Keepalived_vrrp_default[5818]: (br100.v1 - br100.v1) total priority = 120 , priority cost = 0
Jul 09 12:15:48 3866 Keepalived_vrrp_default[5818]: (br100_v6_1) received lower priority (110) advert from fe80::cdef - discarding
Jul 09 12:15:49 3866 Keepalived_vrrp_default[5818]: (br100_v6_1) received lower priority (110) advert from fe80::cdef - discarding
Jul 09 12:15:50 3866 Keepalived_vrrp_default[5818]: (br100_v6_1) received lower priority (110) advert from fe80::cdef - discarding
Jul 09 12:15:51 3866 Keepalived_vrrp_default[5818]: (br100_v6_1): send advert error 22 (Invalid argument)
Jul 09 12:15:51 3866 Keepalived_vrrp_default[5818]: (br100_v6_1) Entering MASTER STATE
Jul 09 12:15:51 3866 Keepalived_vrrp_default[5818]: (br100_v6_1) using locally configured advertisement interval (1000 milli-sec)
Jul 09 12:15:51 3866 Keepalived_vrrp_default[5818]: (br100_v6_1) Received advert from fe80::cdef with lower priority 110, ours 120, forcing new election
Jul 09 12:15:51 3866 Keepalived_vrrp_default[5818]: (br100_v6_1): send advert error 22 (Invalid argument)
Jul 09 12:15:52 3866 Keepalived_vrrp_default[5818]: (br100_v6_1) Received advert from fe80::cdef with lower priority 110, ours 120, forcing new election
Jul 09 12:15:52 3866 Keepalived_vrrp_default[5818]: (br100_v6_1): send advert error 22 (Invalid argument)
Jul 09 12:15:53 3866 Keepalived_vrrp_default[5818]: (br100_v6_1) Received advert from fe80::cdef with lower priority 110, ours 120, forcing new election
Jul 09 12:15:53 3866 Keepalived_vrrp_default[5818]: (br100_v6_1): send advert error 22 (Invalid argument)
Jul 09 12:15:54 3866 Keepalived_vrrp_default[5818]: (br100_v6_1) Received advert from fe80::cdef with lower priority 110, ours 120, forcing new election
Jul 09 12:15:54 3866 Keepalived_vrrp_default[5818]: (br100_v6_1): send advert error 22 (Invalid argument)
Jul 09 12:15:55 3866 Keepalived_vrrp_default[5818]: (br100_v6_1) Received advert from fe80::cdef with lower priority 110, ours 120, forcing new election
Jul 09 12:15:55 3866 Keepalived_vrrp_default[5818]: (br100_v6_1): send advert error 22 (Invalid argument)
Jul 09 12:15:56 3866 Keepalived_vrrp_default[5818]: (br100_v6_1) Received advert from fe80::cdef with lower priority 110, ours 120, forcing new election
Jul 09 12:15:56 3866 Keepalived_vrrp_default[5818]: (br100_v6_1): send advert error 22 (Invalid argument)
Jul 09 12:15:57 3866 Keepalived_vrrp_default[5818]: (br100_v6_1) Received advert from fe80::cdef with lower priority 110, ours 120, forcing new election
Jul 09 12:15:57 3866 Keepalived_vrrp_default[5818]: (br100_v6_1): send advert error 22 (Invalid argument)
Jul 09 12:15:58 3866 Keepalived_vrrp_default[5818]: (br100_v6_1) Received advert from fe80::cdef with lower priority 110, ours 120, forcing new election
Jul 09 12:15:58 3866 Keepalived_vrrp_default[5818]: (br100_v6_1): send advert error 22 (Invalid argument)
Jul 09 12:15:59 3866 Keepalived_vrrp_default[5818]: (br100_v6_1) Received advert from fe80::cdef with lower priority 110, ours 120, forcing new election
Jul 09 12:15:59 3866 Keepalived_vrrp_default[5818]: (br100_v6_1): send advert error 22 (Invalid argument)
Jul 09 12:16:00 3866 Keepalived_vrrp_default[5818]: (br100_v6_1) Received advert from fe80::cdef with lower priority 110, ours 120, forcing new election
Jul 09 12:16:00 3866 Keepalived_vrrp_default[5818]: (br100_v6_1): send advert error 22 (Invalid argument)
Jul 09 12:16:01 3866 Keepalived_vrrp_default[5818]: (br100_v6_1) Received advert from fe80::cdef with lower priority 110, ours 120, forcing new election
Jul 09 12:16:01 3866 Keepalived_vrrp_default[5818]: (br100_v6_1): send advert error 22 (Invalid argument)
Jul 09 12:16:02 3866 Keepalived_vrrp_default[5818]: (br100_v6_1) Received advert from fe80::cdef with lower priority 110, ours 120, forcing new election
Jul 09 12:16:02 3866 Keepalived_vrrp_default[5818]: (br100_v6_1): send advert error 22 (Invalid argument)
Jul 09 12:16:03 3866 Keepalived_vrrp_default[5818]: (br100_v6_1) Received advert from fe80::cdef with lower priority 110, ours 120, forcing new election
Jul 09 12:16:03 3866 Keepalived_vrrp_default[5818]: (br100_v6_1): send advert error 22 (Invalid argument)
Jul 09 12:16:04 3866 Keepalived_vrrp_default[5818]: (br100_v6_1) Received advert from fe80::cdef with lower priority 110, ours 120, forcing new election
Jul 09 12:16:04 3866 Keepalived_vrrp_default[5818]: (br100_v6_1): send advert error 22 (Invalid argument)
Jul 09 12:16:05 3866 Keepalived_vrrp_default[5818]: (br100_v6_1) Received advert from fe80::cdef with lower priority 110, ours 120, forcing new election
Jul 09 12:16:05 3866 Keepalived_vrrp_default[5818]: (br100_v6_1): send advert error 22 (Invalid argument)
Jul 09 12:16:06 3866 Keepalived_vrrp_default[5818]: (br100_v6_1) Received advert from fe80::cdef with lower priority 110, ours 120, forcing new election
Jul 09 12:16:06 3866 Keepalived_vrrp_default[5818]: (br100_v6_1): send advert error 22 (Invalid argument)

root@3866:~# ifconfig br100
br100: flags=4419<UP,BROADCAST,RUNNING,PROMISC,MULTICAST>  mtu 1500
        inet 11.1.1.1  netmask 255.255.255.0  broadcast 11.1.1.255
        inet6 1111::1  prefixlen 64  scopeid 0x0<global>
        inet6 fe80::abcd  prefixlen 64  scopeid 0x20<link>
        ether 90:b1:1c:f4:99:9f  txqueuelen 1000  (Ethernet)
        RX packets 1003  bytes 64320 (62.8 KiB)
        RX errors 0  dropped 0  overruns 0  frame 0
        TX packets 1238  bytes 109512 (106.9 KiB)
        TX errors 0  dropped 0 overruns 0  carrier 0  collisions 0

root@3866:~# ifconfig br100.v1
br100.v1: flags=4163<UP,BROADCAST,RUNNING,MULTICAST>  mtu 1500
        inet6 fe80::92b1:1cff:fef4:999f  prefixlen 64  scopeid 0x20<link>
        inet6 1111::ffff  prefixlen 128  scopeid 0x0<global>
        inet6 fe80::200:5eff:fe00:201  prefixlen 64  scopeid 0x20<link>
        ether 00:00:5e:00:02:01  txqueuelen 1000  (Ethernet)
        RX packets 933  bytes 0 (0.0 B)
        RX errors 0  dropped 0  overruns 0  frame 0
        TX packets 1255  bytes 110462 (107.8 KiB)
        TX errors 0  dropped 0 overruns 0  carrier 0  collisions 0

root@3866:~#

Interface        Group   Priority   Prempt       State        Version    Master addr(s)                  Virtual addr
---------------------------------------------------------------------------------------------------------------------
vlan100          IPv6 1    120       true      master-state     3         fe80::abcd                      1111::ffff

Device 1:

root@7848:~# ifconfig br100
br100: flags=4419<UP,BROADCAST,RUNNING,PROMISC,MULTICAST>  mtu 1500
        inet 11.1.1.2  netmask 255.255.255.0  broadcast 11.1.1.255
        inet6 1111::2  prefixlen 64  scopeid 0x0<global>
        inet6 fe80::cdef  prefixlen 64  scopeid 0x20<link>
        ether 14:18:77:16:84:31  txqueuelen 1000  (Ethernet)
        RX packets 2627121  bytes 185699072 (177.0 MiB)
        RX errors 0  dropped 0  overruns 0  frame 0
        TX packets 240801  bytes 18831310 (17.9 MiB)
        TX errors 0  dropped 0 overruns 0  carrier 0  collisions 0

root@7848:~# ifconfig br100.v1
br100.v1: flags=4163<UP,BROADCAST,RUNNING,MULTICAST>  mtu 1500
        inet6 1111::ffff  prefixlen 128  scopeid 0x0<global>
        inet6 fe80::200:5eff:fe00:201  prefixlen 64  scopeid 0x20<link>
        inet6 fe80::cdef  prefixlen 64  scopeid 0x20<link>
        ether 00:00:5e:00:02:01  txqueuelen 1000  (Ethernet)
        RX packets 2459852  bytes 475988 (464.8 KiB)
        RX errors 0  dropped 0  overruns 0  frame 0
        TX packets 240587  bytes 18811318 (17.9 MiB)
        TX errors 0  dropped 0 overruns 0  carrier 0  collisions 0

root@7848:~#

Interface        Group   Priority   Prempt       State        Version    Master addr(s)                  Virtual addr
---------------------------------------------------------------------------------------------------------------------
vlan100          IPv6 1    110       true      master-state     3         fe80::cdef                      1111::ffff

**Comment by arulkumar9690** [comment]
I observed the following behavior where after configuring the parent interface(br100) link-local address to the vmac sub-Interface(br100.v1). The "send advert error 22 (Invalid argument)" error message is not seen.

root@3866:~# ip address add dev br100.v1 scope link fe80::abcd/64
root@3866:~#
root@3866:~#
root@3866:~# ifconfig br100.v1
br100.v1: flags=4163<UP,BROADCAST,RUNNING,MULTICAST>  mtu 1500
        inet6 1111::ffff  prefixlen 128  scopeid 0x0<global>
        inet6 fe80::abcd  prefixlen 64  scopeid 0x20<link>
        inet6 fe80::92b1:1cff:fef4:999f  prefixlen 64  scopeid 0x20<link>
        inet6 fe80::200:5eff:fe00:201  prefixlen 64  scopeid 0x20<link>
        ether 00:00:5e:00:02:01  txqueuelen 1000  (Ethernet)
        RX packets 322  bytes 86 (86.0 B)
        RX errors 0  dropped 0  overruns 0  frame 0
        TX packets 751  bytes 65762 (64.2 KiB)
        TX errors 0  dropped 0 overruns 0  carrier 0  collisions 0

root@3866:~#

**2. Can you not change the link-local address of br100 before keepalived runs?**

Kindly confirm if this is the recommended approach is not to change the parent interface(br100) link-local address after configuring the vrrp-group.

**Comment by arulkumar9690** [comment]
Please find the reponse inline

**The Keepalived.data looks somewhat strange. You don't appear to have an lo interface, and you also mentioned that br100 was created as a Vlan interface, and yet there is no interface that br100 was created on top of (have you moved br100 into a separate network namespace?). In addition, br100.v1 lists the fe80::200:5eff:fe00:201 address twice; so far as I am aware this is not possible.**
[Response] : I copied only the br100 and br100.v1 interface data in the keepalived.data file. Please find the attached unmodified keepalived.data file 
[keepalived-data.txt](https://github.com/acassen/keepalived/files/6800435/keepalived-data.txt)


**In Keepalived.data both br100 and br100.v1 have link-local IPv6 address fe80::cdef. This does not seem to represent the scenario you have put forward above.**
[Response] : In the expected behavior I have mentioned that both br100 and br100.v1 must have the same link-local IPV6 address. Whereas in  the problem scenario br100 and br100.v1 have different link-local IPV6 Address (Please refer step 2 under "To Reproduce" heading )

**In addition to the above your configuration has a global_defs item vrrp_bfd_status_pipe_name which is not a keyword that I am familiar with. I also don't recognise the log message (br100.v1 - br100.v1) total priority = 105 , priority cost = 0.**
[Response] : I was working on a Proof of Concept, kindly ignore this keyword and log message.

**Comment by pqarmitage** [comment]
I think for the time being it is best to change the interface link local address manually before keepalived runs. I will see if I can make keepalived update the link local address on the VMAC interface to track its parent interface, although there might be some circumstances, such as if the parent interface is itself a macvlan, and its parent is in a different network namespace, where it won't be possible to track the link local address.

**Comment by pqarmitage** [comment]
Commit 4c7a94a resolves this issue. The VMAC interface will use the first IPv6 link local address that keepalived finds on the parent interface, and if the parent interface's link local address changes, then the VMAC link local address will be updated. Also, if the parent interface does not have a link local address, then keepalived will generate one for the VMAC based on the MAC address of the parent interface.
