### ISSUE TITLE
master BACKUP No election

### ISSUE THREAD

**Issue by githublaohu** [acassen/keepalived#465]
# **master configuration**
global_defs {
        notification_email {
                
        }       
        notification_email_from admin@test.com
        smtp_server 127.0.0.1
        smtp_connect_timeout 30
        router_id LVS_backup
}       

vrrp_instance mysql_1 {
    state BACKUP
    interface eth0
    virtual_router_id 61
    priority 100
    nopreempt
    advert_int 1
    authentication {
        auth_type PASS
        auth_pass 1111
    }   
    virtual_ipaddress {
	172.16.6.140
    }   
}   

# **BACKUP configuration**
global_defs {
        notification_email {
               
        }       
        notification_email_from admin@test.com
        smtp_server 127.0.0.1
        smtp_connect_timeout 30
        router_id LVS_MASTER 
}       

vrrp_instance mysql_1 {
    state BACKUP
    interface eth0
    virtual_router_id 61
    priority 100
    nopreempt
    advert_int 1
    authentication {
        auth_type PASS
        auth_pass 1111
    }   
    virtual_ipaddress {
	172.16.6.140
    }   
} 

#** master log**
Nov 23 19:42:49 localhost Keepalived_vrrp[23545]: VRRP_Instance(mysql_1) Entering BACKUP STATE
Nov 23 19:42:49 localhost Keepalived_vrrp[23545]: VRRP sockpool: [ifindex(2), proto(112), unicast(0), fd(10,11)]
Nov 23 19:42:49 localhost Keepalived_healthcheckers[23544]: Registering Kernel netlink command channel
Nov 23 19:42:49 localhost Keepalived_healthcheckers[23544]: Opening file '/etc/keepalived/keepalived.conf'.
Nov 23 19:42:49 localhost Keepalived_healthcheckers[23544]: Unknown keyword 'nat_mask'
Nov 23 19:42:49 localhost Keepalived_healthcheckers[23544]: persistent_timeout invalid
Nov 23 19:42:49 localhost Keepalived_healthcheckers[23544]: Unknown keyword 'nb_get_retry'
Nov 23 19:42:49 localhost Keepalived_healthcheckers[23544]: Unknown keyword 'nb_get_retry'
Nov 23 19:42:49 localhost Keepalived_healthcheckers[23544]: Using LinkWatch kernel netlink reflector...
Nov 23 19:42:49 localhost Keepalived_healthcheckers[23544]: Activating healthchecker for service [172.16.6.2]:3306
Nov 23 19:42:49 localhost Keepalived_healthcheckers[23544]: Activating healthchecker for service [172.16.6.3]:3306
Nov 23 19:42:52 localhost Keepalived_vrrp[23545]: VRRP_Instance(mysql_1) Transition to MASTER STATE
Nov 23 19:42:53 localhost Keepalived_vrrp[23545]: VRRP_Instance(mysql_1) Entering MASTER STATE

# **BACKUP log**
Nov 23 19:57:44 localhost Keepalived_vrrp[1171]: VRRP_Instance(mysql_1) Entering BACKUP STATE
Nov 23 19:57:44 localhost Keepalived_vrrp[1171]: VRRP sockpool: [ifindex(2), proto(112), unicast(0), fd(10,11)]
Nov 23 19:57:44 localhost Keepalived_healthcheckers[1170]: Unknown keyword 'nat_mask'
Nov 23 19:57:44 localhost Keepalived_healthcheckers[1170]: persistent_timeout invalid
Nov 23 19:57:44 localhost Keepalived_healthcheckers[1170]: Unknown keyword 'nb_get_retry'
Nov 23 19:57:44 localhost Keepalived_healthcheckers[1170]: Unknown keyword 'nb_get_retry'
Nov 23 19:57:44 localhost Keepalived_healthcheckers[1170]: Using LinkWatch kernel netlink reflector...
Nov 23 19:57:44 localhost Keepalived_healthcheckers[1170]: Activating healthchecker for service [172.16.6.2]:3306
Nov 23 19:57:44 localhost Keepalived_healthcheckers[1170]: Activating healthchecker for service [172.16.6.3]:3306
Nov 23 19:57:48 localhost Keepalived_vrrp[1171]: VRRP_Instance(mysql_1) Transition to MASTER STATE
Nov 23 19:57:49 localhost Keepalived_vrrp[1171]: VRRP_Instance(mysql_1) Entering MASTER STATE

**Comment by pqarmitage** [comment]
This configuration works for me, although clearly it is an edited version of the configuration you have used.

It would be helpful if you could provide the actual configuration you have used (albeit with any confidential email addresses, IP addresses etc CHANGED rather than removed). It would also be helpful if you could provide the complete log (the keepalived_vrrp log entries start sometime after the initialisation is complete).

Could you also please provide the version of keepalived you are using, and run keepalived with the -D option, and including all the logging output from both system from that.

As an initial guess though, it looks like the two systems aren't communication with each other, and the second keepalived instance that starts up (the backup in the example above) is not seeing any packets from the other system. For testing purposes you could try running without nopreempt, and with the 2 instances having different priorities and then seeing if they report receiving anything from each other. You could also have a look with wireshark or tcpdump to see if the systems are receiving anything with ip protocol 112 (vrrp).

**Comment by githublaohu** [comment]
#**version**
/usr/sbin/keepalived -v
Keepalived v1.3.1 (11/22,2016)

Copyright(C) 2001-2016 Alexandre Cassen, <acassen@gmail.com>

Build options:  PIPE2 FRA_OIFNAME RTAX_CC_ALGO RTAX_QUICKACK LINUX_NET_IF_H_COLLISION LVS VRRP VRRP_AUTH VRRP_VMAC SOCK_NONBLOCK SOCK_CLOEXEC FIB_ROUTING INET6_ADDR_GEN_MODE SO_MARK


# **/usr/sbin/keepalived -d**
Nov 24 09:38:10 localhost Keepalived[2312]: Starting Keepalived v1.3.1 (11/22,2016)
Nov 24 09:38:10 localhost Keepalived[2312]: WARNING - default user 'keepalived_script' for script execution does not exist - please create.
Nov 24 09:38:10 localhost Keepalived[2312]: Opening file '/etc/keepalived/keepalived.conf'.
Nov 24 09:38:10 localhost Keepalived[2312]: daemon is already running


# **tcpdump -i eth0 host 172.6.6.6**
tcpdump: verbose output suppressed, use -v or -vv for full protocol decode
listening on eth0, link-type EN10MB (Ethernet), capture size 65535 bytes
09:57:24.602828 IP 172.16.6.6 > vrrp.mcast.net: VRRPv2, Advertisement, vrid 61, prio 100, authtype simple, intvl 1s, length 20
09:57:25.603943 IP 172.16.6.6 > vrrp.mcast.net: VRRPv2, Advertisement, vrid 61, prio 100, authtype simple, intvl 1s, length 20
09:57:26.605100 IP 172.16.6.6 > vrrp.mcast.net: VRRPv2, Advertisement, vrid 61, prio 100, authtype simple, intvl 1s, length 20
09:57:27.606194 IP 172.16.6.6 > vrrp.mcast.net: VRRPv2, Advertisement, vrid 61, prio 100, authtype simple, intvl 1s, length 20
09:57:28.607388 IP 172.16.6.6 > vrrp.mcast.net: VRRPv2, Advertisement, vrid 61, prio 100, authtype simple, intvl 1s, length 20
09:57:29.608667 IP 172.16.6.6 > vrrp.mcast.net: VRRPv2, Advertisement, vrid 61, prio 100, authtype simple, intvl 1s, length 20
09:57:30.609799 IP 172.16.6.6 > vrrp.mcast.net: VRRPv2, Advertisement, vrid 61, prio 100, authtype simple, intvl 1s, length 20
09:57:31.610897 IP 172.16.6.6 > vrrp.mcast.net: VRRPv2, Advertisement, vrid 61, prio 100, authtype simple, intvl 1s, length 20
09:57:32.612071 IP 172.16.6.6 > vrrp.mcast.net: VRRPv2, Advertisement, vrid 61, prio 100, authtype simple, intvl 1s, length 20
09:57:33.613117 IP 172.16.6.6 > vrrp.mcast.net: VRRPv2, Advertisement, vrid 61, prio 100, authtype simple, intvl 1s, length 20
09:57:34.614260 IP 172.16.6.6 > vrrp.mcast.net: VRRPv2, Advertisement, vrid 61, prio 100, authtype simple, intvl 1s, length 20


# **Disable nopreempt results**

**Comment by pqarmitage** [comment]
Unfortunately the new log doesn't show the startup of keepallived, it just says that another instance of keepalived was running, and it then exited.

The tcpdump output shows only outgoing VRRP packets, and none being received. If the keepalived instance was running on your other system at the same time, then they are not receiving each others VRRP packets. This would mean that you have a networking problem, or perhaps iptables isn't configured to allow ip protocol 112, and suggests that it is not a keepalived issue.

I'm not clear what you intended to add after the Disable nopreempt results heading!

**Comment by githublaohu** [comment]
I put the firewall closed, still can't choose the Lord.
    systemctl disable firewalld

**Comment by pqarmitage** [comment]
If we are to be able to move this problem forward, we need the full logs as previously requested, indicating whether they are logs for master or backup, and also the tcpdump output (please filter on proto 112 rather than IP address) again from both master and backup, and indicating which is which.

**Comment by pqarmitage** [comment]
Closing due to no response for over 3 months.
