### ISSUE TITLE
Large Failover transition delay (few minutes!) - when using vmac

### ISSUE THREAD

**Issue by rozmanro1** [acassen/keepalived#1510]
Hi all,
I'm using a custom built linux kernel , built by using Buildroot.
kernel version -  4.19.19
keepalived version - 2.0.15

**My keepalived setup:**

Device_A|-------->|SWITCH|<--------|Device_B|
And |PC| connected to the SWITCH pinging the virtual VRRP address.
NO physical connection between the devices.
Device_A: 10.0.254.20
Device_B: 10.0.254.30
VIP: 10.0.254.3
LAN PC: 10.0.254.100

Device_A:

! Configuration File for keepalived

global_defs {
   vrrp_version 3
}

vrrp_instance VI_1 {
    interface eth4
    virtual_router_id 50
    priority 250
    advert_int 1
    preempt
    use_vmac

    virtual_ipaddress {
        10.0.254.3
    }
}

 

Device_B:

! Configuration File for keepalived

global_defs {
   vrrp_version 3
}

vrrp_instance VI_1 {

    interface eth4
    virtual_router_id 50
    priority 50
    advert_int 1
    preempt
    use_vmac
 
    virtual_ipaddress {
        10.0.254.3
    }
}

**The problem**
Whether it's on failover switching between device A to B or when keepalived was shutdown and started again.
It takes **5 mins** (!!) for traffic to start going / pings to start getting the reply...
the arp -a output shows that the MAC is being learned properly and fast.(GARP sent by vrrp device)
But still no ICMP packets until 5 min passed.

**When use_vmac is not in use there is no such issue!**

**Expected behavior**
Immediate fail over switch.

**tcpdump logs**
**Device_A (Master)**
**First 5 minutes dump:** (ARP packets every 45 seconds)

15:29:25.916768 IP 10.0.254.20 > 224.0.0.18: VRRPv3, Advertisement, vrid 50, prio 250, intvl 100cs, length 12
15:29:26.916901 IP 10.0.254.20 > 224.0.0.18: VRRPv3, Advertisement, vrid 50, prio 250, intvl 100cs, length 12
15:29:27.917038 IP 10.0.254.20 > 224.0.0.18: VRRPv3, Advertisement, vrid 50, prio 250, intvl 100cs, length 12
15:29:28.917171 IP 10.0.254.20 > 224.0.0.18: VRRPv3, Advertisement, vrid 50, prio 250, intvl 100cs, length 12
15:29:29.917305 IP 10.0.254.20 > 224.0.0.18: VRRPv3, Advertisement, vrid 50, prio 250, intvl 100cs, length 12
15:29:30.917443 IP 10.0.254.20 > 224.0.0.18: VRRPv3, Advertisement, vrid 50, prio 250, intvl 100cs, length 12
15:29:31.917595 IP 10.0.254.20 > 224.0.0.18: VRRPv3, Advertisement, vrid 50, prio 250, intvl 100cs, length 12
15:29:32.917725 IP 10.0.254.20 > 224.0.0.18: VRRPv3, Advertisement, vrid 50, prio 250, intvl 100cs, length 12
15:29:33.286676 ARP, Request who-has 10.0.254.3 tell 10.0.254.100, length 46
15:29:33.286757 ARP, Reply 10.0.254.3 is-at 00:00:5e:00:01:32 (oui IANA), length 28
15:29:33.917850 IP 10.0.254.20 > 224.0.0.18: VRRPv3, Advertisement, vrid 50, prio 250, intvl 100cs, length 12
15:29:34.917969 IP 10.0.254.20 > 224.0.0.18: VRRPv3, Advertisement, vrid 50, prio 250, intvl 100cs, length 12
15:29:35.918103 IP 10.0.254.20 > 224.0.0.18: VRRPv3, Advertisement, vrid 50, prio 250, intvl 100cs, length 12
15:29:36.918244 IP 10.0.254.20 > 224.0.0.18: VRRPv3, Advertisement, vrid 50, prio 250, intvl 100cs, length 12
15:29:37.918382 IP 10.0.254.20 > 224.0.0.18: VRRPv3, Advertisement, vrid 50, prio 250, intvl 100cs, length 12
15:29:38.918512 IP 10.0.254.20 > 224.0.0.18: VRRPv3, Advertisement, vrid 50, prio 250, intvl 100cs, length 12
15:29:39.918647 IP 10.0.254.20 > 224.0.0.18: VRRPv3, Advertisement, vrid 50, prio 250, intvl 100cs, length 12
15:29:40.918779 IP 10.0.254.20 > 224.0.0.18: VRRPv3, Advertisement, vrid 50, prio 250, intvl 100cs, length 12

**After 5 minutes:**

15:33:00.945788 IP 10.0.254.20 > 224.0.0.18: VRRPv3, Advertisement, vrid 50, prio 250, intvl 100cs, length 12
15:33:01.945925 IP 10.0.254.20 > 224.0.0.18: VRRPv3, Advertisement, vrid 50, prio 250, intvl 100cs, length 12
15:33:02.946060 IP 10.0.254.20 > 224.0.0.18: VRRPv3, Advertisement, vrid 50, prio 250, intvl 100cs, length 12
15:33:03.946195 IP 10.0.254.20 > 224.0.0.18: VRRPv3, Advertisement, vrid 50, prio 250, intvl 100cs, length 12
15:33:04.946333 IP 10.0.254.20 > 224.0.0.18: VRRPv3, Advertisement, vrid 50, prio 250, intvl 100cs, length 12
15:33:05.606065 IP 10.0.254.100 > 10.0.254.3: ICMP echo request, id 4236, seq 218, length 64
15:33:05.606195 IP 10.0.254.3 > 10.0.254.100: ICMP echo reply, id 4236, seq 218, length 64
15:33:05.946453 IP 10.0.254.20 > 224.0.0.18: VRRPv3, Advertisement, vrid 50, prio 250, intvl 100cs, length 12
15:33:06.617097 IP 10.0.254.100 > 10.0.254.3: ICMP echo request, id 4236, seq 219, length 64
15:33:06.617206 IP 10.0.254.3 > 10.0.254.100: ICMP echo reply, id 4236, seq 219, length 64
15:33:06.946563 IP 10.0.254.20 > 224.0.0.18: VRRPv3, Advertisement, vrid 50, prio 250, intvl 100cs, length 12
15:33:07.628146 IP 10.0.254.100 > 10.0.254.3: ICMP echo request, id 4236, seq 220, length 64
15:33:07.628251 IP 10.0.254.3 > 10.0.254.100: ICMP echo reply, id 4236, seq 220, length 64
15:33:07.946670 IP 10.0.254.20 > 224.0.0.18: VRRPv3, Advertisement, vrid 50, prio 250, intvl 100cs, length 12
15:33:08.639185 IP 10.0.254.100 > 10.0.254.3: ICMP echo request, id 4236, seq 221, length 64
15:33:08.639300 IP 10.0.254.3 > 10.0.254.100: ICMP echo reply, id 4236, seq 221, length 64
15:33:08.946770 IP 10.0.254.20 > 224.0.0.18: VRRPv3, Advertisement, vrid 50, prio 250, intvl 100cs, length 12
15:33:09.650293 IP 10.0.254.100 > 10.0.254.3: ICMP echo request, id 4236, seq 222, length 64
15:33:09.650409 IP 10.0.254.3 > 10.0.254.100: ICMP echo reply, id 4236, seq 222, length 64
15:33:09.946874 IP 10.0.254.20 > 224.0.0.18: VRRPv3, Advertisement, vrid 50, prio 250, intvl 100cs, length 12
15:33:10.617554 ARP, Request who-has 10.0.254.100 tell 10.0.254.20, length 28
15:33:10.661271 IP 10.0.254.100 > 10.0.254.3: ICMP echo request, id 4236, seq 223, length 64
15:33:10.661360 IP 10.0.254.3 > 10.0.254.100: ICMP echo reply, id 4236, seq 223, length 64

**What i tried to do**
- iptables open traffic for VRRP (in & out)
- switch reset / switch change / flush arp tables
- tried to add vmac_xmit_base parameter
- tried to tweak the sysctl parameters:
echo 1 > /proc/sys/net/ipv4/conf/all/arp_ignore
echo 1 > /proc/sys/net/ipv4/conf/all/accept_local
echo 1 > /proc/sys/net/ipv4/conf/all/arp_announce
echo 0 > /proc/sys/net/ipv4/conf/all/arp_filter
echo 0 > /proc/sys/net/ipv4/conf/all/rp_filter

echo 1 > /proc/sys/net/ipv4/conf/eth4/arp_filter
echo 1 > /proc/sys/net/ipv4/conf/eth4/arp_ignore
echo 0 > /proc/sys/net/ipv4/conf/eth4/rp_filter

echo 0 > /proc/sys/net/ipv4/conf/vrrp.50/rp_filter
echo 1 > /proc/sys/net/ipv4/conf/vrrp.50/arp_ignore
echo 1 > /proc/sys/net/ipv4/conf/vrrp.50/accept_local

What can be the problem that causing such a delay??
Thanks in advance!

**Comment by pqarmitage** [comment]
Changing the sysctl parameters shouldn't be necessary - keepalived sets what is needed itself - see vrrp_if_config.c. If any of your sysctl parameters (especially in /proc/sys/net/all) conflict with the settings in vrrp_if_config.c that could indicate a problem. If you have some unusual settings in /proc/sys/net/all that could cause a problem, but I don't see why it should suddenly start working after 5 minutes.

After a keepalived instance becomes master and before the pings start working, can you check that the VIP 10.0.254.3 is configured on the vrrp.50 interface.

If none of the above indicates any problem, then the issue may lie with the switch and its cache of which MAC addresses are on which ports. It might be that after device A becomes master, the switch takes 5 minutes to time out the old entry from when device B was master and then update the entry for 00:00:5e:00:01:32 to be on the port connected to device A. This could explain why it works when you don't use VMACs, because there isn't a MAC address moving from one port to another.

Are you able to try directly connecting device A to device B? If so, with the current setup can you try pinging 10.0.254.3 from device B when device A takes over as master and see if you still get the 5 minute delay. If you do, repeat the experiment with device A directly connected to device B. If you no longer get the delay, then that would suggest that the switch is not updating its MAC cache when device A takes over as master.

**Comment by pqarmitage** [comment]
@rozmanro1 Do you have any update on this?

**Comment by rozmanro1** [comment]
> @rozmanro1 Do you have any update on this?

Yes!
I want to update that you were right, the issue was related to the MAC-Address table of the switch(Marvell) in the devices (A & B). For some reason the vmac 00:00:5e:00:01:32 was not getting cleared until 5 minutes....

Solution:
So far only **clearing the mac-table** every time we recognize a fail over switch helps and the traffic continues immediately. 

Thanks for help!

**Comment by pqarmitage** [comment]
So it seems as though you need to replace your switch with one the behaves better!
